Kevin Love should just come off the bench for next game|Cavaliers|3
Damn is Reddit still broken |Bulls|6
yay reddit works again|[HOU] James Harden|4
FUCK. I JUST WANT A FREE TACO!|Spurs|6
im so tempted to go to a location and pretend that the away team won and see if the cashier is just like oh cool|Timberwolves|1
They get emails from their corporate office letting them know if it is on or not|Cavaliers|2
WELCOME TO THE EAST?!|NBA|2
DIDNT LOSE BY 31|Lakers|3
Kevin love died for this|Pacers|5
Is Lil Kev a voodoo doll, and is RJ syphoning his youth?||4
Find out next time on DRAGONBALL Z!!!||1
The warriors got punched in the fucking mouth and could'nt fully recover. Never gave up though. I expect them to come out hard from tip off Friday.||6
"Both teams will play hard." - Ecallaw Deeshar|[LAC] DeAndre Jordan|1
Noob question: Is plus/minus a legit stat?\n\nBarnes had 3 times the points of Green (6 vs. 18) plus more rebounds and less turnovers, in roughly the same amount of minutes played. Yet, Barnes\' (+/-) is 9 points lower than Green. Does this typically "even out" over the course of the year, or does this give insight into defensive effort that is not typically quantified, or both?||5
Raw +/- is not a legit stat.  When it's used in advanced analytics, it's run through a series of regressions to mostly account for different lineups, so you can mostly isolate a player's performance.  \n\nAnd even in that situation, you need a huge sample size in order to make it reliable, which usually means multiple seasons worth of data.\n\nSo the way it's being used right now - only 3 games of data and not accounting for team or opponent lineups - is not legit at all.|Pistons|3
Im not surprised Andy got booed lime he did. We the midwest, you play for the opposing Finals team, we aint cheering yo ass. Detroit booed Ben Wallace for christ sake|[DET] Ben Wallace|4
Who is expecting the Warriors to win? Since this is likely going to be a matter of home court advantage|Raptors|3
I don't know what to expect anymore. My life has gotten a whole lot busier recently so I haven't had time to watch the games and I've made my peace with the series, but it will be amazing if Cleveland pull this off.|Cavaliers|2
"Hey Kevin...do you mind if you can just bash your head on the wall for concussion test.."||5
I\'ve always wondered this, what on earth is the "+/-" column for?|Celtics|4
From what I have heard, it means that when the player was on the court, the team either outscored or **was** outscored by that number of points. |Spurs|3
This was the version of the Cavaliers that made me nervous. |Warriors|4
Then G1/2 and I got comfortable and then complacent. Series almost on!|Warriors|1
I wasn't happy with the way the Warriors played today. There was absolutely no effort boxing out or going for the rebounds with both hands. This led to getting crushed on the boards, which does absolutely no favors, especially when the Cavaliers were shooting lights-out in three of four quarters. Also, Klay, Dray, and Steph began to do the tunnel vision thing when they were down and not hitting shots, which led to turnovers. So we start being down on FG%, rebounds, and turnovers. \n\nWe got ourselves stuck in corners, we either rushed the shot or got stuck with a low shot clock, and players were slow to get back even if they hadn't tried to get the rebound. It was super weird.|Warriors|5
Where is curry? 2nd year in a row he's struggling in the Finals. I'd give him a pass for the first 2 games but 3 games in a row? Inexcusable. Where's the guy who scored 17pts in OT? He only scored 2pts in the 1st half? Credit to Cavs D I'm sure but come on...|Lakers|5
I have huge respect for R. Jefferson, guy is a real baller and deserves a lot of credit. |Nets|4
someone on the cavs needs to "accidentally" extend kevin love\'s concussion protocol, like bump into him or something.|Raptors|11
http://imgur.com/VT9O1HE|Cavaliers Bandwagon|7
man klove bout to get straight up jon snow'd by lebron and kyrie in the locker room before game 4|Cavaliers|7
forrrrr theeee landdddddddd|[CLE] Mark Price|2
For the Ring!||1
oh that's pretty damn good|[CLE] Mark Price|1
How is Klay gonna call someone else dirty when you got donkey ass mofka on your side|NBA|5
The Cavs played a great game but is no one going to talk about that Cleveland crowd?\n\nThe place was going to blow the roof off in the first quarter. You could tell the entire team fed off of the crowd's energy.|Lakers|7
My section stood for the entire game it was fucking hype |Cavaliers|3
Shit. How much did that cost you? Been wanting to go to a Finals game myself.\n\nAre you not going to eat for a week or something?|Lakers|1
My buddy got terrible seats after game 2, and they were $215. That's as cheap as it got, but it was the best money he's ever spent.||1
Were they standing rooms or just all the way up top-seats? The United Center as standing rooms that are cheap. But if I have to *stand* forget it, I'll just go to the bar and watch it with some friends.\n\nI'd spend $215 on seats that are up at the top but not standing room. $215 is cheap for a finals game if you get an actual seat for it.|Lakers|1
It was an actual seat up at the top, but I don't think anyone was sitting.||1
Ah then he got a **great** deal for those tickets. \n\nHad a buddy spend 300+ on standing room tickets for a Bulls-Heat playoff game (when LBJ was still there). He said it got so crowded he had to stand in the back and ended up watching it on a monitor.|Lakers|1
Got three tickets before game one, so they were more expensive too. After taxes and fees with flash seats they were 1650 a ticket. Mid court, club seats on the second floor. Worth it when we win ;) |Cavaliers|2
FUCK DRAYMOND GREEN|[HOU] James Harden|20
No matter what, Golden State will be doing a heel turn next season. We'll probably see stories about how Green is clashing with Klay, and how Curry wants to have a private locker room. It's just basic marketing.|[LAC] DeAndre Jordan|1
I respect his athleticism, but man that guy seems like a douche bag...||1
gentlemen we have a series|Cavaliers|10
Let's fucking hope so. Three blowouts was actually a lot less fun to watch. I really really wouldn't mind at all if there was a close game and Cavs win by single digits in game 4. \n\n6 games minimum, and 7 games is always ideal. I can't really deal with life when there's no NBA. I have to like work and shit. It's awful. |Lakers|2
So K Love just needs to not play?|Suns|4
Join me in prayer for Kevin Love's health|Warriors|7
Our father, Lord in Oakland, Curry be thy name. Thy finals come, thy will be won, in paint as it is from three. Give us this day our daily bread, and forgive us for missed shots, as we forgive those that shoot against us. And lead us not into Jefferson, but deliver us Kevin Love. For thine is the Oracle, the Assassin, and the Warrior. For ever and ever. Amen. |[ATL] Kent Bazemore|1
Is it...is it safe to come back to r/nba again? |Cavaliers|5
My name is LeBron Raymone James, commander of the Cleveland Cavaliers, General of The Land, loyal servant to the true emperor, Ty Lue. Father to a murdered team, husband to a murdered dream. And I will have my vengeance, in this life or the next.\n\n\n||6
**ALL ABOARD THE CLEVELAND HYPE TRAIN**\n\n**CAVS IN 6**\n\n**LOVE OUT, LIGHT SKINNED LEONIDAS IN**\n\n**JR LAYING THE PIPE AGAIN AFTER PREVIOUS DYSFUNCTION**\n\n**LUE IS FINALLY REVVING UP THE FRYERS**\n\n**EAST CONFIRMED BETTER THAN WEST**\n||8
i just want a free taco bell taco :(|76ers|3
Great show from the Cavs. GS looked like they did game 3 against OKC tonight.\n\nWith that said, the only thing sadder than Cleveland feeling entitled to a professional sports championship is the brief glimpse of hope this game gives their fans.  I know it's very un r/nba of me to look past this 3 hours, but GSW is gonna take this in 5.|Timberwolves|3
Cavs fans last year complained that Love wasn't healthy for the Finals, but it seems now they want him benched for the rest of the series lol. |Bulls|3
I think missing Kyrie was the main complaint. ||1
eh true, but still would have been mentioned even if they had Kyrie i feel |Bulls|1
Good win Cavs, solid beat down |Warriors|3
I remember I thread earlier a guy had like 30 upvotes saying LeBron isn't even a top 10 player of all time. Lmao.|[MIA] Shaquille O'Neal|3
r/nba is a lot like regular life.  There's a lot of people who just say things because there is no law against being stupid.||2
2k should nerf this fucking homecourt advantage bs|Raptors|3
So what's been the deal witch curry and klay disappearing for long stretches during this postseason|Raptors|3
I think the LA kings still have a solid chance |Warriors|3
When Andre Iguodala didn't start a single game all season and started the last three in the finals he won the Finals MVP\n\nRichard Jefferson for Finals MVP 2k16 you heard it here first ||3
Bring him off the bench.||3
[MRW Klay, Dray and the bench haven't bailed out my team so I can take over in the fourth](http://i.imgur.com/WlrYBQp.png)|[CLE] LeBron James|8
What's up with Reddit right now|Rockets|5
Congrats guys! We broke Reddit!|Lakers|1
Fuck you Richard Jefferson how are you about to dunk a bunch of contested offensive rebounds when you couldn't even make an open layup three years ago |[GSW] Vonteego Cummings|5
HGH MOTHA FUCKAAAAA|[GSW] Klay Thompson|1
Whelp time for /r/nba to change its narrative and say Irving is a beast PG and Lebron is GOAT while the Warriors are overrated or something.\n\n\n\n|Lakers|7
I think it mostly is that fans of a team come out in victories and hide in defeats|[CLE] Mark Price|1
**NO UP VOTES THIS WHOLE THREAD? MUST HAVE DISAPPEARED LIKE CURRY TONIGHT**|Raptors|5
And let that be a lesson to you all. Nobody beats the cavs 8 times in a row.|Cavaliers|4
Can someone tell me why Shump looks like he told his barber to JUST||5
Even if the Warriors win, I don't know if you can call this team better than the 96 Bulls. The Bulls lost 3 games in the entire playoffs, with score differences of 3, 21, 11. The Warriors have had a few really terrible games this postseason. |Bulls|6
Yeah, pretty clear the Bulls were better. GS still top 3 tho, which is insane||1
We got LeBroned so fuckin hard.|Warriors|2
Warriors threw the game so they can win the championship at home in 5. ||4
These have been the most boring playoffs in a long time. Too many blowouts.|Clippers|4
Lebron guarding Dray exclusively was huge chess move tonight, that no one is talking about. Totally took him out of the game.||3
Kevin love post game text to lebron: "Hey big head, cant wait to be back in game 4"  \n\nLebron: *ignores* |Hawks|3
"New phone. Who dis?"|NBA|3
[curry still thinking about whats back at home](http://i.imgur.com/kZDkJcIl.jpg)|Lakers|5
We'll take the next two. *chews mouthpiece||4
"Rips mouthpiece out, and proceeds to throw it off a building" there all better |Cavaliers|1
As a bww employee, there's nothing like salty warriors fans (well except patriots fans)||3
Im taking bets on how long Kevin Love stays on the concussion protocol. O/U 2 Games|Clippers|2
Adam Silver was there for one reason only. To keep Kevin Love in concussion protocol.|Knicks|1
Thank you for giving us a series!|[WAS] Michael Ruffin|2
Kevin Love GSW sleeper agent confirmed|Heat|2
PRAISE LUE THE GOD WITH FOR WIN|Raptors|2
Well, shit. I guess these *are* the real finals.|Warriors Bandwagon|2
west is weak.|Spurs|2
What is with these playoffs and blowouts? |Nuggets|2
It's the nature of the new N3A. Blowouts are easy to come by.|Pistons|1
put them brooms away |[CLE] Kyrie Irving|2
This thread is a couple of hours late |Rockets|2
I fully expect the Warriors to come out guns blazing for game 4 and blow out the Cavs.|76ers|2
I did not enjoy the outcome of this game.|Warriors|2
Well at least Golden State will win the series at home!||2
Cavs in 4|Cavaliers|2
fuck steph curry fuck steph curry||2
What a fucking game|[NYK] Kristaps Porzingis|2
What is wrong with this sub it's acting crazy buggy |[CHA] Kemba Walker|2
Massive defensive improvement from the Cavs, but the Warriors missed a lot of shots you'd expect them to make|Kings|2
**1)** Cavs starters need some bench help\n\n**2)** Love should be 6th man this series\n\n**3)** JVG was funny with the hell-freezing-over-before-Draymond-gets-that-last-flagrant-or-last-two-techs-comment\n\n**4)** Steph shouldn't be in MJ or Lebron talks (if that's his trajectory) if he can't step up in the Finals.  Someone might argue that he doesn't need to but....that's not what's happening here.\n\n**5)** Harry kind of dominated Channing Frye in that matchup\n\n**6)** J.R. was good...very good.\n\n**7)** Richard Jefferson can dunk (JK, he'd get mad at that comment based on his Snapchat...which I love)\n\n**8)** Lebron 1 AST away from a Lebron\n\n**9)** I wish Harrison Barnes was on the Bulls\n\n**10)** Iman Shumpert is as good as his hair (not good)\n\n**11)** That game was a murder|Bulls|2
No comments are showing so no one will know I'm excited for the new Ghostbusters |NBA|2
Do you need help? We're here for you |Bulls|1
bruh|Raptors|1
we found him|Rockets|1
Vintage LeBron dad dicking if I've ever seen one|[CHA] Kemba Walker|2
Needed to study for final exams anyways. Anyone know how to learn an entire differential equations course in 18 hours?|Warriors|2
#We didnt lose by 30...........1+!|[GSW] Andre Iguodala|2
Completely off-topic: I just realized Klay Thompson looks like a young Fidel Castro.|Knicks|2
My favorite "Play looks like" came from the Dan Lebatard radii show. The said he looks like an unfinished police sketch. Lol||1
The cavs seemed to just attack curry tonight. Kept switching until curry was the on ball defender or involved in the screen. Really seemed to hurt his confidence getting abused like that|[CLE] Kyrie Irving|2
Now that the clock hit 0:00, I can relax.  No lead feels safe against GSW.|Cavaliers|2
Where are all the comments?|Spurs|2
GAME 3: THE PIPEMAN RETURNS|Timberwolves|2
What do I upvote none of these comments have points?!?|[MIA] Dwyane Wade|2
I will get my free taco, Taco Bell. I swear on it. You guys aren't getting off the hook. ||2
Kevin Love died for this|Kings|2
Is something wrong with Reddit?||2
So many blowouts.   Playoffs kinda shit this year. |Celtics|2
Love needs to go ahead and get another concussion, also lebron shooting jumpers again is a good sign. |[DAL] Dirk Nowitzki|2
LeBron going to make sure Love stays concussed |Warriors|2
Dont call it a comeback!|Suns|2
Surprised at how good the role players were tonight. Thompson with 10 points and 13 rebounds and 5/6 fg. Jefferson too, great game|San Diego Clippers|2
Give us a 7 game series King James!|Raptors|2
Now that's the J.R Smith that gives me that sense of dread watching.|Warriors|2
Do you guys love should start next game? Assuming he will be cleared to play? Or would you go with the same team to carry the momentum carried with this win. ||2
LeBron was 1 assist off from a LeBron (27/7/7), I feel like he's always off by 1 stat. \n\nStill, he absolutely dominated tonight. He was aggressive from start to finish. He couldn't finish well in the 2nd quarter but he didn't let that stop him from shooting, they need him to do that.|Raptors|2
so happy....not getting swept!  we have a chance!  & it's my birthday... thanks for showing up cavs...& thanks for that concussion blow, barnes. best bday present.|Cavaliers|2
happy birthday!|[HOU] James Harden|2
thanks!|Cavaliers|2
Wait I thought the series was over already?|[NYK] Walt Frazier|2
Lebron was a beast |[SAS] Kawhi Leonard|2
Can't wait for all the posts tomorrow saying that Curry is a scrub and Cavs are going to take it in 6|Cavaliers|2
Ma gawd we got ourselves a series again|Grizzlies|2
Kevin crying himself to sleep watching old Game of Thrones eps rn. Dreaming of Khaleesi holding his head.|Trail Blazers|2
dat home court doe|Wizards|2
Hoist it!!!!!!!!!||2
Holy fuck this sub went to shit so fast. Some dude actually asked if Curry should get a ring if GSW wins. Thank god for mods.  \n\n|Lakers|2
He hasnt played very well. Definitely not MVP caliber. That bogus play when he hooked LeBrons arm on the way down the floor and flopped is everything thats wrong with the game of basketball. Despicable. If LeBron had a game like that or pulled that shit he'd be crucified.\n\n\nThat being said. He has a huge part in getting the Warriors there, super deserving of a ring.\n|Suns|4
Cavs in 5|Bulls|2
Dubs didn't want to win another title on the road anyway.|Bullets|2
I don't even wanna see Love in uniform next game|[IND] Paul George|2
[Fuck Steph Curry!](https://www.youtube.com/watch?v=M3pZl8EVQ9w)|Celtics|2
This post game thread dead..wtf where the memes at?|Thunder|2
did the guy who said Frye would get 15 points tonight eat his shirt yet?|Timberwolves|2
Better than the 01 lakers though|Lakers|2
Curry and Klay needs to wake the fuck up if they want to win this series. You can't rely on your bench to win you 4 games in a playoffs series. Bench won Game 1, Dray won Game 2. Time for the Splash Bros. to get GSW the 3rd and 4th wins in this series.\n\n\n\nOh, and Lebron looked angry and motivated tonight like a 2012-2013 Lebron. \n\n||2
Today's performance was vintage James also the help around him. Came up big with the likes of Jefferson and Thompson. Helping the defence was incredible! special mention goes to JR smith. PS: Wish THAT half court shot counted! :)||2
I expect Bogut to play less than 10 minues next game. ||2
Welp. Warriors got thumped. Not much else to say. Even during the stretches when their offense looked *okay* the Cavs offense just looked better and defensively the Warriors were pretty much a step behind all night. \n\nCertainly makes it a more interesting series. I still think the Warriors win it, but they certainly didn't put together a convincing argument tonight. Curry's gotta get going soon though. The scrutiny train has left the LBJ platform and is barreling its way to Wardell's place if he can't put together an MVP performance soon, then we'll definitely have a series on our hands. ||2
Bring love in off the bench, it's gotta be done|Pacers|2
'GOAT' teams cant be considered that if they are blown the fuck out so many times|Lakers|2
Honestly, just hoping for close games... These blowouts from either side just aren't satisfying.||2
This playoffs can be summarized, with the exception of gs and OKC, by one team coming to play and the other coming to collect checks. ||2
My favourite part of the home crowd so much.||2
On some folks suggestion I'll post an amended and updated version in the cavs. never did it on the heat. that's interesting..||2
Hahahahahahaha see r/nba? This series ain't over. ||2
Cavs bench need to step up. |Clippers|2
Don't even bother playing Kevin love. He sucks.|Rockets|2
I don't understand what's with all the kevin love hate? He clearly isn't good vs the Warriors match-up. But not all teams are like the Warriors, they are definitely 1 of a kind. He was still a huge factor in the East Playoffs, spacing the floor, hitting open shots while helping the team cruise in the EC. I'd say he can come off the bench on Friday and help the team when the death lineup is resting. Cavs fans should not give up on the big fella easily and should give him credit where credit is due. SMH|Cavaliers|2
Lebron with 232 points...mama there goes that man|Heat|2
Holy shit. My mom came into my room to bring me a plate of chicken nuggets and I literally screamed at her and hit the plate of chicken nuggets out of her hand. She started yelling and swearing at me and I slammed the door on her. I'm so distressed right now I don't know what to do. I didn't mean to do that to my mom but I'm literally in shock from the results tonight. I feel like I'm going to explode. Why the fucking fuck are they losing? This can't be happening. I'm having a fucking breakdown. I don't want to believe the world is so corrupt. I want a future to believe in. I want the Dubs to go back to back. I cannot fucking deal with this right now. It wasn't supposed to be like this, I thought they were supposed to sweep??? This is so fucked.|Spurs|10
You wasted perfectly good chicken nuggers|Cavaliers Bandwagon|1
Haha, you are an spoiled fan! This is basketball, and it is about winning and losing! Be patient :)||1
Is this a meme? Otherwise you might need some help bro|Bucks|1
Its an edited copypasta about Bernie Sanders being a serial loser|Braves|2
Thanks lol need to find it|Bucks|1
Lol I'm a huge basketball fan but damn man, don't disrespect your mom like that. Better apologize for that nonsense|Cavaliers|3
its a copypasta |Knicks|2
It's a copy paste about Bernie Sanders losing|[PHO] Steve Nash|9
No thread is safe|Thunder|2
#StopNuggetAbuse||2
gr8 b8 m8 i r8 8/8||4
2 l8|Timberwolves|1
What just happened lol ||6
[pls come back Friday](http://i.imgur.com/ZyxfJrf.jpg)|Cavaliers|4
Sure :) ||1
I\'ve always said, most respect in the land goes to you all, raptors fans. The standing ovation that team got at home the game they lost the series made me tear up. You know more than most we in Cleveland can respect but breaking a "dry spell" and making the playoffs for y\'all was a big deal. God bless you, and God bless Cleveland. Sorry for the emotional r reply, I\'m a 5th of whiskey deep and I love my city .|Cavaliers|1
Thanks man, I appreciate it. Best of luck Friday. ||1
It would be real nice if there was a close game in the finals at some point. I don't care who wins, just give me a game I can watch in the 4th quarter.|Generals|3
http://m.imgur.com/Hvg5Yw7|Cavaliers|3
can we please stop with the kevin love undefeated stuff |[CLE] Kyrie Irving|4
b-but muh warriors were gonna 4-0 them||3
I'm all about having fun in game threads but they are killing Reddit. And it's literally thousands of shit posts and comments that are only relevant if you're watching at that moment. They need to split it by quarter or something to ease the load so the site doesn't crash. |Warriors|3
Lol I'm loving Chuck right now. He is going in on Draymond. Say's he is a dirty player. |Knicks|2
The fix is in #doritolocos|Cavaliers Bandwagon|2
kevin love is still undefeated in the playoffs in cleveland.|Cavaliers|3
Hi r/nba, I'm from r/all and I don't really follow basketball, but how can you lose a basketball game by 30 points?||3
[deleted]||-4
Lol|[NYK] Carmelo Anthony|1
oh, that makes sense. Thanks r/nba!||7
Yeah I'm a gsw fan but we really suck. We got here by luck, great run though. I'm happy with my team!! |Warriors Bandwagon|1
Over when it started|Rockets|5
Warriors never had the lead. |[GSW] Leandro Barbosa|2
Suck on that /r/NBA ...can\'t wait to make a best "cavs suck" montage of comments over the last few days |Cavaliers|3
In true Cleveland fashion, most of those comments will be from Cavs fans.|Pistons|-1
We have been shit on by every body for the past week...we are allowed to say whatever we want right now |Cavaliers|-1
Oh, I\'ve got no problem with that.  I\'m just saying ya\'ll self-deprecating motherfuckers have been sayings "Cavs suck" as much as anyone. :P\n\nIt\'s like Lions fans.|Pistons|1
I'd wait until you win more than just a home game bro|Lakers|3
Holy crap this series is unwatchable. How many blow outs will we have?|Heat|3
So... No good games this series?|[UTA] John Stockton|4
worst unanimous mvp ever|Bucks|2
shitpost or stupid overreact|[NYK] Jamal Crawford|1
more of a joke really|Bucks|2
It's not a very good one. Work on your material.|Cavaliers|0
hes the only unanimous mvp, so by definition there is no comparison. how can you say hes the worst? you cant say hes the best either. another salty bandwagoner. go cry into your brand new curry jersey\n\nedit: i see youre a cavs fan, go fish out your burned lebron jersey from the trash that you threw away already. theres still at least 2 more games |Bucks|2
Life long Cavs fan, never burned a jersey. Man, I just thought your joke wasn't that good.|Cavaliers|0
my joke was hilarious. you have no sense of humor |Bucks|1
Not enough dicks and farts for my unrefined tastes.|Cavaliers|1
[deleted]||4
HA!|Cavaliers|5
That was some of the best defense I\xe2\x80\x99ve seen against GSW all playoffs, holy shit.|Cavaliers Bandwagon|2
Honestly can't believe some said the Warriors were gonna sweep after the first two games. It should be no surprise this Cavs team was gonna come back to Cleveland with a vengeance.|[MIA] Dwyane Wade|2
Homecourt "Literally Steroids" Advantage|Raptors|2
/r/nba overreacts more than any other sub I've seen.*\n\n\n\nOnly other sub I visit is /r/nfl\n\n\n\n|NBA|2
Suuuuuuuuck it Haters!|Cavaliers|2
KERR EXPOSED AS WORST COACH\n\n\nloool I fucking love /r/nba after games. Shit is so exciting reading all the different views, especially since I don't have a horse in the race.|[MIA] Voshon Lenard|2
People are so damn reactionary. OKC series, this series in multiple ways, etc. Its like nobodies watched basketball before. Youre kinda expected to win at home. Doing so in a dominant fashion like GSW helps give credence to them winning the series but why is anyone surprised by a dominant game 3 performance by the cavs. It happens all the time after a solid first two games by the home team. We wont really get an idea how this series will go until after the next game where we see if GSW can respond or the Cavs keep the pedal down. |Bulls|2
Yeah but can you remember a series that's been as bipolar as this finals and the conference finals have been?\n\nI know we've seen occasionally huge blowouts, like the Heat in 2012, but it seems like this playoffs have been 90% blowouts and that's abnormal.  |Pistons|2
True its definitely an odd series. |Bulls|1
i agree with you..particularly about the next game. but honestly dude, those first 2 blowouts had lots of cavs fans terrified & demoralized. not surprised cavs won, but surprised they were so dominant tonight.|Cavaliers|3
