It's true, their media narratives couldn't be more different.\n\nCurry: small college, undersized, injury plagued, wasn't sure if he could be anything more than a spot-up shooter in the NBA. Any accomplishments he gets just add to the feel-good story. He's *really good* and that's what people have come to expect, but that's about it. He's the star on the best team in NBA history that's shown they can win when he underperforms.\n\nLebron: touted out of high school as the next Kobe or even Jordan. Athletically out of this world, guaranteed #1 pick, poised to be the face of the league for years to come. Greatness was always something that people expected of him, and people's expectations due to his image is that *he's supposed to be legendary*. If he underperforms, especially in Cleveland, no one is really gonna pick up his slack. Thus, expectations are and have been crazy high since Lebron left to Miami to start competing for championships.|Kings|12
I hate to bring it up, but the Dubs are not the best team in history.||6
I agree, but I think his point was just the narrative is that this Dubs team was the greatest team.|Heat|3
Honestly I think it's because the expectations are always too high with LBJ. If Curry never wins a title again no one will give a shit in 5 years.\n\n|Lakers|6
Lebron kind of made his expectations as high as they are. |Celtics|1
It's cause he's so gosh-darn cute. |Cavaliers Bandwagon|74
Curry look liked a light skinned Malcolm X with no glasses.||1
Um, Malcolm X was light skinned. |Spurs|1
 https://twitter.com/GQMANOFTHEYEAR_/status/689295015022080000?s=09|Warriors|1
And just so *relatable*.  Real underdog story|Celtics|9
Seriously, who wouldn't love to have him bent over an ottoman while a gentle rain can be heard through the open windows?|[LAC] DeAndre Jordan|12
ie not *black* black||20
#LeBron James has a bigger dick than Curry|[BOS] Paul Pierce|83
Or is it: https://s-media-cache-ak0.pinimg.com/736x/1f/87/2e/1f872ebba8c344c12cfa20ba0f685edd.jpg |[OKC] Steven Adams|-6
Damn, I did not know that kd was THAT tatted up|[GSW] Stephen Curry|1
BIGger IF TRUE!|Cavaliers|2
**THE CLEVELAND CAVALIERS WIN GAME 3 OF THE NBA FINALS WITH THE BIGGEST POINT DIFFERENTIAL AFTER LOSING BY A COMBINED 48 POINTS IN THE FIRST TWO GAMES OF THE NBA FINALS.**||17
Death, taxes, and Lebron completely hatefucking your team |NBA|35
[Kevin Love after tonights game prolly like](https://az616578.vo.msecnd.net/files/2016/02/10/635907362310656644-1074372563_tumblr_inline_nzb6a3hkJG1rp5ay0_500.gif)\n\n[Steve Kerr/Warriors fans the entire game](https://turnernbaallball.files.wordpress.com/2015/06/kerrfan.gif?w=599&h=337)\n\n[Iman Shumpert out here looking like this hat](http://i00.i.aliimg.com/img/pb/604/024/577/577024604_647.jpg)\n\n[Cavs fans in the stadium all night](https://i.imgur.com/iLmnQj7.gifv)|Wizards|324
[deleted]||-2
idk I lost it at the hat one. He probably should have stopped there. |[DAL] Rodrigue Beaubois|7
The hat one was the best by far. |[BOS] Isaiah Thomas|1
Just a collection of some of the ones I posted during the gamethread. Sorry you are not amused|Wizards|5
[I thought Shump looked like the little boy from Emperor's New Groove](http://vignette1.wikia.nocookie.net/parody/images/3/3c/Tipo.jpg/revision/latest?cb=20150131000850)|[HOU] Luther Head|2
Pacha's wife is such a babe. |Pistons|1
I seriously love that last gif |[CHA] Kemba Walker|2
lmao.|Cavaliers|4
Lmao how that dog know how to dance better than me|Warriors|34
Someone pointed out that he probably has a rash because he's scratching his butt against the wall. I had a dog who was the same it was a nasty rash on his ass :( |Celtics|4
Stop ruining my dreams||5
Seriously [what the fuck Shumpert?](http://i.cdn.turner.com/nba/nba/dam/assets/150531172346-20150531-cle-sound-shumpert-00015010.1200x672.jpg)|Pelicans|79
his hair was getting in his face game 2. Looks like it was purely a game decision to not affect his play and not a fashion statement.||1
Is that like the black man version of the man bun ? Lol|Cavaliers|1
Better than whatever he was doing with it the game before||1
He saw the reddit post about hair affecting the shot and he didn't want to cut it||1
He must've seen the earlier post on /r/nba about hair getting in the way of your form.|Grizzlies|2
**BRING BACK THE HIGH TOP FADE**|[MIN] Andrew Wiggins|2
He read the article on /r/nba about tall hair getting in the way of your shot.|Cavaliers|3
Gotta stay relevant. |Knicks|3
[Iman "Pebbles Flintstone" Shumpert](http://imgur.com/alics9T)|Kings|5
He saw the video showing how hair could affect people's shots.  So he tied his hair up and made sure Curry got a good luck at it, he jiggled it everytime Curtty touched the ball.  That split second slowdown from his chuckle threw him off.||12
Black Shumurai|Vancouver Grizzlies|19
lol @ Shumpert|Cavaliers Bandwagon|42
I thought he had the Antonio brown look going at first lol, was disappointed |[DEN] Emmanuel Mudiay|2
I like that dog|Nets|49
I've seen this before and I'm still cracking up, its one of those *gets funnier as you watch* gifs. Those are the best.|Thunder|3
It's my favorite thing on the internet, no hyperbole.|Spurs|1
Tristan EIGHTY TWO FUCKING MILLION Thompson\n\n14 PTS (5/6FG)\n\n13 REB - 7 OFFENSIVE REBOUNDS|Raptors|55
At one point he had made more free throws on less attempts than all of the Warriors combined.||1
more made free throws? |Suns|1
Kevin ONE HUNDRED AND TEN MILLION Love\n\n0 PTS (0/0FG)\n\n0 REB - 0 OFFENSIVE REBOUNDS|NBA|8
How many FUCKING MILLIONS does that convert to? ||1
but 0 TO!|[MIN] Kevin Garnett|2
this entire play offs he literally has more offensive rebounds than defensive rebounds.  this dude is something else.  he makes them pay when green cheats over to help contest a shot in the paint.|Bulls|40
He bails out so many of our awful possessions. Allows kyrie, LeBron, jr, and the rest take iffy shots or drive into double teams, even if they miss TT has a good shot at cleaning it up||2
Golden State can\xe2\x80\x99t win Game 3s, Cleveland\xe2\x80\x99s first bench points was a Shumpert 3 in the fourth quarter, and they win by 30. Half-Life 3 confirmed. |[POR] Allen Crabbe|43
I expected the Warriors to lose this game but not like this. Cavs looked like the Warriors did in game 2.|Lakers|16
It's been a while since LeBron has dad-dicked a game like that, fun to watch.|Raptors|78
...dad-dicked?|Bulls|4
When an older, more experienced player shows up a younger inexperienced player with his greater skill.\n\nLike playing a game against your dad when you were 12, most of the times he'd obliterate you to teach you a lesson. \n\nThat is what Lebron did tonight.|Cavaliers|8
Oh okay. I'd never heard that phrase before and it sounded weird haha\n\nAlso, thank God I've never been worse than my dad at basketball\n\nLiterally\n\nThe entirety of my life \n\nNever was worse\n\nI came out of the womb and crossed him over|Bulls|9
    It's been a while since \n    LeBron has dad-dicked a game \n    like that, fun to watch.||2
I just woke up my girlfriend laughing at this comment.  Well said.  |Trail Blazers|7
So.... sit out kevin love Friday?|Timberwolves|41
And the rest of the series.|Warriors|1
Bring him off the bench and treat him as a 1st option with the 2nd unit. They definitely need points off the bench. |Supersonics|37
I agree.  You know people are gonna circle jerk about how the Cavs are better without him, but they should really try to not have him and Kyrie on the court together.  Love is a huge asset to this team against 28 NBA teams, but he makes the Cavs match up horribly with the Warriors, especially when Kyrie is in.|Cavaliers|1
http://i.imgur.com/to2lZZQ.png|Cavaliers|37
Sauce Por favor |[CLE] Sergey Karasev|1
trainwreck|Cavaliers|1
Curry's dinner https://imgur.com/WSDl6U0|Cavaliers|369
Need a better effort on the shop. |Warriors|-2
Did she use salt?|Cavaliers|8
Damn why u gotta bring Ayesha into this lmao|[CHI] Scottie Pippen|38
People sometimes ask how you'd like to die, and I wish to drown in crying Jordan memes|Supersonics|24
http://i.imgur.com/mJ86tBi.jpg|[OKC] Nick Collison|258
Goddamn yall gonna kill me fam|Rockets|1
wat|Warriors|1
It's a picture of Steve Kerr.  Sometimes those live actions shots make a person look a little funny.  Kind of like Beyonce.\n||1
Completely agree|Thunder|2
Stove Korr?|NBA|5
Hey I made that!! |Cavaliers|180
http://i.imgur.com/TnQRX6v.gif|NBA|1
http://giphy.com/gifs/why-bradley-cooper-not-E7yX6ZvDlYmEE|Cavaliers|2
You made this? \n\nI made this. |Clippers|2
no no no i made that for realz|Cavaliers|2
You made that?\n\n...\n\nI made that|Lakers|3
Haha I really made that though... |Cavaliers|1
Holy shit, you really did. Well I'm a big fan of your work, sir.|[OKC] Nick Collison|103
Thanks! I made a steph curry one today, but it wasn't as good. Share that pic with your children and their children. Never forget |Cavaliers|64
I will never forget, and will always tell my heirs the story of /u/louievettel and his master work.|[OKC] Nick Collison|20
My wife just said she is a Cavaliers fan because "Curry didn\'t perform how he should"... Ultimate bandwagoner |Lakers|39
Divorce her|Bucks|9
You should divorce her.||5
That's what happens when you watch LeBron dad-dick Curry the whole game. |Cavaliers|8
Shout out to Kevin Love for helping the Cavs win by not playing today|Spurs|87
I sincerely don't understand this: why wouldn't Love be good to have coming off the bench to keep things going when starters are resting? Sort of like what made Harden so effective when he was on the Thunder. ||-1
Rekt||2
I hope it goes 2-2.   We dont want a sweep, we want a challenge.|Warriors|36
You know it's all about getting one for the land|Cavaliers|3
You guys weren't swept, what are you talking about :) ||2
Nah I'd be just fine going up 3-1|Warriors|11
[MRW people really thought LeBron would get swept](http://i.imgur.com/Q7iUrO9.jpg)|Heat|82
lmao Lebron has lost in the finals in 4 and 5 games. Not exactly a low percentage occurrence. |Bulls|-19
How many finals have the Bulls been to in the last decade? |Cavaliers|9
[Dayum](http://imgur.com/gallery/7lZwLKc)||6
5 isn't a sweep|Cavaliers|17
God Cage is such a beast|Supersonics|2
I AM HERE TO OVERREACT AND DECLARE THAT KEVIN LOVE SUCKS, CAVS ARE BETTER WITHOUT KEVIN LOVE, AND STEPH CURRY IS STILL HURT!|Lakers|22
At this rate, we'll never get the free taco from Taco Bell|Bullets|11
You win comments, lol.||1
I can't believe Klay blamed Mozgov for the screen and called it dirty when if you glance at the replay you can clearly see Harrison didn't even try to call it out. Barnes owes Klay dinner and a thigh massage.|Vancouver Grizzlies|31
And in a league full of moving screens, that wasn't that bad of one anyway. Hard, yes, but just barely shy of him being set. Klay just ran into a Russian wall||5
Yeah that was nothing more than a moving screen foul.  Just happens that his knee is as high as Klays waist |Supersonics|4
Suck my ass /r/nba|[CLE] Matthew Dellavedova|140
No that's weird|Supersonics|-2
Yes, I'm here for some sweet and juicy outback Jesus ass please...|Trail Blazers|1
That's weird last I saw /r/nba was rooting for you guys|Warriors|2
Tonight /r/NBA can suck *all* of our asses.|Cavaliers|2
GOAT flair too|[CLE] Mark Price|5
Too bad the Cavs were terrible during that era|Cavaliers|1
The Dellavadova era?|[CLE] Mark Price|2
If you're an mvp you can not go fucking scoreless for practically an entire half. That's inexcusable. |Knicks|18
And the Dub Nation saying that MJ, Pip, or Harper can't stop Curry. Or even hold him below 20. LOL.||4
And the Dub Nation saying that MJ, Pip, or Harper can't stop Curry. Or even hold him below 20. LOL.||6
They couldn't consistently stop him. No defender in the world can consistently stop an MVP. Curry could literally average 100 ppg on 100% shooting and you would find a way to jerk off MJ|Knicks|-5
Let Curry do it first before spouting non-sense. Curry even had problems against Delly last year and other good defenders this year. He'll get his points against Pip or MJ, but not the way he's doing in this season. LOL||0
And the Dub Nation saying that MJ, Pip, or Harper can't stop Curry. Or even hold him below 20. LOL.||7
And the Dub Nation saying that MJ, Pip, or Harper can't stop Curry. Or even hold him below 20. LOL.||11
Kevin Love is gone.|Suns|32
Cut him, max out Jefferson this summer|[DEN] Emmanuel Mudiay|8
[deleted]||72
He looks older than Curry|[NYK] Walt Frazier|2
Needs Jordan face |[LAC] Blake Griffin|20
[Here is my extremely shitty attempt.](http://i.imgur.com/4h5kZZV.jpg)|[OKC] Nick Collison|10
lmao it's perfect |[LAC] Blake Griffin|8
He played? Looked to me like he just missed shots and chewed on his mouth guard.|Cavaliers|70
He must get a new one every game because he goes to town on those motherfuckers |Hawks|4
when you dont show up to play and still lead the team in scoring|Cavaliers Bandwagon|6
Those points were in 3rd quarter blowout garbage time. They needed them in the first|[DET] Richard Hamilton|3
That says more about how garbage GS was today than Steph lol|Knicks|3
Says a lot about how the rest of the team played|Cavaliers|9
THIS WIN IS FOR ALL THE EASTERN CONFERENCE HATERS, WHO PRE-MATURELY SHIT ON OUR CONFERENCE EVERY YEAR. THANK YOU CAVS, WE STILL STANDING.|Wizards|17
I don't want to overreact but Cavs in 4.|Pacers|9
##didntgetswept|Cavaliers|11
[The Cavs when people said it was over](https://imgflip.com/i/15jdrp)|Knicks|38
**I'm just here to overreact**|Heat|17
Ok so say you'll eat your shirt over something||2
Cavs in 6.|[OKC] Nick Collison|39
**WWWWWWWWWWWWWWWWWWWWWWWWLWWWWWLWWWWWWWLWLWWWWWWWWWWWLWWWWWWWLWWWWWWWLWWWWWWLWLWWWW-WWLWW-WWLWW-LWLLWWW-WWL**ARRIORS!\n\n:(|Warriors|118
Warriors fans crying into their Royals jerseys re-watching their Broncos win the Super Bowl wondering if they'll be penguins or sharks fans this time next week. |Cavaliers Bandwagon|-1
Wait we fucking hate all those teams mainly the Broncos fuck them. I would probably stab any warriors fan that likes the Broncos. |[GSW] Tim Hardaway|3
And again for 3 more games.|Trail Blazers|1
:( :( |Warriors|1
We the Larriors once again|Warriors Bandwagon|11
Your username confuses me.|Warriors|14
I don't see much to be confused about.|New Jersey Nets|1
Love the accuracy.|Cavaliers|20
I mean is anyone really checking it? I know I'm not |[WAS] John Wall|1
I'm sure he has just saved it every game and just updates it. |[GSW] Tim Hardaway|1
But he could be wrong and we'd never know. Maybe he makes one of the Ls in the wrong place just because?|[WAS] John Wall|1
Not on the free throws and threes I don't ||1
*Lol-den Hate L-arriors*\n\n\n&nbsp;  \n&nbsp;\n^^^^please ^^^^come ^^^^back ^^^^game ^^^^4||4
Fuck you reddit!\n\nYou made me wait 10 minutes to view the glorious post game thread memes.|Cavaliers|7
WHY IS EVERYTHING 1. IM SO CONFUSED||8
Everything one but you|Kings|2
You on mobile ?||2
Yes ||2
Yeah I'm seeing the same thing on mobile lolol||1
I love Lebron's effort and intensity|NBA|7
This just in: Kevin Love slipped while taking a shower and hit his head on the floor. NBA to evaluate concussion and will be out on G4.|Cavaliers|9
Epic username|[SAS] Tim Duncan|3
The K Love jokes are fucking old and he's obviously a net positive to the Cavs...\n\nReading this thread, I'm convinced that none of you are original.\n\nThe reason they won is cause a) it's a home game...finally and b) LeBron was excellent. The best in the world. Curry can make everything, including shots out of his ass (yes I know he makes shit like that), and even so he's still not as good as LeBron when he plays like this.|Lakers|10
Defense and effort were the reason we won. And while Love is a quality player, we don't know if he can actually contribute against the Warriors (it's a bad matchup). Jefferson good defense and allowed us to switch, which is what we can't do with Love. |[CLE] LeBron James|4
> Curry can make everything, including shots out of his ass (yes I know he makes shit like that)\n\nWe all make shit out of our asses though. That's nothing special.|Jazz|2
This was not Game Six Lebron. He is coming...\n|[LAC] DeAndre Jordan|5
[For the land](http://i.imgur.com/RBzck7H.png)|Raptors|7
Is that Varejao top left as well?|NBA|1
Lol yeah he's getting a ring no matter what.\n\nBron bron trying to kill the traitor but he has too many rings.|Raptors|1
I'm getting sick of these blowout games from both sides. I just want to feel the NBA finals anxiety and have panic attacks again.|Warriors|5
So late to this, but all I can say is that it really says something about the Warriors when I'm watching the game and the Cavs are up 20 and im still thinking how not-over the game is... what im trying to say is that I had those panic attacks until like 3 min into the 4th|Cavaliers|2
Am I seeing this right? The cavs bench only had 15/120 points...|Trail Blazers|7
Cavs bench scored only in 4th|[SAS] Tim Duncan|6
[deleted]||28
Is that the girl in that Netflix show 'love'? (But this looks like community)||1
I am so proud of this team. After all the shit every single player got from the media/fans in the last week, that was a hell of a bounce back. Kyrie had so much swagger out there, it looked like once he got it going early, he knew he was back. JR was money tonight, that's the JR I remember. Clutch from downtown and showed so much heart on defense. LeBron struggled with turnovers again, luckily he was a beast in every other aspect. Amazing leadership. RJ was such an amazing pickup for this team. He plays with so much grit and passion, and is still extremely talented for his age. Shout out to all the people on this sub that talked about how trash TT is after Game 2. 14 pts 13 rebs, what a performance. 5 yrs/82 mil doesn't look bad at all when he plays like that. \n\nOur offense looked so much more crisp tonight, people just played with so much more energy and confidence. \n\nOur defense was amazing tonight. Curry and Thompson were completely swarmed. The close outs on everyone else seemed much less lethargic. People were fighting for every loose ball, through every screen, just playing with so much more heart.|Cavaliers|78
[deleted]||-17
Thanks|Cavaliers|24
We will never get any respeck, so many haters. Look at the analysis you gave, and then get shitposts in response by these salty ass fans. We dealt with this bullshit for over a week now.|[CLE] Kyrie Irving|8
You are the Skip Bayless of reddit comments, I think I read that in his voice. No offense, I'm a Cavs fan 30+ years. But the way you write and the whole using a lot of adjectives I just read that in his voice, once again, no offense. Go Cavs!|Cavaliers|1
I actually like Skip so thanks|Cavaliers|1
You guys stepped up. Glad this is a real series now I wasn't ready for offseason /r/nba yet. |Warriors|11
**the game 3 Kerrse continues**|[GSW] Andre Iguodala|34
[deleted]||19
Tbf that halftime shot was insane, Cavs undefeated when JR puts down the pipe|[CLE] Mark Price|1
He is. if he makes 4 or more threes a game they are 20 and 5. regular season.|Suns|1
I agree. Jr is key to the ti ttl e|Kings|2
[Finally relevant](http://imgur.com/W6rYb99)|Raptors|6
Well, fuck.||6
Sooo... Kevin Love benched game 4?||6
Golden State should just trade Curry for the 1st pick. You have to look out for your future these days.|Cavaliers|5
Since no one will see this... I ate ass 3 days ago |NBA|31
How was it and why did you do it other than memeing?|Spurs|2
It was alright she showered and I trust her so it tasted like when you bite your arm but instead its a butthole|NBA|10
Did she ask you too?|Vancouver Grizzlies|3
See thats why I don't get it. But props you crossed it off the bucket list|Spurs|3
( \xcd\xa1\xc2\xb0 \xcd\x9c\xca\x96 \xcd\xa1\xc2\xb0)\n\n\n\n\nI saw it|Trail Blazers|3
Do you still taste it? |Cavaliers|6
Anyone else notice Cavs fans stayed til the end? Unlike Dubs fans. |Suns|16
If I was a dubs fan I would have probably left too. You don't need to see the corpse titty-fucked after they've already killed your mom|Supersonics|0
there's a big difference in the cost of prices between the two arenas, plus the distance between said stadiums and the homes of their fans|Lakers|1
Oakland traffic is nothing to fuck with ||1
There are some great Dubs fans, it's mostly ticket pricing forcing out the hardcore people|[CLE] Mark Price|4
Trust me we hate the people who can afford our games too|Warriors|7
The 2015-16 Cleveland Cavaliers are undefeated in the postseason when Kevin Love does not play.||11
Well, since no one can see this...\n\n\nFUCK THE CLIPPERS!|Suns|11
We saw, Mr. Bandwagon fan. Shouldn't you have a Cavs bandwagon flair since they won the last game? Fuck the Clippers? No. Fuck whatever team it is that can't maintain the respect of its fickle fair-weather fanbase enough for those fans to keep a ***faded bandwagon flair FFS***. Without looking, I'm gonna guess that you are a Houston fan... hold on, let's see... Oh, I get it. A ***Suns fan***. My apologies, sir. You have every right to be salty.|[LAC] DeAndre Jordan|2
Imma about to call up Ayesha and adopt Riley, LeBron just murdered Steph with *that* block|[BOS] Paul Pierce|37
What about Ryan?|[TOR] Pops Mensah-Bonsu|3
Nah you got it all wrong. He became Riley's grandpa with that one.||18
[Everyone who thought the Warriors would cake walk to a sweep](http://i.imgur.com/A9P6jBw.gifv)|Timberwolves|71
Love your name, too bad Cudi let himself go these last few years|Cavaliers|0
"LeBron is declining, Steph Curry is the best player in the league. LeBron failed at building his team the series is already over Curry GOAT"|Bulls|2
Mmm... curry goat!!||1
I said Warriors in 6, but after those first two, I was thinking sweep. \n\nKudos to Cleveland on stepping up big time. Friday could've been an elimination game, but they have a chance to tie on Friday.|Magic|2
Warriors fans weren't saying that though, need to ask Steven A. Smith about that one\n\nEdit: I don't know what's happening but I comments are showing up for me. \n\nWhat I was saying though was it seemed everyone was counting out the Cavs *except* for the Cavs and Warriors fans. We've experienced back to back defeats and bounced back, it's naive to think the Cavs would take it laying down. \n\nThat said, did not expect this...GOTDAMN|Warriors Bandwagon|19
That's the thing. We get made to seem like idiots when the only people who didn't know that we are atrocious in Game 3s are the bandwagon fans/flairs. It was never going to be a sweep. |[GSW] Ian Clark|1
He's been such a LeBron fan the whole playoffs until today. He gave that sad faced look as he picked GS this morning and turned his back on LeBron. Can't wait to see Skip tear at him tomorrow for it. |[ATL] Kent Bazemore|1
I think you could find a few Warriors fans that were saying that.|76ers|5
Stephen A. Smith wasn't saying that so... need to ask Warriors fans about that one?|Heat|4
"I really hope the Cavs play a good game, I want to see some good basketball tonight. I don\'t want it to be too easy for the Warriors."\n\n...\n\n"Ok, not that good, damn."\n|[GSW] Leandro Barbosa|87
Kevin love finals MVP. He offered to sit out to let his team win.|Thunder|3
Harrison Barnes Finals MVP for giving Kevin Love the concussion. |Mavericks|1
This shit starts when an away team wins. |Suns|6
The Cavs home/road splits these playoffs are hilarious.\n\nSave for game 1 against Detroit and the 4th quarter in game 1 vs. Atlanta, they've basically been invincible at the Q this spring.||5
Ladies and gentlemen, The Finals have started |Lakers|4
Fuck man, I came into this game rooting for the Cavs cause I want a good series, but quickly started rooting for the Warriors. I just want to watch one close game these finals.\n\nThat being said it was really impressive to watch the Cavs play the way they did and keep themselves in this series. People were so obnoxious in the game thread saying it was all because Love wasn't on the floor though. This team played lights out. Their physicality on defense was huge yeah, but they were just so wet I really don't think Love's lack of defense or whatever would have mattered. Kyrie has been shit on just as much if not more but the way he shot tonight made that irrelevant. I mean shit, I don't think anyone but the starters scored in the first half, maybe longer. So yeah, hopefully they can keep this up throughout the rest of the series. I seriously doubt the Warriors play like they did in the first half tonight for much more, if any, of the rest of the series.\n\nI'm hoping we can get this series to go 7 but I just don't know if the Cavs can continue what they did tonight. I think they had their backs up against the wall and because of that came out like rabid dogs. Dunno if that type of motivation will continue and if both teams regress back towards the mean at all I still see the dubs taking it in 6, maybe 5. |[DEN] Dikembe Mutombo|4
I don't think the Cavs can win four matches without a contribution from the bench... their stars made a huge effort that cannot really be sustained for that long. We'll see, because Curry and Klay are going to show up at some point!||5
I\xc2\xb4m still hopefull Cavs can turn it around.|Cavaliers|3
I like how the narrative is now the dubs suck.\n\nThis sub is such a joke ||7
Truth|Cavaliers|2
#lost by 30|Cavaliers|13
Cavs in 4|Cavaliers|8
Honestly even without all the comments, this has around the same level of analysis as the normal postgame threads|[MIA] Hassan Whiteside|6
Thompson just called Mozgov dirty. smh.|Celtics|7
He should look at his own damn team|Cavaliers|2
We sure love to overreact|[HOU] Yao Ming|4
Richard Jefferson is my new dad|Cavaliers|5
strangely i found out through dna testing recently that rj is in fact my biological father. I reached out to him but he didn't want to meet me. |[CLE] Andre Miller|1
LeBron James had the loudest, and angriest 32 points in recent memory|[NYK] Kristaps Porzingis|4
