"i am fine. why won\'t anyone believe me?" -kevin love, tomorrow|Raptors|496
"Oh Jesus his amnesia\'s kicked in. No Kevin, you\'re not fine, you\'ve been in a terrible accident. You\'re gonna have to sit out the rest of the series I\'m so sorry. We\'ll do what we can to get you the therapy you need."\n\n"But I can reme..."\n\n"... OH GOD HE\'S HAVING FLASHBACKS TIE HIM DOWN"|Bulls|247
Kevin Love: "Which is better...to live as a monster, or to die as a good man?"|Timberwolves|3
Lebron nodded.||3
Kevin has Changnesia|Raptors|6
Kevin Love's concussion tests will be solving rubix cubes one handed while playing concert level piano with the other hand sitting on a unicycle.|Mavericks|1521
Saw this on twitter hmmmm|Spurs|2
Ah yes, the 'just another day as an Asian kid' routine.|West|2
[Future NBA player confirmed](https://youtu.be/9lOTVwVLZ3g?t=10)|Supersonics|2
[Got the Piano part.](https://www.youtube.com/watch?v=ML05gLjR_sY)\n\n[And the Cube.](https://www.youtube.com/watch?v=3FDmmL5vKHg)||2
plz *Rubik's|Lakers|2
Funniest comment in the thread|Cavaliers|3
Putting a hand on a unicycle doesn't seem so hard|[MIA] Michael Beasley|6
>unicycle.\n\no shit \n\n||5
Here come dat Kevin|Knicks|11
[oh shit](http://i.imgur.com/F9mRtOd.jpg)|Heat|7
please please please|Cavaliers|83
Kevs gotta win the spelling bee in another language if he wants to see game 4|[DEN] Emmanuel Mudiay|415
Against Leroy. |[LAL] Kobe Bryant|3
Spelling Bee in Chinese, to be exact.||14
Serious question: can you have a spelling bee in a language that has a logographic writing system? Does the concept of "spelling [outloud]" even exist in Mandarin?|Supersonics|4
i guess the other replies said it better than i could. the only thing i have to add is that there\'s a lot of homophones. like you can have the same sound and same tone, but write it several different ways and each different way has a different meaning. and you differentiate by combining it with other words. like in English if I said traintracks vs training, the train part sounds the same but when i tack on different sounds, the "train" takes on a different meaning. When writing single characters, you can just provide that context. Like, "My name is Train Chen. Train as in training." and then they would be like, "oh. so he has the character for the word train like training for something instead of the train that you ride." This is assuming that they\'re already literate ofc, which I am not at all lol.||2
There are spelling bee style TV shows in China, but instead of vocalising the words the kids instead write out the characters in a digital display that is shown on a large screen for the viewers/audience.\n\nYou could technically vocalise each stroke as there is a formal order for how each character should be properly written but I think it was just more practical to have them write it out.|Grizzlies|4
That\'s super interesting. Difficult to compare, I suppose, but I wonder if this sort of competition is in any way "easier" for the contestants because of the visual reinforcement one gets from writing something out (the same way I might have to write a word like "embarrassment" or "Alanis Morissette" down to make sure I have all the double letters properly distributed).|Supersonics|2
"Straight horizontal line at top for 5cm into 45 degree diagonal line down and to the right for 3cm into straight vertical line on the right side 3cm...."|Cavaliers|19
**\xe4\xb8\x8d\xe5\xa5\xbd\xef\xbc\x81**|Celtics|3
Actually Chinese characters are made up of a formal order of preset strokes each with their own name, so you would just list each of the strokes.|Grizzlies|11
[SIDEBAR](https://pbs.twimg.com/media/Ckeq70IXEAQomyZ.jpg)\n\nedit: SINCE PEOPLE KEEP ON ASKING ME THE SOURCE/PHOTOGRAPHER. \n\nYou can find the best quality photos after the game @ getty images and searching for the game (Cavs vs Warriors game 3)\n\nHere's a [direct link](http://www.gettyimages.ca/photos/cavs-warriors-game-3?editorialproducts=sport&excludenudity=true&family=editorial&phrase=cavs%20warriors%20game%203&sort=best#license)\n\n|Raptors|1557
That looks like a fucking painting. Notice how everyone is just in awe of what they are witnessing.|Hornets|1
THIS SHIT TOO MUCH BRUH|Clippers|1
I feel like classical music should be  playing while I look at this. |Supersonics|1
Side note, Iggy's shoulder muscles look like an action figure.|Cavaliers|1
incredible|Raptors|1
That is just sexy. So glad I get to watch this dude play.||1
new computer background, the best!|Kings|1
Seriously, that was some too squad stretchy arm shit there. ||1
Perfect||1
State Farm||1
How the heck do they get the lighting that way? i don't understand|Celtics|2
Holy shit that pic is amazing. The detail is fucking incredible|[OKC] Russell Westbrook|2
The lighting makes this pic to be honest.\n\nBesides the athletic freak jumping out of the building, of course.|Trail Blazers|2
it's all about the lighting|Hornets|3
It looks like every player has their own personal spotlight|Cavaliers|1
Damn, that is sexy.|[MIN] Andrew Wiggins|5
hooooly fuck|[PHO] Yuta Tabuse|7
ooh pretty|Cavaliers|10
This is the exact game we needed from LeBron, and was a textbook LeBron takeover.  He wasn't a ball hog and forcing shots, but instead made HIS shots when he felt confident and facilitated the offense and defense perfectly.  Set the tone.  Reminded everyone that the King will not go quietly.|Cavaliers|5
[Now with more Halo.](https://twitter.com/AndyCole84/status/740752051332751360)||5
"declining athleticism"\n\n"LeDecline"\n\nOkay.|Cavaliers|175
Actually I think if you look at [this pic](http://i.imgur.com/2LDxUNW.png) you can see that he's lost a lot of lift.|Cavaliers|16
I literally yelled out "fucking shit!" \n\nNE: Good thing I\'m alone in my apartment. Ha.|Thunder|1
yeah, he was more athletic than this before. still a brilliant athlete, but not as brilliant as in his 20s.|Celtics|6
His athleticism is declining and so is he. The fact that he's still this athletic and is still so good just shows how insane he was before\n|Lakers|158
If you're 10/10 and everyone else is 8/10, declining down to 8.5/10 still makes you inhuman. Trust me, I'm a math scientist.||1
Which makes no goddamn sense! Just how athletic was he??? Did we all just not notice, because he's still Top 5 most athletic guys in the league right now.|OKC Hornets|1
The incredible amount of negative bias being thrown his way through the media didn't help the perception.|Grizzlies|3
His athleticism is like his stat sheet. He so frequently does the incredible that it quickly began looking normal to people. Lebron wasn\'t in the league very long before the reaction to his insane athleticism turned from "oh my god, how is that possible." to something like "oh, Lebron did something insane again, neat."||7
I think KD goes through the same thing. He\'s just so efficient, people are like "oh okay, no biggie". Which isnweord|OKC Hornets|5
it's more evident in his lack of quickness from a standstill. he still gets up in transition for dunks though |Bucks|60
/r/AccidentalRenaissance |Bulls|184
So many people already submitted in a desperate attempt at a karma grab ||12
That's actually more baroque, half the pics in that sub are baroque or rococo||7
WHOA NELLY|Cavaliers|37
Woah Delly|Cavaliers|2
That is going to be an iconic photo, I guarantee it|Lakers|88
Nike is hoping so|[CLE] Matthew Dellavedova|1
And State Farm||1
You're gonna like the way you look||4
Only if we win.|Cavaliers|30
[This is still the best pic of him ever](http://pdnpulse.pdnonline.com/wp-content/uploads/2010/12/Lebron-Wade-web.jpg)|Raptors|8
Definitely one of the best. I just feel like it gets some points off because of the hundreds of empty seats in the background |[CLE] Matthew Dellavedova|1
Agreed. DWade: "Are you not entertained?!"||1
That's got to be one of the greatest photos of him. That looks so damn epic. ||429
[I love this one too, similar lighting](http://i.imgur.com/razCorp.jpg)|[MIA] LeBron James|2
that was one of the most athletic plays i've seen recently. can't believe he went from on the floor, to this in like one second|Rockets|4
[This one is still my personal favorite of his](https://pbs.twimg.com/media/Bhh72leCEAAsrh8.jpg:large)|Trail Blazers|335
Banning that mask was such a chicken-shit move by the league.||1
Ah yes. The Madvillainy version of LeBron|[OKC] Ray Allen|1
This is one of the coolest pictures ever.|Mavericks|1
MF BRON||1
"Undashing" LeBron James.|Kings|1
I didn't know MF DOOM played for the heat|76ers|1
You guys have no respek for Chrome users.|Raptors|1
Got the Undertaker '96 going on!|Thunder|1
Villain |[CLE] Matthew Dellavedova|1
I like that one a lot but I gotta say this one is better.|Bulls|1
seen this photo many times, first time i realized he's clapping his hands though. i always thought he was pointing upward which looks cooler |Suns|1
MF doom |Wizards|3
[I have to argue that this beats both of those](http://i.imgur.com/YiqwkpA.png) |Lakers|60
/r/nfl is leaking|Heat|2
Nowhere is safe |Suns|3
[r/wrongsubreddit](http://i.imgur.com/PKesCUW.png)|Lakers|37
had a ton of tabs open, was so confused then realized. fuck you |Suns|6
Wow, didn't expect that to be a real place.  Interesting mixups.|[CLE] Mark Price|16
yo, fuck you -_-|Celtics|3
Can confirm, this one has been my background on my laptop for a couple years now. And I'm not even a Cavs/Heat fan.|Suns|17
[I really like how stoic he looks in this one.](http://i.imgur.com/YYiM2pF.jpg)|Spurs|426
[deleted]||1
Nope that's the original version. Looks like it's shopped though right?|Spurs|4
Yeah|Raptors|1
I knew what I was going to see, but it still cracked me up. Thank you. |Celtics|1
Np fam :)|Spurs|2
[Here is my favourite photo of him](http://3.bp.blogspot.com/-eEXIn8vpZ7o/T9IoIPT6API/AAAAAAAARCw/Mgo3Jx7Wkkk/s1600/kjqsdup-tw1.png)|Suns|11
Celtics fans are having flashbacks right now.|[MIA] Dwyane Wade|5
http://i0.kym-cdn.com/photos/images/newsfeed/000/371/430/f8e.gif GIF version||14
it doesnt even look real|Clippers|80
Holy shit the origin of Lelbron.|Raptors|266
is it really?|[SAS] Manu Ginobili|41
It is indeed.|Raptors|40
We are not worthy...|Cavaliers|25
We're so used to that face being shopped, it doesn't look real anywhere.|Cavaliers|46
The canny valley?|Pelicans|3
ah, i understand why he's getting paid millions of dollars to do this now. |Heat|566
Who? Tristan Thompson? /s||2
I mean, it's a good edit and all but someone paid him *millions* just to change some lighting around?|[ORL] Tracy McGrady|4
[deleted]||531
Lebron Nods.|Celtics|1
Who the fuck told you that?!?! It was SUPPOSED to be a secret!|Spurs|5
I was wondering what made him different from me|[MEM] Marc Gasol|9
Big, if true|Raptors|155
And let that be a lesson to you all. Nobody beats the Cavs 8 times in a row.|Cavaliers|749
That reminds me of an old tennis rivalry between Jimmy Connors and Vitas Gerulaitis. It was rather one sided actually, and Connors had won all 17 of their encounters. When Vitas finally managed to beat him, he said "And let that be a lesson to you all. Nobody beats Vitas Gerulaitis 17 times in a row.".||1
That was literally the joke.|Cavaliers|13
I didn't know that phrase was so well-known, i thought it was too similar to be a coincidence anyway. ||3
it shows up on the front page every couple of months, so i'd say it's pretty well known here||3
Given the number of upvotes u/jibflank has i'd be inclined to agree.||3
Chicago beat Cleveland 10 times in a row between 2010 and 2012 ;)|[WAS] John Wall|259
We don't talk about that time|Cavaliers|1
You mean when LeBron wasn't on the Cavs...||1
No lebron, doesn't count|Cavaliers|1
Nobody beats the ~~Cavs~~ LeBron 8 times in a row|Celtics|5
10 isn't 8 now is it Mr. Smart Guy?|Cavaliers|14
But there was some time between the 8th and the 9th wins. So technically at some point in time, someone did beat the Cavs exactly 8 times in a row.|Knicks|1
Wewsh|Cavaliers|1
Chicago beat Cleveland 8 times in a row between 2010 and 2012 ;)|[WAS] John Wall|1
Technically correct, the best kind of correct|Hawks|13
Die|Knicks|-7
Hey fuck you!|Cavaliers|230
I'm not crazy about the message, but I just love your enthusiasm|Bulls|1
Warriors for sure gonna let Harrison Barnes walk this summer for that hit on Kevin Love|Knicks|983
lol nah, he played well tonight. 7-11 and was looking like the only guy out there at times.|[GSW] Klay Thompson|-11
It was a joke. For taking out K Love and thus making the Cavs better. Wasn't sure if you got what he was saying. lol||12
I totally got it, and moved onwards from it|[GSW] Klay Thompson|-18
Not good enough, Sonya.|NBA|8
k|[GSW] Klay Thompson|-11
When your feet are glued to the floor, you're gonna have a bad time |Warriors Bandwagon|1
thanks for making me spill my coffee lol|Cavaliers Bandwagon|1
They can't afford that max contract ass anyway|[DEN] Emmanuel Mudiay|164
Is Barnes really going to get a max deal? I know his max is considerably less than someone like lebron or KD, but damn, Harrison Barnes getting a max? I feel like he's been a huge disappointment in the NBA but he's just found a niche on the dubs right now. I feel like he's on the same level as Jeff Green and there's no way in hell Jeff Green gets a max deal.||68
I have to say I love the green comparison. They both seem to have all the talent and ability to do amazing and are just meh. Barnes is more consistent tho. |[NBA] Lebron James|-1
The cap changing means, yes, he will get a max contract. Look at how much TT made, and as many people say he's not worth that much, he would have gotten something close wherever he went because teams are just throwing money around right now anticipating the cap jumps.\n\nAnd he's been pretty solid, just hasn't been the superstar a lot of people thought he could be.|Cavaliers|1
Honestly he's really impressed me in these playoffs. He really seems to step up when his teamates are playing poorly. He's also a great defender and is versatile. Could play 2-4 and can shoot well. That's just so valuable in today's nba. The cavs would be better off with him instead of Love. Love is the better player on a team where he's the 1 or 2 option but Barnes could fit on any team |Cavaliers Bandwagon|1
I don't know why I thought this account was u/Rabsho's alternate account|Jazz|1
I respectfully disagree. Harrison Barnes is a damn near complete offensive weapon who plays on the same team as two of the best shooters possibly ever. Barnes shoots a respectable percentage from 3, is great at finishing around the rim, can post effectively against guys his size or smaller, moves well without the ball, and has hops for days. The biggest knock on him is probably his FT shooting. Harrison Barnes is more polished now than Jeff Green will ever be. I'd say he is as good if not better than DeMar DeRozan. I think he scores in the low 20s or higher on a team where he's the first or second option. ||2
he doesn't deserve to be the first option on any team  in the playoffs this year. for that matter what team would he be the second option on? maybe Memphis, dallas, insert shitty eastern conference team here? |Trail Blazers|1
Tristan Thompson got a max, so anything is possible.|Raptors|2
Good small forwards are hard to come by and Barnes is only 24 with finals experience. That's the ultimate recipe for a max contract in my opinion |Pistons|4
The thing is he will be the highest paid player on our team by far and it might not sit well with some players.|[GSW] Draymond Green|2
i don't understand contracts anymore and i feel like in a few years we will look back on some really bad deals this year. it's like ww1 too much firepower and no idea how to use it.|Wizards|9
He doesn't *deserve* a max deal, but he'll get one. The money is so crazy nowadays, someone's gonna be willing to pay.\n\nPlus, with the huge new TV deal, and the salary cap going up soon, *and* because 50% of the NBA revenue has to go the players, some teams are gonna have so much money coming in while being so far under the cap that they'll essentially get penalized for spending *too little* money. So, if you you have money that you HAVE to spend, why not throw it at a max deal to ensure you get the player you want? Sure, you're technically overpaying him, but you'll take a hit if you don't spend that cash, so there's no reason to pay him less. \n\nIt's just how the NBA is going nowadays, there's literally more money than the league knows what to do with. ||55
The nba is choosing the WRONG time to make a TV deal and it will backfire. ESPN is down like 300% in ratings pr something lately and subscriptions are way down too.|[UTA] Rudy Gobert|0
Not sure if you have been living under a rock or what, but NBA already made a new TV deal and it's amazing for the NBA money wise and started already for this season.\n\nhttp://www.sbnation.com/2014/10/5/6916597/nba-new-tv-deal-espn-turner-24-billion\n\nIt will be awhile before they make a new deal.|Mavericks|1
Oh they just get a lump sum that is a good move, if they made a percentage of the viewership then that would be a terrible move. Honestly Turner is gonna lose money on this one |[UTA] Rudy Gobert|1
>...there's literally more money than the league knows what to do with.\n\nOh I don't know...maybe lower ticket prices?  But I'm just spit ballin' here.  ||38
Or just stop resell on tickets, face value isn't that bad. ||1
Don't ticket prices have to do with supply and demand? Besides, it's been proven that lowering ticket prices won't help the common man since the vast majority are bought up by professional scalpers and sold at market price anyways.||17
I think that's reliant on the market. Wizards tickets are always cheap, and even when they started balling, resale wasn't ridiculous.|OKC Hornets|1
I think this is heavily dependent on the venue. The Hawks were really guilty of jacking up prices as the team did better the past couple years, and I get it, but I don't get half-empty games with tickets being released in staggered sets to make the game appear closer to sold out.||1
If they  really gave a fuck they'd put mechanisms in place to curb that|Cavaliers|8
For teams that sell out sure.  But for some other teams, who I see no need to name here, they should lower their prices just to get people in buying concessions.  But they don't want to embarrass themselves with 99\xc2\xa2 tickets.|76ers|9
But that's the thing though. People don't go to those games cause the team sucks and tickets costs so much. Lowering the price increases demand there by increasing value for scalpers to get involved. ||1
I was watching a Utah local stream and the deals were insane - like 4 pizzas and four tickets for 60 bucks. Only problem is now you're in the middle of Utah. Isn't Nevada right beside Utah? Why would ya stay in Utah. Isn't it a desert with draconian laws about alcohol etc?||3
Not really. Utah has the same liquor laws as 13 other states in the country. They're admittedly stupid, but with those liquor and gambling laws comes higher average income, higher college graduates per 1000, lower crime rate, affordable housing, and a sustained economic growth due to all the available degreed talent. Also we have Google Fiber. ||5
You had me at Google fiber ||1
Kevin Love is about to make history as the first player on a winning team to ever be Crying Jordan'd|[SAS] Speedy Claxton|1495
[deleted]||-5
Nope. People made those memes for every single team that lost in the NCAA tournament. ||4
thats not true at all|[NYK] Amar'e Stoudemire|8
[deleted]||0
I responded to you yesterday fool|[NYK] Amar'e Stoudemire|2
[deleted]||1
https://www.reddit.com/r/nba/comments/4n91gf/post_game_thread_the_cleveland_cavaliers_defeat/d427mdx\n\n|[NYK] Amar'e Stoudemire|2
[deleted]||1
i just saw a message that all comments that contain a reddit link are removed automatically if the link isn't a 'no participation' link.\n\noh well. i fixed it.|[NYK] Amar'e Stoudemire|2
[deleted]||1
[deleted]||1
Really though. Hes gotta come off the bench next game|[WAS] John Wall|3
Klove is gonna need some love after this game. He feels left out.|Cavaliers Bandwagon|93
He needs some more love from Guillermo|Celtics|1
He need some milk! Chocolate that is |Hornets|2
No matter how many times I see this I always pronounce it in my head as "clove" and not "k-love"|Celtics|3
"Stop trying to feel left out and just feel left in"|Cavaliers|165
I thought for sure that was a Drake quote I hadn't heard yet. |[LAL] Smush Parker|4
http://imgur.com/VT9O1HE|Cavaliers Bandwagon|1070
What the fuck? How is this funny?|Cavaliers|-1
Yeah this is fucked up. Concussions aren't funny|Rockets|1
Crying jordan is always funny lol |Pacers|8
it's perfect.|Heat|2
Memes don't die|Rockets|129
Let me crash here for a moment|Warriors|1
Memes don't lie|Thunder|1
They just take on newer forms |Knicks|1
They just are Missing in Action|[SAS] Tim Duncan|4
What's memed may never die|[LAC] Michael Olowokandi|5
Let me shitpost here for the moment|[SAS] Speedy Claxton|14
And post more crying Jordans. No liiiiiiiie.||5
Remember kid, there's heroes and there's memes. Heroes get remembered but memes never die, follow your heart kid, and you'll never go wrong.||8
the great memebino||3
Love don't shine in the game. ||24
LeBron don't really go away|Wizards|15
And that's just the game|Rockets|9
James don't dieeee|Celtics|3
i legit feel so bad for him. Mark Jackson with his "with due respect" shit again and then openly shitting on him was so sad. Imagine Kevin just watching the game and you hear that.|Raptors|246
Mark Jackson is an idiot ||2
He wasn't wrong. Isn't blunt, honest commentary what you want? It's what I want. |Magic|5
The cavs are obviously better without Love. Kinda like how the Warriors re obviously better without Mark Jackson. He can only comprehend one of these things however. |Trail Blazers|0
Its like every time I hear Mark Jackson talk, I hate him more and more.. I completely understand why the Warriors management didn't want to deal with that guy.|Cavaliers|80
with all due respek the man was speaking the truth|Vancouver Grizzlies|1
What did Mark Jackson actually say? I wasn't able to watch the game and couldn't find out via a quick Google search. Thanks ||17
I remember him saying something like "with Love out, Warriors don\'t play Bogut and Cavs defense improves by a long shot"|Lakers|29
God he is just such a senile asshole these days, and he's the biggest captain fucking hindsight in existence.|Warriors|0
How dare you talk that away about the coach that built the warrior's franchise||2
Isn't all analysis based on hindsight? |NBA|4
It's not like it isn't true, anybody watching these finals could tell you that|Celtics|11
He's not wrong though. And people were saying that even before this game. The Cavs were a lot better defensively without Love in last year's finals as well. It's no secret that Love isn't a great defender.|NBA|7
"He\'s straight trash.. with all due respect"|Lakers|179
Yeah the Cavs are definitely better off without that sad weak dude. With all due respect.|Spurs|3
I still can't believe I read a NYT article about the crying Jordan meme, what a time to be alive.|Trail Blazers|244
link it my dear cunty||30
http://mobile.nytimes.com/2016/06/04/arts/crying-jordan-the-meme-that-just-wont-die.html||31
For real, this meme has been around for a few years, which in meme years is like a fossil.|Raptors|22
It's an old meme that still checks out|Warriors|2
kevin love watching this game [like](http://i.imgur.com/mU5PnIs.jpg)|Celtics|338
The Lebron face in the background ties this picture together nicely.|Celtics|1
the moment when a 36 year old plays with more heart and intensity than you||2
hey |Braves|2
asuh\n|Celtics|4
\xf0\x9f\x90\x8a \xe2\x9b\xbd\xef\xb8\x8f\xf0\x9f\x85\xb0\xef\xb8\x8f\xf0\x9f\x86\x96|Braves|2
Ayesha Curry watching this game [like](http://i.imgur.com/z1cnGHb.jpg)|Raptors|16
Those concussion symptoms are really affecting his vision|[LAL] Luke Walton|80
The starters:  \n\n* James 32 PTS, 11 REB, 6 AST, 1 STL, 2 BLK, +24\n* Thompson 14 PTS, 13 REB, 2 AST, +21\n* Irving 30 PTS, 4 REB, 8 AST, 1 STL, +24\n* Smith 20 PTS, 4 REB, 1 AST, +33\n* Jefferson 9 PTS, 8 REB, 2 AST, 2 STL, +11|[NYK] Carmelo Anthony|404
i'd be worried if i were the cavs, means the cavs bench was total shit wasn't it?||0
Now that's the pissed off Playoff Lebron I know! |Heat|1
RJ still got it! ||1
> Smith 20 PTS, 4 REB, 1 AST, +33\n\nPIPE CONFIRMED|Cavaliers|3
No depth.||3
JR with the +33!! Nice to see him finally show up to a finals game. |[CLE] Kyrie Irving|5
>8 assists \n\n> selfish, not a point guard \n\nKyrie "Westbrook" Irving \n\n\nEdit : of course Westbrook is better |[HOU] James Harden|116
Wait is this a real debate, do people think Kyrie Irving is better than Westbrook?|Heat|1
No |[HOU] James Harden|3
Westbrook is in another universe defensively, as a driver, and has always been a much much better passer than Irving. Kyrie's career high assists per game is 6. Westbrook averaged over 10 this year and his worst seasons as a passer are just a bit worse than Kyries best. Kyrie really is a below average passer, which is where the Westbrook comparison falls flat.\n\nKyrie was never unfairly maligned as a passer, he's been below average as far as creating offense from day 1.|Pacers|1
Westbrook has the same defensive flaws as Kyrie actually. He relies too much on athleticism and instinct. He is constantly out of position and ball watching in hopes of stepping into the passing lane. Both have slow feet in picks and suffer tracking off ball movement.\n\nNeither are good defenders, but Westbrook certainly has better court vision and shot creation for teammates. Complete agreement. Kyrie has the better jumper though.|Hawks|17
Kyrie has a better jumper overall but Westbrook's pull up jumper is cash. |Bulls|3
Kyrie's younger tho|Spurs|13
He's missing 8 more boards to be a Westbrook |Thunder|98
And 4 turnovers||1
West had hella low turnovers in a lot of the playoff games.|Thunder|1
