I, too, saw [that tweet.](https://twitter.com/WorldofIsaac/status/740718378562801664)|[OKC] Russell Westbrook|214
Yeah this joke is so original there's no way 2 people could come up with it separately.||-2
Come to this sub expecting original content or good analysis? Lol||2
I liked it so I shared it.|Cavaliers|18
>shared|Knicks|16
No nowadays you must cite every single thing in MLA format ||47
Fuck that #APAMasterRace|Cavaliers|2
Chicago Turabian you Philistine!|Cavaliers|4
Sorry I'm not a Bulls fan.|Pelicans|2
Well I didn't|Pistons|5
"K"|Cavaliers|454
[K](http://i.imgur.com/4P4AcxW.gifv)|Spurs|10
"<3"|Bulls|103
\xe2\x9c\x93 Seen 11:31pm|Knicks|173
http://i.imgur.com/TwsvUu0.jpg|[LAL] Luke Walton|157
Yo D. Rob :(|[SAS] LaMarcus Aldridge|3
This is the fucking ugliest picture I've ever seen.|Bulls|26
It's beautiful.||5
*"Ayyy Kev why don\'t you take a 3 day weekend and rest that head"* - Tyronn Lue|Lakers|99
Kev, buddy? We're just gonna be safe and rest ya for the rest of the finals, ok?|[DEN] Emmanuel Mudiay|8
I\'ve finally finished mourning my Thunder, so I\'ve decided to do more write-ups in honor of the Finals. But I hadn\'t seen enough of the Cavs playing to make honest and informed critiques. Thankfully, I get to do that on a Cavs game that wasn\'t a total wash! Notes:\n\n* We\'ll start with the coaching. I honestly think Kerr got severely outcoached by James this round. Kidding. But seriously, Lue was much improved tonight. I\'m not sure if it was the home court getting guys comfortable in their game again, but I saw much improved switching, communication on both ends. He finally got his guys ready to play. \n\n* Kerr\'s coaching was also improved. He was prodding and tinkering to see how Lue would react. Unfortunately, there\'s no real adjustment to shots falling. That being said, he did a lot in order to see Steph getting a little in his groove after halftime. Backcuts off baseline screens and lots of curling, while using Livingston dropping to the elbow as a magnet for guards is pretty ingenious. \n\n*  Speaking of Steph, he took a while to wake up. Like 2.5 quarters. Yeah his shot started falling, but if you look more closely, you saw him getting a lot of the offball asswhooping that he got playing OKC. Bumping, prodding, checking, slapping, pushing: all of it seems to get him out of his rhythm and firmly into his own way. And when he\'s in his own way, like so many other greats, that\'s when he seems mortal. Taking that long in the Finals cannot happen. \n\n* I was really impressed by both Draymond and Klay. It\'s a shame that Dray is probably a shoe-in for the FMVP if the Warriors win, because Klay has been doing that thing all series where he singlehandedly puts the team on his back and hits stupid, ill-advised, JR Smith caliber shots at an insane clip. \n\n* That\'s not to belittle Draymond\'s game: he\'s been very good defensively. Notice that once he was no longer guarding LeBron, his jumper started falling again. Hopefully thats a causality that Lue looks into, but I don\'t have the analytics in front of me. \n\n* I hate to make another OKC comparison, but I have to--the Cavs finally brought their defense. More importantly, they used that defense to create offense, letting fast breaks come out of shattered posessions on the other end. Smart, and simultaneously breaks their overrealiance on iso-sets, and Kyrie playing off the dribble against Iggy/Livingston/Klay. \n\n* List of teams of fans that I saw trashing LeBron: Bulls (stop it), Dubs (expected), Nuggets (stop it again), Lakers (Boi). Cut the malarky, people. \n\n* List of teams of fans that I saw trashing Steph: OKC (guys...), Bulls (stop it again), Cavs (expected), Lakers (leave), Pistons (#fuckReggie). \n\n* Iman Shumpert looks like Huey Freeman, if Riley shaved his head in his sleep, and then he said "fuck it" and made a samurai bun out of the nappy ass remains. \n\n* I really think JR\'s regression is a direct result of that burn he got Game 1. He\'s not wearing the bandage, and suddenly he\'s slinging pipe and sipping Hennesey during timeouts. Coincidence? I think not. \n\n* Igoudala is probably one of the most underrated fucking defenders I\'ve ever seen. Seriously. Watch him work. He has Pippen caliber hands, he\'s remarkably aware of his own body in space, his timing is (terrifyingly) better than Draymond\'s, and he knows how to use his weight, and how to balance it to avoid fouling.\n\n* I know it\'s not smart to use singular events to make decisions, but honestly, Jefferson might need to start, the same way Kerr hasn\'t been afraif to start Igoudala. His defense has been magnificent, his heart has been great, and his PnR switches are nothing to shake a stick at. \n\n* Bogut was a bit of a liability tonight. Not tremendous, in my opinion, because at least he wasn\'t getting stupid fouls, but he was getting handled on the boards, and was slow to get back. Last game\'s block party has been shut down by Officer Thompson. \n\n* Tristan Thompson had a fantastic game. Still not worth 80m\'s though. Sorry. Had to be said. \n\n* Harrison Barnes plays games like there\'s a combo meter in his brain that fills up with good plays, and when it fills up, he wins a max contract. \n\n* Pop Quiz: Who is the best two way player in th-- LeBron. The answer is LeBron. If you said Klay, or Dray, or anyone else, welcome to the Mark Jackson School of Half-Baked Analysis. \n\n* LeBron time. Honestly, LeBron\'s biggest problem is that he makes it look easy. We don\'t compare him to his peers, we compare him to the likes of Jordan and Kobe and the Big O. Yeah he\'s lost 4 times in the Finals--because he\'s good enough to get there 7 times, 6 consecutively. That\'s more than your franchise. Damn sure more than my franchise. He\'s averaging damn near a triple double AGAIN, and we say he needs to step up. And he did, by bringing back his jumper, while making players quiver on the other end. \n\n* Kevin Love is a top 5 player at his position, and I hope he heals from his concussion without adverse effects. It is a shame to not be able to play in the Finals and have to be left with "What ifs", especially 2 years in a row. \n\n* Homecourt this year has been absolutely monstrous for teams. For anyone who says shit like "regular season doesn\'t mean anything" I promise you wish your team had more home games in a series this year. I know we do. \n\n* Trapping was magnificent on the Cavs side, while the Dubs were great switching and digging through screens. \n\n* Props on both teams for their mental toughness: GSW didn\'t get lazy. Cavs didn\'t come out softer than Twinkie filling. Props all around. \n\nThe Cavs are finally looking like who we thought they\'d be, while the Dubs are still capable of making a 20+ point deficit look tiny. Next game will determine if this was an aberration or not, for both teams. Only time will tell. We got a series, folks!\n\nP.S. On some folks suggestion I\'ll post an amended and updated version in the NDT tomorrow. \n|Thunder|1672
>  Lakers (leave)\n\nlol no|[LAL] Smush Parker|2
I wish I was this smart.|[BOS] Paul Pierce|2
*blush emoji* shucks|Thunder|0
> List of teams of fans that I saw trashing Steph: OKC (guys...), Bulls (stop it again), Cavs (expected), Lakers (leave), Pistons (#fuckReggie).\n\nhilario\n\nLots of nice insight. LeBron is the best two way player, *when he wants to be*. Curry shouldn't have pissed him off. Bogut was getting beat, but Ezeli, Varejao and Speights were as well. I think that's a testament to the Cavs more than the Warriors. \n\n> Harrison Barnes plays games like there's a combo meter in his brain that fills up with good plays, and when it fills up, he wins a max contract. \n\nliterally this. |[GSW] Klay Thompson|2
>JR Smith slinging pipe\n\nAll I needed to see from this comment|Trail Blazers|2
Save this shit for the Next Day Thread boi only memes here/s|Raptors|2
I haven't seen nuggs fans trash bron. (& fuck iggy). and I agree Lebron is best two way or all around player in game still. klay/pg/kawhi behind the king. and bron is 2-4. |Nuggets|2
>  It's a shame that Dray is probably a shoe-in for the FMVP if the Cavs win\n\nWhat's that now?\n\nSeriously though, great post!||3
Brain fart. My bad|Thunder|2
No worries! :) I always feel like I won something when I find things like that. ||5
Iggy's resurgence on the defensive end has been a real surprise since last year in the playoffs. I don't remember him ever playing this good defense when he was younger, and yeah Iggy is a better defender than Draymond. \n\nPeople who write off LBJ too easily, this guy's a lock for the Hall of Fame and probably top 10 if not top 5 players in the history of the game. A lot of people are jumping to conclusions saying the Warriors have 3 potential future Hall of Famers, I'm sorry, but the only person on the Warriors that has a shot is probably Curry. Klay, maybe if the Warriors win more championships like MJ and Pippen did, but Pippen was a fantastic second option next to MJ. Pippen was one of the best perimeter defenders and was consistent offensively. Klay is not as good defensively and he disappears more often than he should. And Draymond. Lol. Yeah he's good, but he's definitely not a Hall of Famer, especially now. It may change in the next 5 years, but he's not getting it. |Lakers|3
Thanks man I read every word. Quality stuff.\n\nGotta say too that Kyrie needs to step up like this every time for them to keep winning. Lebron definitely puts the team on his shoulders but Kyrie gives Lebron wings so they all can fly. \n\nI see this going in 6 to the Dubs just because their shooting is unworldly. |Lakers|3
[deleted]||4
lol bless|Thunder|1
With respect to the coaching changes that were made, I don't feel as though the Cavs did all that much differently than they have all playoffs. It looked like they were taking the same shots from the same formation as previously, but this time they went it. Also LeBron finally drove to the hole and used his strength to get baskets. That opened up EVERYTHING in their offense. As a Hawks fan I saw this game play too much from the Cavs. Once they got their confidence back and the crowd was in it, especially with that alley-oop, there was no stopping the Cavs. Energy on both sides with their physicality at an all time high. \n\nBut can they do it again? My biased answer is no. Warriors are too good and I'm not nervous. OKC looked better in each game than Cleveland has shown thus far, even tonight's game. I'll wait until after game 4 to see what Cleveland is really all about. |[ATL] Kent Bazemore|4
It's a make or miss league. Klay misses half those bullshit shots in G6 *twitches* we'd be in the Finals right now. I do think that it was a product of execution, rather than luck, but as always, in a series, consistency is key. We'll see|Thunder|2
> We'll start with the coaching. I honestly think Kerr got severely outcoached by James this round. Kidding. But seriously, Lue was much improved tonight. I'm not sure if it was the home court getting guys comfortable in their game again, but I saw much improved switching, communication on both ends. He finally got his guys ready to play.\n> \n\nHe's always had the plays and ability. Playing at the Q forces the issue and makes the players see what they're playing for. LeBron also flashed his dick at the Q once, so it's a great home court.\n\n>Kerr's coaching was also improved. He was prodding and tinkering to see how Lue would react. Unfortunately, there's no real adjustment to shots falling. That being said, he did a lot in order to see Steph getting a little in his groove after halftime. Backcuts off baseline screens and lots of curling, while using Livingston dropping to the elbow as a magnet for guards is pretty ingenious.\n>\n\nHe still needs to respond to Tristan Thompson and Kyrie Irving's High Pick and Roll. It's so effective, and has worked extremely well throughout the series, either by freeing Kyrie to crash to the basket or take a midrange gimme shot, or by transitioning the ball to LeBron on the strongside to iso in a great position. \n\n>Speaking of Steph, he took a while to wake up. Like 2.5 quarters. Yeah his shot started falling, but if you look more closely, you saw him getting a lot of the offball asswhooping that he got playing OKC. Bumping, prodding, checking, slapping, pushing: all of it seems to get him out of his rhythm and firmly into his own way. And when he's in his own way, like so many other greats, that's when he seems mortal. Taking that long in the Finals cannot happen.\n>\n\nIt's not so much the shot wasn't falling -- he got some great steals and his head was in the game. I think the issue is that he wasn't willing to just go balls to the wall and consume usage, and when he passed off to other teammates, they were immediately swarmed. He was played exactly as LeBron was in Game 2\n\n>I was really impressed by both Draymond and Klay. It's a shame that Dray is probably a shoe-in for the FMVP if the Cavs win, because Klay has been doing that thing all series where he singlehandedly puts the team on his back and hits stupid, ill-advised, JR Smith caliber shots at an insane clip.\n>\n\nImho, the Warriors can't win without Dray in terms of defensive coverage. Klay Thompson's fuck you threes cost us Game 1, but it wasn't like Klay's been the main focus of the defense thus far in the series. Livingstone and Draymond have really opened us up allowing Klay to excel. He bricked a lot tonight without those guys performing well.\n\n\n>That's not to belittle Draymond's game: he's been very good defensively. Notice that once he was no longer guarding LeBron, his jumper started falling again. Hopefully thats a causality that Lue looks into, but I don't have the analytics in front of me.\n>\n\nDraymond excels in transition threes and exploiting mismatches -- Cavs had better defensive rotation and kept the tempo in their favor today. When he switched off LeBron, the tempo slowed down a bit, letting him shoot more efficient shots. Still, Lue definetly targeted Draymond today\n\n>I hate to make another OKC comparison, but I have to--the Cavs finally brought their defense. More importantly, they used that defense to create offense, letting fast breaks come out of shattered posessions on the other end. Smart, and simultaneously breaks their overrealiance on iso-sets, and Kyrie playing off the dribble against Iggy/Livingston/Klay.\n>\n\nReally the similarity comes from defensive intensity, as well as Kyrie being able to hit outside shots and midrange pullups, very similar to Russel Westbrook's performance in the series. It's just playing good tough basketball, though the Thunder really excelled at making the Warriors test their rim protector in Ibaka, and we've done well to force awkward shots from low efficiency zones\n\n>List of teams of fans that I saw trashing LeBron: Bulls (stop it), Dubs (expected), Nuggets (stop it again), Lakers (Boi). Cut the malarky, people.\nList of teams of fans that I saw trashing Steph: OKC (guys...), Bulls (stop it again), Cavs (expected), Lakers (leave), Pistons (#fuckReggie).>\n\nIdk about the Curry hate, but I've seen *insane* LeBron hate recently. Some guy was heavily upvoted when he said LeBron really isn't a top 15 player and that MJ would always be the GOAT. Another guy was at +2 when he said Steph Curry is the GOAT. A lot of really horrible comments about how they wish he'd never win another ring, especially in Cleveland, and some shockingly mean comments about Cleveland. I'd imagine the same has happened for the Warrior fans and Steph Curry, and I'm glad you pointed it out -- it's exceptionally sucky to the reddit experience and I'm glad you pointed it out\n\n>Igoudala is probably one of the most underrated fucking defenders I've ever seen. Seriously. Watch him work. He has Pippen caliber hands, he's remarkably aware of his own body in space, his timing is (terrifyingly) better than Draymond's, and he knows how to use his weight, and how to balance it to avoid fouling.\n>\n\nHe'd absolutely still be an all-star if he played on any other team or wanted more minutes. He's such an anomaly in sports history -- a top-30 player taking such a low deal to just winnnnn. \n\n\n> Tristan Thompson had a fantastic game. Still not worth 80m's though. Sorry. Had to be said.\n> \n\nIt was either pay this guy 80m or sign some other dude for much less. Thompson is better than the replacement player and has gotten us wins over replacement. While we paid a premium for those wins, it's not the worst thing in the world. Offensive Rebounds are like three point shots in so far that analytics really likes them and they don't get enough attention in game plans. If Tristan gets 5-6 extra possesions to score on and we capitalize on 4-5, we add 10-15 points to the box score, and that's the difference between a win and a loss.|[CLE] Mark Price|12
Tristan Thompson isn't worth 80 million, but he's worth 80 million to the Cavs. |Celtics|1
Yep! |[CLE] Mark Price|1
You can't blame people for trashing Steph this series, he has not nearly been himself.|Kings|9
Hey now.. Lebron isn't 2 for 7 in the finals *yet*|Cavaliers|77
facts. I'll change it tomorrow|Thunder|5
Let's wait until next game to ~~overreact~~ determine that.|[MIA] Alonzo Mourning|22
[deleted]||284
Almost *too* much quality. I suppose it's needed to offset the amount of shitposts elsewhere|Celtics|6
This shit is top notch|Thunder|10
Seriously! Love this in PG threads. Props.|Timberwolves|6
Foreal save that for the Next Day thread m8 ^^^^^^/s|Thunder|4
Thanks!|Thunder|13
Usually I see stuff like this in the Next Day Thread, great job.||4
How much more than 80 million do you think Tristan Thompson is worth then??|Timberwolves|221
Kanter money and not a penny more imo|Thunder|27
Kanter makes more than TT. |Cavaliers|-10
Kanter is better if the playoffs are any indication ||6
Wow we are just shitposting here and you come up with that post. We don't deserve you.|Cavaliers Bandwagon|152
PIPEMAN PIPEMAN PIPEMAN|[MIL] Giannis Antetokounmpo|208
JR's UP TO SOMETHING|Timberwolves|89
WOO! *crows croaking*|[GSW] Stephen Curry|0
JR's UP TO SNIPIN'||1
they been out for 1 or 2 games 'way from cleveland||1
JUST SENT TWO OR THREE TEXTS \n\nLIKE, OH REALLY?|Knicks|2
HE JUST SPENT LIKE 2 GAMES OUT THE CITY|Cavaliers|7
[deleted]||307
https://imgur.com/a/1tmpy|76ers|2
HATE HATE HATE HATE HATE|Knicks|37
Now if you'll excuse me I gotta go put some water in Draymond Green's momma's dish.|[NOP] Anthony Davis|10
Didn't realize how much I wanted Jheri curl Kyrie until now ||121
Shumpert's hairstyles are a wild card, he's your best chance at that happening. |Warriors|2
If enough of us want it hard enough, it will happen. I'll be spending my free time this weekend learning how to merge Kyrie and Rick James.|[LAC] DeAndre Jordan|3
#DAMN HOMECOURT YOU SCARY|Trail Blazers|475
Cavaliers, nice of you to show up for this series! Here's what you missed...|Knicks|-4
We never getting tacos|Bulls|1
#Didn'tLoseBy40|Lakers|1
So 7 Games Series it is then!|[MIA] Alonzo Mourning|1
IT'S ALL WE GOT!!!|Cavaliers|1
The Warriors got Toronto'd.||2
How am I supposed to get my free taco at this rate?|Bulls|4
Both team's roleplayers feed off of the home crowd so much.  It will take a substantial effort from either team to steal a game on the road.|NBA|50
So Warriors in 7?|Nets|1
I need my free Taco!!|[BOS] Evan Turner|1
Game 7 confirmed|Raptors|1
if this goes to 7 with only home wins, perhaps the cavs will put a little more effort in the regular season|NBA|3
it will certainly suck if this series ends up being nothing but blowouts for home teams |Rockets|12
That's largely been the story of the playoffs so far.|[CLE] Kyrie Irving|15
It will be extremely disappointing if we don't get 1-2 games this series that come down to clutch shots in the final 2 minutes in a close game.|Raptors|151
I don't want it to be close. The close games are decided by the refs too often. If the Cavs lose I want it to be because they got outplayed, not cuz some tic tac bullshit||5
Agreed. I saw someone in the game thread say "this series is finally getting good" and I\'m just thinking "what\'s good about 3 games that are over by the halfway mark of the 4th quarter?"|Lakers|7
The Warriors losing |New Jersey Nets|1
Considering I start work at 7 I like getting to go to bed early|Pistons|1
> the halfway mark of the 4th quarter?\n\nThat's being generous for the last two.|Lakers|7
Yea, I put halfway in there because of game 1 since that lead wasn't double digits at the start of the 4th.|Lakers|1
Game 4 I think will be close.|Cavaliers|66
I think Game 4 is another big win for the Cavs. Lots of momentum and still at home. Game 5 is where things will get really interesting.|Braves|-2
Doubt it. I expect GSW gets it going in the next game.|Pistons|1
Warriors had all the momentum going into game 3 and look what happened. I really don't expect the Cavs to shoot that well again and the warriors that poorly. |[GSW] Tim Hardaway|11
Agreed, game 4 will be close.|Lakers|1
I hope so. Too many blowouts in these playoffs. |Lakers|19
WE AINT OUT OF THIS! \n\nHOIST THE GAME 3 VICTORY VIDEO!\n\nhttps://streamable.com/abl3 \n\nEdit: it's likely going to get... More montage parodic as we win our next three games. |Magic|2189
LUHBRON JAYMESSS|Trail Blazers|1
I think I love you |Rockets|1
Upvote *everytime*|[CLE] Kyrie Irving|1
It's good to see this again. Thank you|Cavaliers|1
this is excellent|Cavaliers|1
It's been so long. |[CLE] Kyrie Irving|4
Upvote every time|NBA|6
HOIST IT|Cavaliers|2
OH IT'S BACK BABY|Celtics|2
This is legitimately incredible!!!|Cavaliers|2
Yes! Now lets go hoist it 3 more times this season|Cavaliers|2
I don't know what I'd do without you guys.|Bulls|7
That Kyrie crossover blew out my eardrums|Kings|3
At the very least, I'm so happy we got at least one more of these.|Clippers|3
Hopefully three more after this :\\^)|Cavaliers|4
WE WERE NEVER OUT OF IT. TO THE TOP!|Cavaliers|17
Oh shit, it's on.|Cavaliers|21
KYRIE HIT STEPH WITH THE WOMBO COMBO|[MIA] LeBron James|28
Hoist it boys|Cavaliers|33
**upvote every time**\n\n\n **HOIST IT**\n\n**show respect to the [og](https://streamable.com/1j9b)**\n\n|Kings|192
DO WE HAVE A LIST OF ALL OF THEM??||1
Hotline bling Lelbron is untouchable to me. Usually I skip to the end of a hoist gif to see if this is coming before I watch the whole thing.|Mavericks|1
Was this created when Cleveland came back to wreck the raps after dropping 2 in Toronto?\n\nBecause it's the perfect application.|Raptors|2
This was created really early in the regular season actually. But I see your point.|Braves|8
This video never fails to make me do that laugh where you exhale all of your air with a big wheeze then after a few seconds you actually start to laugh for real.\n\nThat was probably too much info.|Thunder|3
This is the only one I like. Too good to be changed.|Cavaliers|8
i miss the hotling bling switch in the newer ones|Kings|7
[GET HYYYPED SOMEBODY CALL STEPHEN AAAAA!](https://streamable.com/xsfs)|Cavaliers|168
Bro that's 100% Mac from It's Always Sunny in real life. \n\nThat feels like a Project Badass video. ||1
[Source](https://www.youtube.com/watch?v=BDSdiYxuOI0). I think this may be the greatest video I've ever seen lol|Pistons|1
Yes|Spurs|1
This may be the whitest shit I've ever seen. And I've been to a Ren Faire. |Mavericks|2
Lmao is he doing the dance from Napoleon Dynamite?|[CLE] Tristan Thompson|2
Anyone have the link to the original youtube video?|76ers|3
[Source](https://www.youtube.com/watch?v=BDSdiYxuOI0)|Pistons|2
Why does this happen?||4
wut|Thunder|3
this is beautiful\n|Celtics|5
Please tell me there are multiple remixes of this all over the internet.|[MIA] Alonzo Mourning|9
I need to know the origin of this video ASAP...please! |Bulls|11
[Source](https://www.youtube.com/watch?v=BDSdiYxuOI0)|Pistons|1
I did a quick google search of the guy.  He is, basically, an aspiring actor/singer who is slightly crazy, and not very good at acting.  He has some others lovely pieces on the internet if you want to take a look.  [Here](https://www.youtube.com/watch?v=DWDyoO42qIw) is him attempting to establish that he is basically a Captain America clone.  [Here](https://www.youtube.com/watch?v=XFa1cvTfZtE) is him establishing that he is a mediocre actor through a serious of scene.  [Here](https://www.youtube.com/watch?v=kBnbxeIDoSo) is I don't really know what, but you can read some interpretation of it [here.](http://psychoticlettersfrommen.blogspot.com/2009/05/love-story-update.html)  This is just another of a list of a guy trying to make it in entertainment and... failing.  ||9
I wonder if it would be less weird if he wasn't wearing knee pads. Somehow I don't think so.||20
Not it would. Its the sports accessories + business casual attire that makes it weird. |Cavaliers|6
what the actual fuck|Lakers|74
I don't know what the fuck I just watched, but I approve. |Cavaliers|27
GUY'S  REDDIT IS FUCKED UP JUST LIKE CAVS WERE BUT I THINK IT'S GOOD NOW \n\nI CHANGES MY FLAIR AFTER GAME 2 BTW WHICH HELPED GET THE WIN WHICH GRANTS ME +25% TO MY UPVOTE EVERY TIME STAT SO I WILL \n\n#UPVOTE \n\n#EVERY \n\n#TIME|Nuggets|612
SHOULD I BE FEELING THESE 'HOPE' FEELINGS YET?!|Nuggets|2
HOPE ISN'T POSSIBLE UNTIL 2-2 BUT DESPAIR CAN BE GONE|Nuggets|2
OH SHIT YOU JOINED THE BANDWAGON!|Cavaliers|2
FLAIR CHANGE WORKED |Nuggets|1
The fuck was going on with reddit? I assumed it was just me|[TOR] Morris Peterson|3
THE BLIND MAN THAT SEES CLEARER THAN US ALL |Mavericks|3
The GOAT right here|[CLE] Kyrie Irving|4
ALMOST COULDN'T FIND YOU BUT HOLY SHIT YES THIS CONFIRMS CAVS IN 6|[CLE] Sergey Karasev|10
ALL ABOUT WINNING ONE FOR THE LAND|Nuggets|7
YOU HAVE BLESSED OUR BANDWAGON FLAIR AND HAVE HELPED US ACHIEVE VICTORY.|[CLE] Kyrie Irving|157
C A V S I N S I X|Nuggets|96
soi have no idea wtf is going on in this thread|Celtics|2
