ESPN is literally talking about the refs, Steve Kerr did nothing but bitch about refs, klay Thompson is bitching about the refs... How is LeBron James the bitch? These guys can't take a loss and Ayesha curry fuck! Cleveland please fuckin win. |Cavaliers Bandwagon|31
are we going to pretend like they would've called a 6th foul on lebron or kobe in the final 5 mins of the game?|Lakers|-1
are we going to pretend like Curry isn't a favorite of the NBA? he's constantly got a lot of benefit of the doubt calls these last few years.  Stupid on him for getting that aggressive with the refs calling fouls left and right on both teams.  Watching how quickly they put fouls on Love should've been notice to everyoen that it was gonna be a quick whistle.|Pistons|1
fouling love helps the cavs lol|Lakers|1
no argument, I was more commenting on the fact that tone of the reffing was set pretty early.|Pistons|1
GSW feelings got hurt|Spurs|5
Steve Kerr calling out Cavs players for flopping and yet he has Anderson Varejeo on his team.|Celtics|23
Kerr: "I\'m happy he threw his mouthpiece"\n\nKerr\'s gonna suspended along with Curry. |[CLE] LeBron James|12
damn good game cavs. you guys buried us in the 1st and that was the difference. nothing to do with refs. even if people believe calls were one sided, that wasn't why we lost. 31-11 is why we lost.\n\nwe are gonna come out firing in game 7 and hopefully we get a close game.|Warriors|22
This. Dubs out scored the Cavs by 6 the rest of the game.||1
Whoa... A logical Warriors fan... Jesus tits, they do exist.. \xf0\x9f\x98\xae||7
I love seeing level headed fans. I'd buy you a beer|[CLE] Kyrie Irving|9
i mean i am not gonna assume we're done after this game. but we played y'all very well after the 1st and were able to steal some momentum for some decent runs. if not for the first quarter, this game would have been decided by less than 5 (one way or another). \n\ni think this series puts an emphasis on why it is important to try to be the best regular season team. if we were going to cleveland for game 7, this series would basically be over. but our home court advantage is pretty salty and our bench has a notorious reputation for showing up at oracle.|Warriors|3
[removed]||77
[removed]||-1
Cavs only shot 3 more FT's. ||8
So LeBron's game has to be one of the greatest single game finals performances ever right? Do you guys think it's top 30? Top 20?||5
Wasn't his last game better? |Warriors|1
In as much as it hurts to say it, good game by the Cavs. Hopefully the Dubs win game 7.|Warriors|6
Kerr gon get fined|Rockets|5
Game 7's are usually always blowouts, but at the same time it's at Oracle but Clelveland is 1 game away from a title and that means CLeveland is going to play like their lives depend on it. This shit will be a good game I feel, but I think Cavs might barely pull out with a win, even though I want GSW to win It's hard to see Cavs lose now with all their effort.|Spurs|6
Plus cavs have won at their own homecourt in an elimination game, which is close to the intentisity of a game 7.|Cavaliers|0
Lebron James. Legend. A man amongst boys.|Trail Blazers|4
I didn't see the press with Kerr. Can someone tell me if when he said Curry's fouls were inappropriate, did he mean BECAUSE he was MVP or did he mean an MVP shouldn't commit fouls like that?||7
They were ticky tacky.  As a ref u have 2 choices.  Let them play or call ticky tacky fouls.  For the most part refs let them play, but there were a lot of ticky tacky calls that were like what?!||1
https://www.youtube.com/watch?v=J413mcMFRqA Kerr postgame, if curious.|[CLE] Mark Price|2
Because he is the MVP||2
I'm honestly not sure. But leaving it open ended like that doesn't look good.|Suns|2
BECAUSE he was the MVP. Basically you can't foul the MVP out on calls like that.||5
Because he was MVP they were bad calls. That's what he's saying||5
Damn then that's fucked up||2
It would be except for the fact that LeBron gets that treatment||1
Curry: I'm worried because LeBron is the best basketball player in the world!|Heat|6
True||1
The Chosen One is finally fulfilling The Prophecy from 2003.||6
It's about damn time|Cavaliers|1
If game 5 was given to the Cavs to extend the series, game 6 was *taken* by the Cavs. Right from the start, they were switched on and ready to fight. Warriors looked a bit stunned, as if having Green back in itself was going to secure them another easy win.\n\nReally can't wait for game 7 now. Great series!|Timberwolves|7
Can't believe they're blaming refs when Warriors missed their first 7 or 8 shots. ||3
I'm rooting for the Warriors but the refs didn't cost them the game, their bad habits did.  \n\nThey gambled on steals, swiped at balls in the back court, shot hero shot balls, and just didn't get back on defense.  \n\nEvery run they made was ended by one or more of those habits and that's why they lost.    |Lakers|12
This. You're losing and you're jacking up contested 30ft shots? Why?|Clippers|1
I think it looks really bad when a coach is trying to call out players on the opposing team for flopping like Steve Kerr just did in the post game. Varejoa is on you're freaking team dude. Not to mention curry has been flopping quiet a lot this series, and it was a foul. Pompous as fuck. ||11
I'm losing respect for Kerr right now.||15
I lost respect for him earlier in the series. |Rockets|1
Shitty that we've lost two straight but so proud of the comeback the Dubs put on. Great couple of games for the Cavs, this game 7 is gonna be brutal|[GSW] Andrew Bogut|45
I hate it when any team i root for is playing the dubs. I don't stop holding my breath unless we're up by 30 in the 4th, and even then i wouldn't be surprised if they came back. |Heat|2
That end to the 3rd quarter scared the shit out of me|Cavaliers|4
I really thought this was going to be a 30 game blowout, so it was impressive to see the Warriors come within 7-11 points behind the Cavs. |Hawks|3
I got out of an exam during halftime (I'm in Australia), looked up the box score and facepalmed|[GSW] Andrew Bogut|2
JOIN THE DELLY SIDE OF THE FINALS |[CLE] Matthew Dellavedova|9
I know this thread will all be memes so I'll give my assessment of the game:\n\n* Not having Bogut is killer. LeBron carved the paint easily.\n\n* Warriors shooting was garbage, aside from Curry. No more explanation needed.\n\n* Thompson was godlike on the glass. Best player on the court besides LeBron.\n\n* Love was effective in limited time.\n\n* Draymond Green complaining all game long (screaming) shows who the real bitch is.\n\n* Steph Curry *should* be suspended for throwing his mouthguard into the stands. Any other player at any other point would be suspended. He won't be.\n\n\n**Side Note outside of game**\n\n* Ayesha Curry calling the Finals rigged for ratings is probably the funniest thing of this entire series.\n\n|Heat|95
> Any other player at any other point would be suspended.\n\nlol you can't be serious with this|[DAL] Rodrigue Beaubois|1
Lebron could fill a Gatorade cup with piss, and toss it into the crowd, and there's no way he'd be suspended game 7. So I'm not buying that any other player would.|Celtics|1
Good looking out fam.||1
what is bogut status for next game|Heat|5
#OUT OUT OUT|[LAL] Smush Parker|3
Out|Cavaliers|4
He is out for 2 months minimum.|Heat|14
So you're telling me there's a chance...?|Celtics|1
thanks.|Heat|6
So....you're saying theres a chance.|Lakers|8
How many overtimes do we need in Game 7?|Heat|6
0.|Cavaliers|1
24 hours * 60 minutes/hour = 1440 minutes in a day. 1440 times 60 for two months is 17280 minutes total, divided by 5 since 5 minutes per overtime quarter....3456 quarters of play until we get BOGUT BACK CAVS FUCKD!!!\n|Lakers|6
Obligatory /r/theydidthemath |Celtics|0
I mean I'm down if you guys are?|Heat|2
My body is ready|Lakers|3
Why would anyone be suspended for throwing a mouthpiece? Unless you're saying he specifically threw it at a fan? And either way I don't see how that could possibly be an automatic suspension for anyone. |Pistons|2
> Steph Curry should be suspended for throwing his mouthguard into the stands. Any other player at any other point would be suspended. He won't be.\n\nI'd agree in any other game.  But game 7 of the Finals between GOAT-status Lebron and the winningest single-season team of all time?  No.|Celtics|9
[deleted]||-3
Good thing you don't know the rules then, because this is a fine not a suspension.|Celtics|2
> I'd agree in any other game. But game 7 of the Finals between GOAT-status Lebron and the winningest single-season team of all time? No.\n\nShouldn't give preferential treatment to a player just because of the situation. People have been suspended for it before, and it'd be bull if Curry isn't suspended for it now.||4
I would really like to know who was suspended for it and if there was a rule for it?\n\nI don't want curry to be suspended because I want to see an epic game 7, and if the championship is going to mean anything the MVP has to be playing.\n\nEdit: The only case I could find for someone being suspended was Amir Johnson in 2012. The difference being he threw it at the ref instead of at the stands... It was also a much weaker throw.\n\nhttp://www.nba.com/2012/news/12/11/torontos-amir-johnson-suspended/||2
Udonis Haslem was suspended for a playoff game for chucking his mouthguard. It was actually more innocuous than Curry's.||2
The last incident of a mouth guard toss I\'m aware of was Enes Kanter chucking one into the crowd in 2014. He was not suspended, but was given a tech and fined 25 grand. So precedent for suspension isn\'t there and nobody wants to see game seven without the best players on the court.\n\nThat said the NBA is wrong on that one. While a drool covered mouth guard flying into the crowd is probably more "gross" than "dangerous" if the chances of it being potential hazard to a fan is any non-zero number no matter how low, and I imagine it is, a player who does that must be removed from the game immediately and suspended. On court players being any potential hazard to fans at all is unacceptable. \n\nThis doesn\'t make Steph suddenly a super-villain IMO, he certainly has a longer resume of being a good rep for the league, role model, whatever you will. But he\'s gonna get a lot of flack for that incident in the coming weeks and he deserves it, and no matter what he thought of that sixth foul call or how sick he gets of being asked about it his answer needs to be nothing other than, "I was completely wrong to do that, I\'m sorry, and nothing like that will ever happen again."|Pacers|5
No fucking way should Curry be suspended, I'm rooting for Cleveland but that would be the biggest disgrace in sports if they take out the biggest key player for something so chicken shit and meaningless.|Clippers|7
To be fair, he was the chicken shit in that situation.|Cavaliers|1
>Love was effective in limited time.\n\nMaybe on offense, but once again, dude was a massive liability on defense. He just doesn't know how to guard klay/steph. He is either over aggressive or not aggressive enough and creates a lane for them to drive in. |Heat|7
Exactly, Klay's run in the 3rd quarter was all pretty much due to Kev making dumb plays on defense |[CLE] Kyrie Irving|3
I disagree. He wasn\'t horrid in this game compared to his other games and I think he actually did a great job of boxing out for Defensive boards which is an underrated "stat".|Heat|3
I'll agree with that, he wasn't letting smaller guys get the best of him in the paint for rebounds like he did in game 5|Heat|3
LeBron is undisputed top 5 to ever play even if he never wins another title||24
Top 2|Cavaliers|3
I don't know if it's recency or what but I'm fully convinced he's better than Kobe|[SAS] Tim Duncan|10
of course he's better than kobe lol. not even a question at this point.||1
Bryant is a better volume scorer. That's it. LeBron is superior in every other aspect.|Cavaliers|8
This is the defining line. Not only is he better in other aspects, he's leaps and bounds better.|[SAS] Tim Duncan|6
Really not a question. |Supersonics|9
Sets the stage for the most anticipated game in NBA history. That's right, I said it.|Knicks|20
That the NBA wanted. And made happen. |Mavericks|-1
ok ok, easy there|Bucks|1
I dunno, these Finals have been pretty damn boring. No game has ended within single digits.|Lakers|4
either the Cavs come back down 3-1 to beat the team with the most wins ever or the Dubs cap off arguably the best season of all time against a basketball cyborg whose settings are cranked through the roof right now. \n\nI dunno man, this game is about to be bonkers.|Wizards|1
Yeah, the stage that has been set is pretty exciting, but the games themselves have just not been very interesting. They've all been one sided and the reffing has been so frustratingly inconsistent. It has been pretty hard to stay engaged while watching.|Lakers|1
Just because neither team has been consistent doesn't mean this hasn't been a great series with historic implications|Bulls|3
I understand that, but the games themselves have just not been interesting to me at all. A team usually gets a double digit lead in the first quarter and keeps it the whole time. Game 6 was the most exciting but that got shut down pretty quickly when Steph got his 6th foul.|Lakers|2
I mean the dubs came pretty close to cming back, it was definitely a nailbiter there for a bit, even if the lead never got below 8. |Heat|2
This has been the most exciting game so far. But the first half was a massacre, and the last couple minutes after Steph Curry fouled out (bullshit call btw) were pretty much garbage time. There was like 1.5 quarters that were fun.|Lakers|2
2010 Game 7?|Thunder|3
I'm glad Draymond sat this game out to allow LeBron to score 41 again|Cavaliers|20
If he stayed on he would have done something to get suspended for Game 7|[GSW] Marreese Speights|2
LeBron James, the poor kid sleeping on a couches in middle and high school vs. a privileged pre-madonna Steph Curry in game 7. I for one vote LeBron. Dude has fought against the odds and haters. Curry reminds me of all the rich entitled kids I grew up playing against. ||20
That's bullshit. I'm a Lebron fan first and foremost but let's not act like just because Steph didn't grow up poor that he didn't work his ass off everyday to get to where he is now. I watched the whole game and even I thought that last foul against him was absolute nonsense. Let's give credit where credit is due and not discount a player just because they had a moment of well deserved frustration and anger. ||1
No one is discounting anyone. Lebron James literally represents the american dream. Came from nothing, had no father in his life and a drug addict mom and grinded it out to make it to the top. Sure hes athletically gifted, but you can't obtain his athleticism sitting on the couch eating cheetos. Steph grew up in the NBA. He was playing 1v1s against Vince Carter as a kid. You tell me which situation is more likely to make it to the NBA. Yes Steph worked hard, but he simply had more opportunities growing up than Lebron.  Dude literally is a rags to riches tale and he did it with hardwork and talent. What is even more telling, he did this all with ridiculous expectations(and criticism) and he met and even exceeded them. Don't get it twisted, I respect both Steph and Lebron for what they have accomplished. But to compare the adversity that Steph has faced with the adversity that Lebron has faced is downright disrespectful. ||3
Yet Curry's entire story is one of redemption. No one expected him to be where he's at. He had such a struggle, y'know being able to practice in NBA gyms as a youngster is tough!\n\nPlease. |[CLE] LeBron James|3
Lebron won the genetic lottery thou.  Curry probably spent 50,000 hours perfecting that jump shot.   Both work hard.||5
Lebron works hard too, talent doesn't always mean you'll be the best player without some hard work.|Cavaliers|0
Just one of the reasons I love LeBron. I live about 30 miles south from where LeBron grew up. My son made it out of the hood too with some help from college football. I too was a teenage mother. You can't believe how happy I am for LeBron. ||5
*scans*  \n  \nPrimadonna. Not the singer before her first recording contract. |Charlotte Hornets|9
Haha, thank you||1
Take this W||2
LMAO at all the people crying "RIGGED" in the game thread|Suns|14
Acting like this didn't happen as well: https://streamable.com/ij5z|East|3
God, angry Warriors fans are the best |Celtics|15
I know right? I have an erection just imagining all the warriors fans crying themselves to sleep tonight. |Lakers|1
NBA, why are you making us choose between Game of Thrones and Game 7?|NBA|36
GOT is less scripted...|Lakers|-4
I want to believe in an un rigged and un biased nba so much... But with every single series playing out exactly how hypothetically the nba would make the most $ off of... Its hard.|[CLE] Kyrie Irving|3
Your flair (cle not Kyrie, love him) say down vote, but your words say up vote. \n\nAlso it was meant as a joke (somewhat) but going by my negative votes people didn't like it.|Lakers|1
Or you know....  sports.  Kind of a winning formula.|Bullets|1
G7 or Money in the Bank*\n\nG7 wins all day though. |Bulls|1
You got it easy. People on the other side of world like me have to decide  between game 7 or going to work. With a big contract on the line. ||1
SNOWBOWL VS NBABOWL\n\nSrsly tho, ball is life|Bulls|1
No conflicts if you live on west coast|Lakers|1
Dvr|Dominican Republic|1
Battle of the Bastards and Game 7. GET HYPE! |Celtics|1
That's what I'm saying! I'm watching GoT m catching the 2nd half||2
I'm a huge GOT fans and episode 9's are usually epic but c'mon man you can just stream it later.||2
This is why DVR is a thing.||2
As if there's a choice. GoT is on HBO Go, Game 7 of the NBA Finals is only live once.|Clippers|5
Its not even a choice man, there\'s this new thing called "on demand." Watch Game of thrones later.||38
HBOGO is the shit.|Raptors|2
HBO GO is the worst streaming app ever. Can\'t add an entire series to your watch list. No "watch next episode" button. \n\nHBO GO is not the shit. ||0
It's got Game of Thrones on demand. \n\nThat's all I fuckin care about. Especially this Sunday. \n\nAlso, the next episode prompt comes up when the show gets towards the end.|Raptors|3
Guys I think the lion is awake|Rockets|9
Rawr mutha fucka|Cavaliers|1
don't care if cavs win game 7 or not, Lebron has successfully defended the land and proved that he's still the king|Clippers|9
exactly dudes still the best player in the leauge folks saying curry the best LMAO||1
sad part is, if he loses game 7, even if it's close, all people will say is 2-5 and completely disregard the performance he's put on....still can't understand why he gets so much hate |Celtics|2
I'm actually amazed. People really think this series is fixed. I don't have any words|Bucks|10
Yeah the refs really helped Cavs open a 20pt lead in the first.\n\nPeople are so dumb.|Cavaliers Bandwagon|3
Even if GSW win Game 7, I still feel they don't deserve it. \n\nI felt OKC outplayed them 24 quarters out of 28 quarters in that WCF series.\n\nNow in the Finals, I see that Lebron and Kyrie are much, much hungrier and showed more heart than anybody on the Warriors team.  ||10
If they don't deserve the title after winning Game 7, who does?|Wizards|1
I feel like heart and hunger play no factor in winning finals games. Do you really think Curry wasnt hungry for the win tonight? Or that Lebron wasnt hungry every single game last years finals. Eveyone at this point wants to win no matter what. Thats why the refs are getting abused by the players. Either team deserves to win its just that you forget about the first 2 games where they destroyed the Cavs for the whole game|Celtics|2
I'm just sitting here in the office, upvoting everything.|[CLE] Shaquille O'Neal|10
Except for the Warriors fans complaining about the refs I hope.|Cavaliers|2
[chucks it up]|[SAC] Oscar Robertson|2
I'd like to take this time to ask the basketball gods to please allow LeBron to have a monster game 7 and win one for the land. Also basketball gods, if I'm not asking too much, could you please make Curry have a bad game? Amen.\n|Spurs|10
Can i ask the basketball gods for a monster game by both lebron/curry followed closely by insane shots from kyrie/klay and unexpected clutch shots from both benches 39 lead changes and 69 ties defensive physicality and jabbering ending in double ot and not care who wins?I just want 1 game out of 7 to be competitive throughout 4 quarters.||2
Lebron played amazing, but I really think Tristan Thompson deserves a shoutout for his play. Dude is all hustle. |Cavaliers|10
He is a fucking monster, his dunks are just downright heavy. I'm really impressed with his play this series||3
I'm not gonna get much sleep before Sunday. This feels like the apex for Lebron in terms of legacy. I know the Warriors are at home but I feel like Lebron is on a mission and there's nothing you can do. |Knicks|9
[deleted]||5
He fouled LeBron twice on the play he got ejected.|Cavaliers|1
GS played like the kids at my gym lmao |TrailBlazers Bandwagon|6
Barnes's agent might need some new clients. ||5
Never forget the day after game 4 aka the time /r/nba went full retard|Cavaliers|5
inb4 ayesha gets hit with a technical for this tweet http://i.imgur.com/fhmI13v.png||7
If LeBron scores 40 again and wins next game surely he would be the undisputed all time 2nd best ever.|Thunder|5
It would be hard to argue against it but he will never be #1.|Jazz|2
But would you vote Draymond for finals MVP? /s||2
So after 6 games Lebron is at the top of BOTH teams in scoring, assists, rebounding, steals, and blocks. \n\n\nJesus Christ. \n\nOne day, we are going to brag to our children and to our grandchildren that we saw Lebron in his prime. \n\n\n|76ers|4
Kerr getting fined for this lol|Cavaliers|6
You come at the King, you best not miss.||5
Why does he keep saying that the mvp of the league shouldn't get calls on him? I agree that at least one of those calls wasn't a good call but it shouldn't matter if he is mvp or not? ||6
I legit don't understand how people are going to talk themselves into wagering on game 7. JVG said the Warriors would be heavily favored at home and I understand why but holy shit, good luck slowing down a pissed off 4 time MVP with a hobbled Iguodala.||6
Without bogut though, the warriors don't have any rim protectors other then the flopper varejao. Lebron was just eating up the paint tonight.|Cavaliers|2
Now golden state knows how OKC felt||6
Fuck yes! King James brings down 41 pts again |Cavaliers|6
JR Smith is such an entertaining personality, lol.||6
Thanks Lebron now I can't watch Money in the Bank this Sunday.|Pelicans|6
Very low key, Steph set the record for 3s made in a NBA finals|Nets|6
I'm almost certain Kyrie is a Ninja, I bet his resting hear rate is sub 45 BPM. ||4
So if the Cavs end up losing on Sunday (not saying they will) will LeBron still be known as "choker"? I personally have never really considered him a "choker", but I just wanted here your thoughts. |[POR] Damian Lillard|6
No. But a 2-5 record in the Finals in unshakable. MJ was 6-0, Kobe was 5-2. So... Yeah. ||-2
"EXACTLY."\n\n- Robert Horry|[SAC] Oscar Robertson|1
Yeah NBA finals are all that matters.  Jerry West 1-8 and is the logo.  Bill Russell 11 rings, in his 13 year career, and everyone puts him over Jordan right? Rings matter big time but the "rings are the only measurement" fans don\'t know anything about basketball.  Lebron has so much work to do to be the greatest in any book but no matter what happens he\'s a great player and 30 years from now his finals record won\'t be the only thing remembered when people talk about him.  He\'s the best player in this generation.  \n\nBy generation I don\'t mean greater than Kobe or anything like that either (I\'m a big Kobe fan too) because he will play at least 5-6 years if not more longer than him.  I do love people not giving Lebron credit though and acting like Kobe and MJ did it all by themselves.  Remember 2010? Kobe folded in game 7 and Pau, Andrew Bynum and Meta went off for the lakers to win.  Espically Bynum and Pau ( their length killed the Celtics). Meta even hit the game winning three in game 7.  Revisionist history man, we all love to do it.  Great players often have great help.|Cavaliers|2
only the morons on facebook will say that|Lakers|2
Anyone who thinks that still is an idiot.||4
Dumb.  I don't care how many rings you have or how many times you've failed to get a ring: Making the NBA finals is not a joke, nobody can take that away from you (unless you're Barnes or KLove...).|Warriors|4
Glad to see I'm not alone \n\n>unless you're Barnes or KLove\n\nlol|[POR] Damian Lillard|3
I don't know about anybody else, but it looks like Golden State has nothing left in the tank.\n\nIggy's banged up, lots of their guys missing easy shots and just a general lack of drive. On top of that, i think the Cavs are in their heads too. Lots of really dumb fouls taken by the Warriors tonight. \n\nGolden State may have won the physical battle through the first 3 or so games, but it looks like the Cavs may have won the mental battle in the next 3. That looms large, especially when you have to go up against a pissed off LeBron.|Raptors|4
Warriors hit a 3, get a stop, get a another 3 to start the game and the crowd starts going bonkers, their swag will be back at 1000. ||5
Yeah, but Cavs have been halting their runs and subsequently managing the crowd effect really well this series. |Timberwolves|2
True theyve hit timely shots. Just saying I wouldn't favor the cavs with the warriors at home. Unless Iggy can't play, then they're in big trouble ||1
I favour Cavs if LeBron's outside shot is dropping...but it's impossible to predict if that'll be the case. |Timberwolves|5
