Loosing in the finals is better than loosing in earlier playoff rounds.|Rockets|14
Who was better?||1
Michael Jordan?? |Raptors|1
I've been around a long time. \n\nI saw the 96 Bulls in person. \n\nLeBron is the best I've ever seen. |Suns|44
MJ never had a 2011 meltdown like LBJ. Watched them also, MJ is the best in the Playoffs and Finals. That fire never dies. ||0
Agree, MJ may be the best pure shooter I've ever seen, but the best all around player is Lebron. To me, that makes him the greatest player ever. ||5
It's just the all around impact he has.|Hawks|30
It is. There's been nothing like it, ever. |Suns|21
I think the point is that even if Lebron is better than Jordan was, he hasn\'t proven that confidently enough to overshadow Jordan\'s greater career accomplishments (and I don\'t just mean rings). \n\nBut he\'s definitely on pace, if he maintains anywhere near this level of play through the coming years. Plus, if they do take game 7, beating the "best team ever" is a HUGE feather in his cap as far as legacy is concerned.|[BKN] Markel Brown|14
One of the best individual Finals performances ever imo |Mavericks|178
It rivals last year from him. Which is fucking insane.|Lakers|1
Can we rename the FMVP trophy after him already?|NBA|3
Along with last year's. The man is an absolute machine.||3
I mean last year he almost averaged a 30 pt triple double his team was just maimed |Bulls|159
He's almost doing that this year and he's doing it way more efficiently. More points last year though |Heat|1
This year with a healthy cavs....|[CLE] Kyrie Irving|2
Both he and his team dominated tonight and got in the Warriors' heads. |Mavericks|5
efficiency is much better this year|Cavaliers|32
Efficiency is so hot right now.|Bucks|5
I can't even blame him for the bad efficiency last year. When you're scoring option 1,2, and 3 for a team you're going to have to take some shitty shots. |Cavaliers|10
There's no question, putting up those numbers is incredible regardless of efficiency. \n\nBut putting up those same numbers efficiently, while still leaving plenty of offensive touches for teammates that are actually performing this time around (and then making a greater defensive impact with the added stamina of taking plays off on offense) is even MORE impressive.|[BKN] Markel Brown|7
Defense too|Hornets|13
Flashbacks for Detroit fans.|[CLE] Kyrie Irving|421
Draymond was a Detroit fan!|Trail Blazers|3
He grew up in my hometown.  I've tried so hard to like him just because of that.  It was hard, then I remembered I didn't like most of the people from my hometown.|Pistons|3
That's cold man.|Pistons|4
Come on, man, I was in a good mood.|Pistons|4
:( \n\nDude is fucking great|Pistons|7
Die. |Pistons|6
This one was a *lot* more fun for me to watch.|Pistons|9
I was driving on 75 in downtown Detroit during the game, listening to it on the radio. Flashbacks so intense I almost drove into a wall. Flight of the Conchords were great tonight though so I can't complain. \n\n\n|[DET] Smush Parker|17
Not even mad|Pistons|30
lost my vcard seeing those stats||2
Nope|Pistons|5
I've just come to accept that we're LeBron's bitch.|[DET] Chauncey Billups|461
He is LeBron. We are LeBitches.|[SAC] Rudy Gay|1
Same man ||1
You and us both friend |Hawks|2
I'm not a bitch I'm a grown man with 4 neices and nephews.|Mavericks|3
Game of Thrones rules. He murdered our heroes and you can either die with them or witness greatness. ||4
We are all Lebron's bitch on this blessed day|Lakers|6
Speak for yourself.|NBA|1
I am ALL LeBron's bitch on this blessed day.|Heat|2
Is it ok that Im rooting for the Cavs even though it's Cleveland and LeBron is an OSU fan? I'm looking for a release from my self hatred. |Pistons|12
I just want to see Cleveland win one so Lebron can get that damn monkey off his back. That and if Warriors win this series, we will be hearing from GSW fans that this is the GOAT team. \n\nWhich is bull shit because OKC would\'ve won the WCF if NBA showed an ounce of favoritism to them that they have shown Cleveland. Dray should\'ve been suspended for the kick or at the least, the trip. The Lebron James "cock punch" suspension was crap though.|New Jersey Nets|4
I've been rooting for him for years now, not even all of that can force my hatred for Ohio to overcome how great it is to watch this man play.|[DET] Chauncey Billups|11
We all are |Bulls|308
Not us|Heat|1
Yup.\n\nBut he was our bitch for a bit |Celtics|1
Speak for yourself|Spurs|1
Unless your the Spurs then it is the other way around.||1
Except if you are Dallas or Spurs.|New Jersey Nets|2
Even us, strangely.|Cavaliers|3
u right|[DET] Chauncey Billups|3
We are all LeBron's children. |Supersonics|9
I thought he only had 3?||1
WITNESS|Cavaliers|204
BITCHNESS|Cavaliers Bandwagon|1
WITNESS ME BLOOD BAG|OKC Hornets|2
ES|[CLE] Shaquille O'Neal|2
This just fucked your team http://i.imgur.com/ugNuoUe.jpg |Clippers|296
p siq threads tbh|Pacers|3
Is LeBaron effay?|Lakers|4
I want that outfit badly|[LAL] Smush Parker|23
[Ayesha Curry on that hockey mom tip](https://twitter.com/ayeshacurry/status/743648744860639234).\n\nEDIT: She deleted the tweet: http://i.imgur.com/jFy4jgI.png|76ers|585
She is straight up making a fool of herself. She is just passionate which is fine, but she should stay off the twitter during NBA play offs I think.|Cavaliers Bandwagon|6
Is Ayesha taking lessons for twitter shit talking from Miko Grimes? Wasn't this the same chick who was bashing chicks for dressing scantily clad on IG/twitter? lmao, at least those hoes don't post dumb conspiracy theories when things don't go their husbands way|Thunder|6
deleted lmao|Thunder Bandwagon|12
What did it say?||6
https://i.imgur.com/Zi3SlAR.png\n\nCourtesy of /u/AttachRod.|Trail Blazers|9
they should have never given her a phone|Lakers|2
Oh my goodness, that's ridiculous. What a crybaby.|Clippers|197
[deleted]||-5
What shit? Losing fair and square?|Hawks|6
[deleted]||-25
No one is acting like that,he grabbed LeBrons hand clearly on foul 6 and then goes after the ref, don't try to spin that|Suns|20
golden boy|NBA|1
yeah #6 was ticky-tack but probably legit. the kyrie foul was garbage tho.|Bulls|15
That is completely true|[CLE] Kevin Love|9
I'll give you the 5th, but he got Lebron on the arm how is that not a foul? Or you just think it shouldn't be called because he has 5 already?|Cavaliers|7
He never said they weren't bullshit calls. Because they were. That's the game, Cavs have had shit calls, so have the Dubs. Fact is if the Warriors hadn't laid a goose egg in the first then we very well might be crowning them right now. Calls go both ways, no point in complaining about it. |[CLE] Matthew Dellavedova|17
Was probably mad about Steph picking up that sixth foul for getting elbowed in the head by Bron||1
Oh come she sounds just like one of us |[CLE] Matthew Dellavedova|1
What did she say? Tweet has been deleted|Warriors|1
What did it say? The tweet has been deleted|[HOU] Yao Ming|1
What did it say it's deleted I think||1
What did she say? Link is dead|Clippers|2
She said the league is rigged for money|[WAS] Bradley Beal|2
Thanks|Clippers|2
It's fine cause it's a man's game|Lakers|7
Very classy stuff|Cavaliers Bandwagon|29
It\'s ok because she said "sry" \n\n/s|Wizards|7
What did she tweet?  It was deleted.  ||11
"I\'ve lost all respect sorry this is absolutely rigged for money\xe2\x80\xa6 Or ratings in not sure which. I won\'t be silent . Just saw it live sry."||33
Eh, it's not that bad. Wives, pretty much like any other huge fan, can say hasty and regrettable things.|Celtics|2
Wow lol what a whiny bitch.|Thunder|3
She says she won't be silent, then she deletes it cuz she can't handle the heat.|Cavaliers|27
Or some team PR rep said OH SHIT AYESHA DELETE THAT SHIT|Jazz|8
Very likely. She's probably the biggest problem for Steph's PR team.|Cavaliers|15
You mean the Cavs|Raptors|19
she just deleted it. the comments on that tweet were fucking hilarious\n\nESPN ALREADY TALKING ABOUT IT. HAHAHA, cant delete it now mrs curry|Bucks|8
Is she serious lmao|[IND] Rik Smits|53
The replies to that tweet are golden.|Clippers|13
Lol "your husband is cheating on you" |Heat|28
SMH. Biting the hand that feeds. Sad!||87
Ayesha Curry is a mess. A big fat mistake.|[LAL] Smush Parker|11
her man doesn't even show that anything bothers him, always trying to be all chill and cool but nope not today, even his girl saying shit on tweeter||3
Wives of pro-athletes shouldn't have a twitter account|Mavericks|14
Savannah Brinson (LeBron's wife) has a twitter account and she tweets about herself doing deadlifts and stuff man. Pretty awesome.|Jazz|18
Haha well she may be the exception|Mavericks|7
Those replies are godly haha|NBA|15
She's totally salty right now.|[LAL] Kobe Bryant|172
[deleted]||-12
It was a close play but not a very smart play by Curry in general.|Cavaliers|12
What'd she say?\n\nEdit: Nvm she said the league's rigged|Celtics|1
Damn, looked at the link late. Anyone have a mirror of the tweet?|[ATL] Pete Maravich|4
https://i.imgur.com/Zi3SlAR.png||3
What did it say? She deleted it. ||4
Some things along the lines of how the game was rigged for money/rating reasons.|[LAL] Kobe Bryant|4
mirror https://i.imgur.com/Zi3SlAR.png||11
https://pbs.twimg.com/media/ClH8YLSVYAAsCQy.jpg|Heat|21
mirror \n\nhttps://i.imgur.com/Zi3SlAR.png||66
"I won\'t be silent"  *deletes tweet*|Braves|1
DELETE THIS||2
on it||1
its a joke by the way. ||1
i'm sweating||1
Thank you!|Trail Blazers|3
you're welcome||2
Taking the high road once again.\n\n[Edit: She deleted the tweet. Here it is](http://imgur.com/1GT1JwT)|Timberwolves|225
>rigged for money...or ratings\n\n[Por que no los dos?](http://www.relatably.com/m/img/why-not-both-meme-gif/82733-why-not-both-meme-5LvD.jpeg)||1
Lmao Brian Donworth|Thunder Bandwagon|1
I dont think anyone on the warriors knows what the high road is. Theyve been bitching for the last two games and got roasted |Cavaliers|12
Yeah only Lebron knows what the highroad is anyway, he pointed it out himself.|Lakers|-15
Yeah now she's blaming her reason for the tweet on cops being racist. I'm not making that up.|Thunder|8
Pls provide proof. That sounds unbelievable lol|Celtics|2
she really did. she said the cops racial profiled her dad. \n\n>Police racial profiled my father and told him to remove credentials and tried to arrest him. It's been a long night for me. I apologize:\n\nhttps://twitter.com/ayeshacurry/status/743656952710967296||11
When in doubt, double down|NBA|5
Hahahaha "your husband is cheating on you"\n\n\nwtf is up with people on twitter|[CLE] Shaquille O'Neal|14
"Your husband is cheating on you" \n\nlmaooo|[CHI] Luol Deng|70
Real talk, is this a real thing, because I was looking at dumb memes on Instagram after all the games this series; and there\'s been a lot of posts supposedly circling a girl singled out as "Steph\'s sidepiece", even sitting like 2 seats behind Ayesha Curry at a couple games, lol\n\nIs this a legit rumor?|[SAC] Oscar Robertson|2
No|[CHI] Luol Deng|1
>dumb memes on Instagram \n\n||5
Dead|Mavericks|1
hahaha from the ted cruz fan no less|Bullets|2
that's cold as fuck|Warriors|2
Chef Curry with the salt. |Lakers|157
Man, she's lame af.|Pistons|3
Wonder what she thought of last series |Bulls|105
[Damn good television.](https://storage.googleapis.com/vidsums/e664250f-f491-4726-b7cb-dcf2ed4cd5fa_text.gif)|76ers|1
She belongs here with us on r/nba. Come join us Ayesha!!|Grizzlies|52
When Steph finds out he's gonna throw his mouthpiece at her |[HOU] Tracy McGrady|490
too soon||2
She already deleted it.  Maybe he'll never know.  The rumors will be there for years though... haunting him.|Supersonics|5
she'll t his ass up and make him sleep on the couch tho|Bulls|11
Steph looks like he's pussy whipped.|Cavaliers|134
She probably approved the final design for his shoes. |Kings|179
best reply "curry stop tweeting from your girls phone"|Bucks|223
Gotta love CashNasty man|Thunder|4
Someone please upload the Lebron highlights! As a Bulls fan I despised Lebron for years but wow... he made the Finals his showcase, MJ style. It was a privilege to watch that game. Just completely took over in the 4th - it was like he looked at his teammates and said "Alright fellas, I got this. Let me take over and follow me to the promise land". He was involved on every play on both ends of the floor, creating chances for himself & his teammates while also playing stellar D. What a display of physicality, accuracy and perennial basketball IQ. I can\'t begin to think how people hate this man - we are witnessing greatness, people! Enjoy it while we lasts. I felt like a kid in a candy store watching this game, it might be one of my favourite games ever & I said that after watching him erupt with Kyrie in Game 5! Definitely my favourite Lebron performance ever. I can\'t wait for Game 7, I think its going to be a special one. |Bulls|40
Look up FreeDawkins on YouTube. All the highlights you want. |Thunder|1
Thanks!|Bulls|1
Reporters: What did LeBron say?\n\nCurry: Nothing\n\nLeBron: I said he\'s "nothing".|Heat|77
Steph Curry throws mouthguard at fans while being ejected. Klay walks off the court early. Can't wait to watch ESPN tomorrow.|Cavaliers|162
Don't worry, they'll change the script to talk about Ayesha instead of the trash bros |NBA|2
Stephen a will be \xf0\x9f\x94\xa5||8
Recorded First Take as soon as the game finished.|Lakers|5
Just curious but is tomorrow Skips last day? I thought the announcement said some like he'll be on until the end of the NBA season. And since Sunday is the last day of the season will he be done or is he there on Monday to recap the last game?||5
Monday will be his last day.||2
I hope they get into it. \n\nthis series took a huge swing when Dray swung, but the bigger story should be LeBron saving his best for the highest stage. I wish I could be mad, but the Warriors fell into a canyon and spent most of the game trying to get back in. \n\nHere's to Game 7. Both teams have had their moments and now we get to see who has what it takes. |Magic|32
As a relatively neutral fan I just want the game to be close.|Cavaliers Bandwagon|7
Both teams are 2-1 at home this series and both Steph and Lebron have had great games on the road. I have no idea what to expect, but I hope there's a legit crunch time. These double digit victories have been pretty brutal. |Magic|8
Lebron's gonna go for 55.||1
He can't drive then. |Magic|1
Don't understand Warriors fans saying this was rigged. We got a couple tough ones, but were mostly just outplayed by LeBron. The worst calls for us were the ones against Kevin Love. We need that guy in the game, can't have him getting in early foul trouble.|[GSW] Ronny Turiaf|154
Must have been rigged for iggy to have back problems, we all know curry has been planning a mouth guard throw since March, and I know for a fact that Harrison Barnes can start sucking on command. \n\n/s|[DAL] Dirk Nowitzki|1
Ehh, maybe on that last one|[GSW] Ronny Turiaf|2
I'm not an NBA fan, just college, but I watched tonight. What I don't understand is the NBA screen. The Cavs screen players with their hands up high and will actually impede player's progress, but it doesn't get called. Warriors usually set screens like they do in collegewith the hands down low. Is that something that just doesn't get called in the NBA?||1
Not really. Seems to me that refs are mostly looking at the player's feet.|[GSW] Ronny Turiaf|1
Hard to play tough D when you're in foul trouble and the refs are basically calling whatever they want.||2
Because Steph's defense is just so great|Clippers|9
I honestly do think his legs are still bothering him. He's never been a great defender but he's struggling to move laterally more than usual and it's really allowed the Cavs to attack him on that end. Probably why he attempted so many risky plays- what else can you do when you're a step behind?|Cavaliers|1
Thank you for not saying "rigged". It was pretty bad both ways. Cavs had a lot of bad fouls called on us earlier, and the Warriors had a lot of bad calls late. It was just evenly shitty. |East|3
No chance was it rigged, but I think it was heavily one sided. Majority of truly terrible and inconsistent refereeing was going against GSW. Not that Cavs didn't get a fair share too, just the lions share was against GSW. I mean Curry fouling out peaks a lot. And his last foul was the weakest 6th I've ever seen.\n\nBut credit to the Cavs, they still won it. They wanted it and kept a really cool head. And when you put the Warriors down by 20 in the 1st, they don't recover. ||-10
The 6th on curry was a foul they called  on Irving attempting to do the exact same thing to curry earlier in the game.  |Cavaliers|1
Funny.. I was saying the worst calls in the game were against Kevin Love... Huh thats interesting.. I guess we'll see his Game 7 performance|[CLE] Kyrie Irving|9
When was the last time a star player got his 6th foul during an NBA game, let alone in the finals?||16
Wasn't that Kevin Durant in that crazy win that the dubs had over the thunder during regular season?|Warriors Bandwagon|19
Oooooh, that game had me fuming.  Not even especially on the referees, though.  Just a frustrating sequence of events in general.|Raptors|3
I always think people that complain about calls are new to the game. The home team always looks like they're getting more calls but usually they're always the aggressor.\n\nThere was a stretch there where the Warriors looked like trash and we're lucky that curry and klay were just being themselves||7
Especially the calls on Curry. Yes they were bad, but you can't put yourself in that position. He played dumb and got hammered for it.||10
It was funny seeing him react so strongly and then on slowmo you could easily see it was a foul (apart from that steal on kyrie which maybe had a foul before the  steal)|Finland|12
Exactly I thought the Warriors were getting the benefit of the calls most of the night, with the exception of a few calls |Clippers|3
That first Q submarined Golden State. Everyone was scared and Cleveland rightfully put the pressure on Steph to play defense since he was going to be working them on the other end. \n\nThey got rattled and the rest of the game was just playing catch up. Barnes might not be the same after this series, win or lose. 2-20 in the last two games. |Magic|14
Steph deserved the MVP for the regular season, but LeBron deserves the Finals MVP, no matter who wins game 7.|Lakers|1128
Klay probably been the most consistently good player for them |Cavaliers|1
LeBron is so competitive. If he loses Game 7, good luck getting him to accept the Finals MVP. He wouldn't want to be up there accepting an award he likely would say himself he didn't deserve because Cavs didn't win. |Lakers|1
I think I'll agree with this.||1
I think Curry is a contender still he's the leading assist man for the Cavaliers while playing for the Warriors..||2
we've been through this before, finals mvp goes to the winning team\n\nlebron had better stats with a harder carry last year and still didn't win fmvp\n\nits either (insert random warriors player) or lebron|Trail Blazers|2
Remember last year when Lebron almost got it in a losing performance? No fucking way he doesn't get t in a 3-3 finals|Cavaliers|2
We said that last season too but didn't happen.|Raptors|2
Lebron is the Most Valuable Player by FAR in the finals. ||2
He deserved it last year too|Cavaliers|2
I don't want to be a prisoner of the moment but I think after this Finals, even if the Cavs lose, that I'm going to have to reconsider my feelings on Steph being better than Lebron.|Lakers|2
Shoulda won it last year too |Mavericks|3
This is a discussion I had with a coworker after game 4. His argument was basically that the MVP has to come from the winning team, otherwise by definition the best player on the losing team did not contribute enough value. IDK, obviously LBJ has had the best finals performance thru game 6, and how could you give it to anyone else!?!?!?||3
Your coworker is right. It's not about not contributing enough value, it's just very straightforward: if your team loses, you are not the most valuable player. If you don't play, your team STILL loses, so basically you had no value at all unless you win. IMPACT is a different thing. ||-2
This is a 5 game series without all of the shit he pulled off. I think Lebron has earned Finals MVP, unless Klay goes the fuck off and wins it for the Dubs.||12
Should've won it last finals also.|Cavaliers|9
Dude, Lebron deserved Finals MVPs for putting the team on his back last year when Kevin and Kyrie were out. It'd mean a lot more if the award didn't automatically go to a member of the winning team.||7
1. LeBron 2. Kyrie 3. Klay |Kings|8
I don't know. I mean I agree with you, he's obviously the best player here, but Klay's holding the Warrios afloat right now|Celtics|110
Only possible gsw choice is Klay.||1
Did I miss the part where Curry had a bad game today? |Pistons|1
The only time Klay was the best player for the Warriors they lost the game...|NBA|1
Klay was super inefficient and has been|Heat|4
What about anything he has done is inefficient? In the last 2 losses he has shot 9/21 from 3 and 30/41 from the field. Yes he has been shooting below his season marks in this finals series but that usually happens as the intensity ramps up. However, I just have stats to back it up, you probably just have reddits feelings which clearly gets hurt after every loss no matter who wins. Everyone comes back saltier than ever it's hilarious.||2
You have to watch the game to see how inefficient he is. Sure his stats are worse, but he's taking worse shots, playing much worse defense and turning the ball over more. He's been playing decent at relative to his regular season self but that isn't worthy of a FMVP. The intensity has ramped up like you said, and Lebron has put up historic numbers. Your intensity argument helps Lebron.|Heat|1
I'm not talking about the MVP, if LeBron were to lose and still get finals MVP I'd have no problem with it. I wouldn't care if they gave it to Kyrie. Honestly' if Cleveland wins give it to Barnes, finals MVP doesn't mean anything to me. I'm talking about the fact that you're calling him inefficient. You're saying poor shot selection, defense and TOs are the signs. Can I ask if you thought Kyrie was inefficient because of those same traits in game 5? They weren't the best shots down the stretch but the man was so on fire it didn't matter. He turned the ball over 4 times, which is as many times as Klay. Of course Kyrie handles the ball a lot more, but 4 TOs is a lot. And of course he doesn't always play the best defense but he has tried all series. So was his game inefficient?\n\nAlso, as someone who watched the Warriors all season, is Klay forcing more, yes. Do I think he's inefficient, no. When you shoot like Klay force it, I wished he forced more in the 4th quarter instead of giving Barnes wide open threes. Defensively, I am not seeing what you are seeing. He is guarding Kyrie, of course Kyrie is going to get his. Maybe if he was tasked with guarding JR and JR was dropping 20 or 30, then you could really say his defense was much worse.||1
All my efficiency arguments have been made of the comparison to his regular season totals. Almost every single metric is lower. I understand your intensity argument but there's also an argument to be made (in your favor) that Klay has been forced to play like a #1 option with Curry's lack of elite play/foul trouble. Relative to the rest of his team, Klay has been pretty good, however, my original argument of Klay's inconsistency was related to Lebron which I know at this point isn't fair.\n\nI understand your argument about defense and I'm actually inclined to agree. I was just a little disappointed in Klay's guarding of Kyrie since Klay is heralded as an elite defender. |Heat|2
Wow, thank you for having a relatively civil conversation on r/NBA, can we just have more of these please? Not going to lie, I came into this fired up but thank you random stranger for taking the time to write a cohesive statement. I feel more level headed now. On to game 7, I'm as nervous as ever and I still have until Sunday.||1
I was just about to compliment you on your civility as well. It's usually very hard to have any sort of discussion on here. Good luck in Game 7!|Heat|2
he was garbage the first 3 ganes|[CLE] LeBron James|12
Like who on the Warriors could you even give it to? Livingston?  I'd rather drink bleach than live in a world where Shaun fucking Livingston got a Finals MVP over the performance Lebron has put on.|Raptors|728
This might be the greatest comment of all time ||1
I would guess whoever the difference maker is in game 7 if they win?? Idk|Bulls|1
It would probably go to Klay at this point. |Hawks|1
Klay so far. It depends on what happens game 7 though. If one player had a breakout game, it could change.|Cavaliers|2
No one on the WArriors deserve it over LBJ|Raptors|2
Klay has been solid, he's getting no help though|Thunder|2
Klay Thompson for sure.|Cavaliers|2
Klay... the only one playing properly|Hawks|3
If the warriors do win I think Klay should get it. He's played really well throughout the whole playoffs, and played well throughout all the finals games too|Lakers|3
Easily Klay. He's been stepping up when Steph hasn't shown up. |[LAL] D'Angelo Russell|3
Didn't Jerry west win it once, even though the team lost? \n\nSo the precedent has already been set. Lebron should get it hands down. |New Jersey Nets|3
That's what we said last year, and LeBron had a better statline last year, albeit a higher usage rate.|[IND] George Hill|3
I think Klay would get it if they give it to a Warrior. |Raptors|3
