In my mind, Barnes will absolutely,  no doubt, get a max contract. Teams will definitely want a player that can disrupt the Warriors' offense like only he can |Pistons|1078
https://www.youtube.com/watch?v=zAvXbAJjMxM||0
rekt||-1
Only Gar pieceofcrap Forman would give him a max deal. ||1
shooting 0-8 on mostly open shots, he's not going to make a dime||2
You seem as sharp as Barnes' shooting|Pistons|3
Dan Gilbert is going to pay him max..............to stay on the Warriors.|Pistons|2
Alongside Kevin "Cleveland Kryptonite" Love.|[PHO] Steve Nash|8
Damn, not 1 point????|Lakers|3
If there is a circlejerk forming around Barnes, I am all for it.|Warriors|8
Does he have the cracker?||1
This is a quality analysis |[DAL] Dirk Nowitzki|32
No matter how much you lost betting on the Warriors the last two games, nobody lost as much money as Harrison Barnes\n|NBA|766
Nah, Harden had a terrible finals and then got paid by Houston.|Pacers|-1
LA will still max him.|Timberwolves|1
Doubt it |Lakers|1
Barnes bet 10 mill that the series would go 7||3
#MAX BENCH TIME||5
Warriors might be able to sign him for ten bucks and thirty cents. |Magic|22
I'll give you tree fiddy |[CLE] LeBron James|17
If Harrison Barnes shot Tupac he would still be alive|Spurs|725
http://i.imgur.com/RXOuoLK.jpg||-5
\xf0\x9f\x98\x82\xf0\x9f\x98\x82\xf0\x9f\x98\x82\xf0\x9f\x98\x82\xf0\x9f\x98\x82\xf0\x9f\x98\x82\xf0\x9f\x98\x82\xf0\x9f\x98\x82\xf0\x9f\x98\x82\xf0\x9f\x98\x82|Kings|0
*ROFL*||1
Nah, fairly sure Tupac's bodyguards would've shot Bares.\n\n^^^Barnes ^^^is ^^^dead ^^^to ^^^me|Cavaliers Bandwagon|1
You actually think Tupac is dead?|Braves|2
wow|Cavaliers|3
Harrison Barnes = Stormtrooper confirmed|[DET] Darko Milicic|11
TIL Harrison Barnes shot Tupac.|Spurs|14
I wrote this song a long tiiime ago|Spurs|4
Way before James dropped 41 in game 6!|Cavaliers|1
Yeah, but Cleveland hasn't played any SEC Defenses |Pistons|590
Hey. |Cavaliers|1
Yes but he has 3 quality losses so that pretty much makes him the national champion already. |Trail Blazers|1
Hahahahahhaah||3
Ah yes, the Oregon Ducks argument. |Kings|7
Oklahoma State (2011)||1
they got some quality losses early tho|Lakers|9
Seriously. The only teams they lost to are the teams that beat ~~Bama~~ Cleveland |OKC Hornets|3
SEC SPEEEEEEED||13
Isn't it obvious? They just don't have the strength of schedule like Alabama.|Mavericks|38
SEC defenses haven't faced the likes of LeBron either.|[ORL] Mario Hezonja|2
I'm from Ohio and this isn't even the right sport and I'm still mad|Cavaliers|262
UM fan and you're my mortal enemy, but I'm with u on this. ||2
At least you're not from Michigan state. |Thunder|8
DISRESPEKT \n\nI'll admit, we got raped in the CFP lol, so many lucky wins|[DET] Darko Milicic|1
Fuck state. Harbough has come and thus their demise is assured.|Cavaliers|8
I'd rather lose to MSU than -ichigan. Fuck those guys |Cavaliers|0
<3|Pistons|3
https://youtu.be/Zxsxfq1aFxo\n\n\nHere ya go man. |Cavaliers|12
Better|Cavaliers|4
Game 7 is on Father's Day... THINK OF THE NARRATIVES.|Cavaliers|1072
Lebron is so devoted to being a father, he skips game 7 to be with his kids. |Timberwolves|1
Reminds me of Jordan winning after his dad passed.  |[CHI] Derrick Rose|1
Holy shit, I forgot the 96 Bulls won on fathers day. There are narratives galore here|Bulls|1
The battle of the bastards Sunday! Also, game of thrones has a new episode. ||1
The fuccboi has a chance to prove himself|Pistons|1
BASTARDBOWL GET HYP--wait wrong sub||1
Delonte West is there with lebron a mom||1
\\- Adam Silver|Rockets|1
I'm a father of three kids and a man!!!|Hawks|1
SOMEONES GONNA DIE ON GAME OF THRONES BECAUSE YOU SAID THIS|Cavaliers|3
http://imgur.com/fL2sM7D|Lakers|3
LeBron gonna try and win one for Delonte!|[UTA] Rudy Gobert|9
Oh shit, I still haven't gotten a card for Bismack.|Suns|5
He's a father of three.|[LAC] DeAndre Jordan|4
LeBron is my father |Cavaliers|4
Dad was old enough to take me to the old dawg pound, and to see Cavs v. Jordan.\n\nI am going to be visiting up north on Sunday.  I hope we get to have a hug and probably a cry.  This would mean the world to us.\n\nCavs are going to win.|Cavaliers|7
This year for father's day, get dad what he really wants; An NBA championship.|Raptors|10
They getting the Dad Dick as Father's Day gift|NBA|11
jesus christ i never thought about how steph was born into riches with a dad and lebron came from scraps without one. |Spurs|41
THINK OF THE MEMES|Hornets|218
WILL THEY BE DANK?|Nuggets|2
Battle of the Bastards Vs. Battle of the Fathers.|Lakers|9
LeBron has 3 children!!!!!!!!!!!!!!|Clippers|610
And a man!|Spurs|0
LeBron is a man!|[NYK] Dick Bunt|0
# I AM A MAN I HAVE 3 KIDS|Rockets|1
And a man|Kings|1
And a man!|Heat|1
4 ACTUALLY https://pbs.twimg.com/media/ClIDkzIWMAAeSIy.jpg:large||1
And Kyrie isn't one of them!|Bulls|1
 #illuminati|[SAC] Oscar Robertson|2
3>2 lebron>curry|Warriors|2
3 CHILDREN 3 RINGS CONFIRMED |Cavaliers|2
BAHGAWD! THAT MAN HAS A FAMILY!|Magic|2
http://imgur.com/fL2sM7D|Lakers|9
4 now|Hawks|25
4 after that block||202
Got em|Heat|1
LOL did the camera man get knocked on his ass?|Lakers|741
Ya||-1
LeBron prob got two shots for that|Warriors|0
lol.  yep|West|0
Not even joking...I think Lebron did a stepover on him.||1
It's ok. He's not a father of 3\n\nEdit: 4*\n|[ORL] Tracy McGrady|1
Dude so funny! Lmao||1
need a gif|Cavaliers|2
Fuck, I would fall to my ass too if I was 3 feet away from Lebron|[HOU] Yao Ming|2
It looked like Lebron pushed him over, I need to rewatch it.||2
He did!! You even saw everyone walk by him in the view between his knees|Raptors Bandwagon|4
i rewinded it twice. and fuck yeah he did. this game had everything, *draymond green  losing and someone eating shit live on tv. \nedit- warriors - draymond green \n||9
Can I get a streamable?|Raptors|8
He was in LeBron's way and today no one stops LeBron |Trail Blazers|18
Loooool I saw that too. The security guard just staring at him like nothing happened.\n||111
Video?|Cavaliers Bandwagon|2
true dedication in Cleveland today|Lakers|6
"make way, The King is coming through"|Thunder|11
Giving us that Draymond Green POV|Cavaliers|7
That dude goes to the same gym as Varej\xc3\xa3o|Lakers|393
BIG BLACK DICK POV HD ||3
No one asked for your search history |[IND] Reggie Miller|22
>No one asked for your search history \n\nHaha yes. Instant burn. ||2
Upvote for using the \xc3\xa3|[DAL] Dirk Nowitzki|8
As a Brazilian I appreciate those little things||2
Seeing that Craig Sager interview almost made me tear up|Mavericks|814
Vid of it yet?|Heat|1
Was it a post game interview? I missed it. :(|[SAS] David Robinson|1
He didn't want to stop interviewing. Sad. Man. Legend and prayers ||2
I think Lebron was choking up at the end too. What a great moment, so much emotion. |Raptors|8
Anyone have a video of it? I was at bdubs|Pistons|11
Here's part of it: \nhttps://twitter.com/JimmyTraina/status/743652514608873472?s=09||38
Oh God my heart :(|Lakers|3
"How the hell did you go 30+ years without getting a finals game"||22
I had tears in my eyes when I saw the tears rolling down his face as Lebron was joking with him.||29
If you want to cry more, [someone said they know someone w/ cancer and Sager is his inspiration. Sager talked to him via FaceTime right away.](https://twitter.com/LaurenBrill5/status/743644017745924100)|Spurs|75
Wow, thats something right there.||1
And he was having an actual conversation with him, not just something typical like "best of luck to ya".. Thanks for posting. |Cavaliers|21
Me too. The man is a legend and such a genuinely good dude. The world needs more people like him. He's unique and awesome, what more could you want? ||139
Question, how come he never did finals game before?|[PHO] Steve Nash|4
Idk but LeBron seemed upset about it haha||2
[deleted]||253
Wife just finished chemo.  Skin cancer.  \n\nShe is in remission, and I have cried more in the last year than is normal for a guy like me.\n\nFUCK Cancer.|Cavaliers|14
Mother died after 8 years of cancer this April.\n\nI wish your wife all the best, man. I know how it feels.\n\nFuck cancer.|Nuggets|14
Fuck Cancer.\n\nI'm sorry about your mother.\n\nWe're lucky, our two daughters will have their mother around for a long time (hopefully).  \n\nFuck Cancer.|Cavaliers|9
My amazing Uncle just passed last week and I found out my Aunt just had double lung cancer surgery.\n\nFUCK CANCER||8
Truth|Cavaliers|6
It certainly made Craig tear up. Towards the end you can see tears strolling down his face. Props to LeBron for giving credit to the best reporter in NBA history.|Celtics|662
If anyone has a streamable that would be super appreciated |[CLE] J.R. Smith|7
Is there a link? My stream cut out right after the game, would like to see a jiffy if possible|Thunder|14
[Here](https://twitter.com/cauldronicymi/status/743652733547208704) \n\nEdit: Him also talking to somebody via FaceTime that also has cancer; said Sager was his inspiration. [Here is the link.](https://twitter.com/laurenbrill5/status/743644017745924100) \n\nCraig is honestly the best.|San Diego Clippers|50
Thanks a lot Warriors. Now we've got Game 7 up against Game of Thrones.|[BOS] Larry Bird|2044
this is gonna be the best sunday ever|Lakers|2
and its the final two episodes of GoT... I have a feeling GoT will be a better watch if LeBron is still possessed.....\n\nDubs have lost their mojo/cool ala OKC... its exact same fucking thing. |Bulls|9
You're the king of goofs if you think even LeBron possessed would turn a Warriors home game into a lopsided Cavs win. ||-5
Yeah, because that didn't happen 3 days ago. Oh wait.||8
One of their best 3 players was suspended ... you goof||1
Green wasn't suspended today was he? Or when he railed the fuck out of dubs in game 3?\n\n|Bulls|5
Damn, you're right. I forgot that the most recent game will dictate how the next one is played. Sorry games 1 and 2 -- you were too far in the past to be relevant. Draymond, don't bother suiting up. HinduHamma is predicting that you'll be ineffectual based on two games and ignoring the regular season and a 2nd team all-nba. Goddamn, I know this sub seems to hate the Warriors but the recency bias is just stupid.||-1
It's playoff time. Regular season don't mean shit right now.\n\nCurry is not even MVP in playoffs.\n\nYa green had lebrons number first two games\n\nGuess what, it's called fucking adjustments.\n\nLebron and the cavs made adjustments. \n\nGreen hasn't evident by the fact lebron has had his dick all over greens weak ass for 4 straight games.\n\nGreens for 1 fucking game left to prove he can handle lebron better than the last 4 tries... my money is on lebron.\n\n\n\n|Bulls|2
Let me get this straight...\n\nCavs made adjustments, and you think 2014 Coach of the Year Steve Kerr won't?\n\nYou think that the regular season MVP won't bounce back. And if he doesn't, you think the rest of his team won't find ways to pick up the slack?\n\n\nTheir last two games at home with a full lineup were blowouts. If you seriously think that the Cavs, with a possessed LeBron, will blowout a team that has broken the record for wins in a regular season ON THEIR OWN HOME COURT, then I was right. You are the King of Goofs. Take a seat right over there next to Ramsey Bolton as you both get egg on your face come Sunday.||0
I'll happily eat crow if your coach of the year can stop the real king|Bulls|1
And WWE MITB but that's been relegated to the phone. \n\nGame 7- tv\n\nGame of thrones- tablet\n\nWwe- phone/laptop|Warriors|5
2 out of those 3 events will leave you satisfied. |Spurs|3
I feel like there's only 1 guaranteed and thats GOT. MITB is good on paper but they could easily fuck it up. game 7 is a toss up.|Warriors|6
Even if the results don't go the way I want, I think MITB will be fantastic match wise. It generally doesn't bother if the guy I want loses as long as it's entertaining. |Nuggets|1
And Money In The Bank. \n\nSeth Rollins vs Roman Reigns will be awesome...but not this awesome.||15
MITB is my usually the PPV I look forward to the most too haha. 2011 and 2013's are two of my top ten favorite PPVs ever.\n\nLuckily I can throw the game on TV, MITB on my computer and just watch GoT after.|Nuggets|1
Dammit, idk what to watch|Pelicans|2
They should just cancel money in the bank and do it next werk|Cavaliers|6
I totally agree\n\nBut booking a venue is hard. And it's at T-Mobile center in Vegas.||2
true|Cavaliers|1
Not even Styles/Cena, and that's saying something.|Kings|8
This might be the stiffest competition WWE has ever been against on a ppv day. ||11
Has to be. They never schedule against major NFL games and this is probably the biggest NBA game in 20 years.||7
And the biggest GoT episode in it's history|Thunder|1
I'm pretty sure GoT is about 1/10th as popular as the NBA.||2
Shit.....|Mavericks|2
Up against father's day...\n\nWho am I kidding, my father left|[OKC] Russell Westbrook|9
:(|Pelicans|1
Bastard Bowl it is then! |Bulls|10
Oof. That's terrible for viewership on both sides.|Charlotte Hornets|12
Not really.  Anyone with HBO has HBO Go, it's really not a decision here.|Supersonics|1
I'm out here trying to get people to start watching Preacher and then they go and do this. |NBA|13
Great show |Raptors|5
Stephen Snow: "We must take back our home"\n\nLeBolton James: "Come and see ;)"|Bulls|43
I feel like its the other way around. Steph is Ramsey and Lebron is Jon trying to take back his crown/Winterfell|Knicks|42
They thought they killed him last year, but he's back for his throne.|[LAC] Quentin Richardson|1
Winter in Cleveland can be quite harsh|Cavaliers|1
Yeah but the names worked better. I mean, what else would it be? LeJon Snow and Stamsay Colton?|Bulls|6
We have ayesha in our dungeon, come and see|Suns|11
"For the Beach"\n\n*Wade stabs LeBron*|[MIA] Josh McRoberts|3
Oh god. Battle of Lebron vs battle of the bastards |Trail Blazers|182
Two things I feel like I have been waiting my whole life for and they're on the same night. |Cavaliers|1
LeBron vs the High Borns|Cavaliers Bandwagon|1
Battle of the battles|Thunder|1
I am so HYPED! |Warriors|3
Torrent/DVR game of thrones. Watch game and avoid Internet. Switch to GoT. Orgasm. Sleep.|[MIA] Udonis Haslem|5
Pretty sure HBO's streaming service doesn't keep track of how many people use it on one account. My entire family and our SOs just use my mom's.|Cavaliers|1
HBO GO my friend |Cavaliers|51
You need to watch GOT right when it airs and finish it in one sitting or you are going to get spoiled|Lakers|1
Implying that people can go even an hour without that shit getting spoiled||1
But I don't remember my password and am too lazy to recover password.|Mavericks|1
I'll uh you pizza if you share your account with me.|Knicks|0
HBO Now for those without the TV subscription. |Raptors|9
Or... other "illicit" means|[NYK] J.R. Smith|3
Oh shit, you're right. Bastard bowl too...\n\nI'll either be too pissed or too excited to watch it later too (read: too drunk). |Cavaliers|637
[deleted]||0
Episode is called battle of the bastards...|Thunder|3
In Australia pissed and drunk is the same thing.||1
I'm rooting for Lebron Snow.|Raptors|2
Battle of the Bastards and Battle of the Baskets|Trail Blazers|2
Oh shit same day as money in the bank.|[PHO] Steve Nash|3
>Bastard bowl too...\n\nOn Father's Day no less! Thank you Ned Stark. Thank you Roose Bolton.|Bucks|9
Need to avoid game threads b/c some trolls will post spoilers|Warriors|210
Game thread or "game" thread?|Knicks|1
Bruh. Good call. I never thought of it but now that you mention it there's almost a 100% certainty lol.|NBA|2
I hate those guys.||2
Yea I'm just avoiding the internet altogether until Mon |Hawks|4
Ooo, good looking out.|[NYK] J.R. Smith|16
forreal, thanks warriors!|Rockets|19
[Draymond Green while Lebron was going ham all game](http://i.imgur.com/3sJRoGm.gif)|Wizards|519
I didn't think he'd have a strong game 6 , but he was invisible for stretches of the game.|Rockets|3
Say "oooo"|[WAS] John Wall|15
"Draymond, you\'re going to be guarding lebron in game 7"||70
"You know what you must do."||2
Three of the five Cavs playing garbage time were significant contributors in last season's Finals. What a difference a year makes!||668
If not the record, doesn't mozgod have like a top 3 most points scored in a finals half?|Nets|0
Seriously though, I thought Delly was injured|Cavaliers|1
They're not worse, it's just that Kyrie and Love aren't injured anymore (~~although Loves playing like he is~~)\n\nedit: Forgot Love had a concussion :(|Cavaliers|250
Delly and Mozgov definitely look worse. Mo Williams should continue as the backup PG he played well tonight|Rockets|1
That's not true. Mozgov has regressed quite a bit. He never fully rebounded his game after a knee injury. |Pacers|1
Love has to still have concussion side effects|Cavaliers|1
The exception being mosgov. He is definitely significantly worse all season. Also, Delly has played a great season but is a ghost this playoff run.|Cavaliers|3
Maybe Delly will come back out if we need him to dive for Curry's ankles|Cavaliers|2
[deleted]||3
I miss his shooting. I know it's only been a few weeks since he rofl stomped the hawks, but I hope he feels better soon. Love is my favorite.||3
Mozgov is certainly worse|[CLE] Anthony Bennett|4
I mean he did have a concussion |Cavaliers|11
Oh shit I forgot, I got caught up in the memeing and now I feel bad :(|Cavaliers|4
Love had a concussion, that's still quite the injury ||105
Also lots of foul trouble tonight.|Cavaliers|2
Oh shit I forgot, I got caught up in the memeing and now I feel bad :(|Cavaliers|7
I bet he's super fatigued right now. If this were the NFL he'd still be questionable for game 7|[SAS] Tim Duncan|25
Yeah I was getting fucking furious seeing some of the comments about him as a player post the concussion. Bright lights and loud noises are fucking awful when you're concussed. No one but K Love knows what it feels like to be out there right now but I bet it's not good.|Cavaliers|1
Yeah it's just unfortunate that it's happening on this stage. Hopefully he clears up for Sunday but I can't blame him for any of this. Concussions are no joke|[SAS] Tim Duncan|1
I hope the NBA gets super pro-active about concussions. I do not think Love should have played in games 5 or 6. Concussions are scary as fuck, and as far as I know the severity was not disclosed.|[MIL] Dell Curry|5
Man I got a concussion a couple years ago, had a nasty headache afterward but it was gone the next day. Rested for a day or two.\n\nTried to do some cardio a couple days later and I puked like two minutes into it.\n\nConcussions are fucking scary shit.|[SAC] Oscar Robertson|13
And RJ is a good role player|Cavaliers|162
He's been killing it||1
RJ is such a pleasant surprise. I mean, I'm not a huge fan of the guy or anything but he's putting in some mad work in these finals. Respect to the old guy.|Heat|2
sigh...|Spurs|2
RJ is like the fourth most important player o_o||58
Second this. I reckon he'd have some good words in huddles and the locker room too. Knowing there's a dude with a cool head on your team like that is always a bonus.\n||1
Idk Barnes might be the 4th most important player for the cavs right now.|Timberwolves|4
5th, behind JR|Celtics|21
RJ is behind JR. |Raptors|18
RJJRRJJRRJJR|Celtics|6
RIP cameraman |Thunder|96
Lmao. They were all like :o|Wizards|2
Link to vid or gif?|Celtics|3
Gif?|Celtics|2
another no call||8
HARRISON BARNES WAS **GARBAGE**\n\n|[CHI] Scottie Pippen|709
If Harrison Barnes shot Tupac he would still be alive|Spurs|1
Harrison "not Tristan" Barnes|Cavaliers|1
His release at the top of his follow through has changed the past 3 games |Raptors|1
https://www.youtube.com/watch?v=aoMmbUmKN0E\n\n**GARBAGE**|Suns|2
And absolutely no one was surprised |Warriors|4
Good to have you back /u/rabsho|Cavaliers|3
barnes is getting paid by Cleveland at this point. what the fuck.|Bulls|6
Yet he'll still get a max contract. |[OKC] Nick Collison|11
I'm not sure teams are dumb enough to give max contracts to roleplayers...\n\nWell, the Thunder are.\n\nBut not most teams.|Jazz|-3
[k](http://l1.yimg.com/bt/api/res/1.2/q2hYoQCgOTEosgFv6Rw_yA--/YXBwaWQ9eW5ld3NfbGVnbztpbD1wbGFuZTtxPTc1O3c9NjAw/http://media.zenfs.com/en/person/Ysports/tristan-thompson-basketball-headshot-photo.jpg)|[CHI] Luol Deng|8
How is this valid? He's been a monster this series. |Cavaliers|1
He's proven himself as a rebounder and a defender in this series. The announcers called him elite at a couple of points.|Cavaliers|2
>He's proven himself as a rebounder and a defender\n\nSounds like a role player to me \n\n|[CHI] Luol Deng|5
Dennis Rodman was a role player too and you can bet an in prime Rodman would get $16M+ a year today.|[ORL] Mario Hezonja|1
I never said role players  shouldn't get paid, I was just replying to the cavs fan (or bandwagoner) who said teams would be dumb to give them the max when the team they're supporting famously did so this year|[CHI] Luol Deng|1
Thompson didn't get the max though. If you recall, he was holding out for $94M, he got $82M.|[ORL] Mario Hezonja|1
He has been paid exactly what he was needed for this series. If we don't have him I doubt we win. He;s the only big that can do PnR and still guard well. If he can't do that we're fucked.|Cavaliers|3
I dunno. He still has never been able to demonstrate consistent performance. That's always been his knock, that he's hot one day and literally worthless the next.\n\nThis series is just going to solidify that and leave that idea real fucking fresh in the minds of GMs. He'll probably get it, but I don't think it's a guarantee anymore. ||12
He'll probably get fewer offers, but at least one team will.|[NYK] J.R. Smith|3
This. \n\nIf all he wants is to go to the highest bidder, then it only takes one dumb team to offer him the max. |Spurs|2
http://imgur.com/TE4aMD6\n\nSomeone fucked with his wikipedia||16
Not there anymore||2
MAX CONTRACT TIME|Cavaliers|167
I heard the Knick were lookin'|Cavaliers|5
Please don't be us who gives it to him. #AnyonebutBarnes|[ORL] Mario Hezonja|1
The game felt over at 6-0 in the first.|Wizards|1017
Plz stop fouling love let him stay on the court he wins us the game :-(|Warriors|1
Hahaha.You're obviously not from Cleveland.|Cavaliers|1
It felt over at two fouls on Curry.|Thunder|1
I knew it was going to be a "Down by 20 at half, cut it to single digits at the end of the third, get LeBron\'ed in the 4th" game the second we lost Game 5. This HAD to go seven games. One single game to determine "Golden State caps the greatest season ever as LeBron comes up short again" or "LeBron delivers a title to Cleveland as the 73 win Warriors choke a 3-1 lead." No matter what happens, the outcome of this one game is going to be talked about for decades. |Warriors|2
When Kyrie answered the first Warriors points with that 3 I felt like it was over.|Mavericks|2
Thanks Harrison "Kevin love" barnes|[DET] Ben Wallace|3
As a Warriors fan with other buddies, all who are die hard Dubs fans, we all felt this way. The crowd at quickenloans was so punped after LeBron scored to go up 6-0.|NBA|7
Flair up|Cavaliers|-1
What were they after lebron about?||1
Game was sealed by the end of Q1|Knicks|6
It felt like that for a while, at the end of the 3rd when the Cavs were throwing three's up, I expected a GS run. ||11
well when they cut it to a 7 point lead I was expecting something more but never felt like the Dubs could do it||5
we just came out lookling like we didnt want to win this one. fucking disgraceful effort|[GSW] Andrew Bogut|12
ohh i gauran-fuckin-tee your boys wanted to win||7
I'm a cavs fan, but I think Golden State looked even worse at the end of the game. The look on their faces wouldn't lead me to think they will go into game 7 with any confidence at all. ||10
feels bad man|[GSW] Andrew Bogut|3
I'm hoping for a more competitive game with lead changes at least a few times. ||1
warriors will be okay|Cavaliers Bandwagon|3
Game was over when Kevin Love got benched for foul trouble.|Thunder|1749
While it's cool to have on Love right now I really hate what the Cavs and LeBron have done to him. Love was a super star player in Minny, and I think he still can be. They don't use him the way he played in Minny. I love LeBron, still want to see him win this ring, but he turned Love into scapegoat and I hate him for that. |Lakers|-1
Hiw did lebron turn k-love into a scapegoat lmao? He's done nothing but try and empower him this year. It's everyone else who's criticizing him, sometimes unfairly.||2
Yeah. I wanted Love to get T-ed up so bad when he was arguing his bs foul. I hope he gets suspended for game 7.||0
MVP comment |Nuggets|0
So true|Knicks|1
The refs are doing God's work.||3
Ha, I told my SO that was probably good for the Cavs|Spurs|6
Refs rigged the game and helped Cavs by calling that BS 3rd foul on Kevin love|Lakers|50
Steve Kerr gonna suspend Draymond for Game 7 for drawing the foul on Love |[NYK] J.R. Smith|13
That's what I told my dad in the first half. Shumpert was trying his best in the first half to keep Golden State in it.||35
Seriously. Shumpert plays like such a dumbass |[CLE] LeBron James|9
I think when the trade happened the Cavs wanted Shumpert and the Knicks forced them to take J.R. with him. Weird how things worked out. |Knicks|13
Even last year... Honored Shump with a respectable contract and locked him up but JR we risked him walking. JRs so invaluable this year its incredible. |Cavaliers|8
i felt bad for love he had a nice block to open the game and got to the line a couple times and a few nice box outs for rebounds then he has to send his ass to the bench for 12 minutes|Trail Blazers|175
Yeah kev came out strong. I think he was about to have a good game||12
Except when he got benched for his 3rd foul his statline was 1 pt 3 fouls in 2 minutes...|Trail Blazers|1
Don't forget his 3|Cavaliers|16
LeBron brought Craig Sager to tears, what a moment.|Cavaliers|247
