GUYS GUYS, TYRONN LUE TOTALLY GOT OUTCLASSED TODAY. WHAT AN ERROR BY MADE BY CAVS MANAGEMENT. THE FINALS ENDED WITH OKC! EASTERN CONFERENCE IS A JOKE! AMIRIGHT GUYS? |Wizards|2
Ain't gonna lie. Kinda got a chubby as a draymond hater|Supersonics|2
LeBron happy to fulfill your Draymond hating fantasies |[CLE] Matthew Dellavedova|1
[THE SALT IS REAL](http://imgur.com/XGL7tqV)|NBA|2
Yes! Yes! Yes! Yes! Yes! [Yes!](http://youtu.be/esCvMOMAFf0)|76ers|2
LOL the camera guy just fell|Knicks|2
LOL the camera guy just fell on his ass||2
That camera man that just fell backwards while he had the main shot |Bulls|2
I saw that too, lol!||1
Camera man got knocked the fuck out.. LEBRON!!!!||2
Lol camera man fell at the end of the interview |Hornets|2
man down cameraman |Celtics|2
Lebron should be Finals MVP, no matter who wins.|Lakers|2
Cameraman taking the charge like a champ. |Bulls|2
Damn, this series has been blowout after blowout but game 7 is gonna be one hell of a game to watch||2
Video game James||2
The return of the king. It was his best performance since the 13 conference finals elimination game in Boston.||2
Shout out to the cameraman who fell and still kept the shot.||2
yeah that was some talent\n|Heat|1
Lmaoo fr||1
We love you, Sager!|Bulls|2
Note to self: ABSOLUTELY DO NOT PISS OFF LEBRON JAMES|Thunder|2
Lol that cameraman passed the fuck out from excitement ||2
I'm personally confused about people being upset with the refs. I understand the refs were widely inconsistent but the Warriors weren't so hot either. \nWhatever game seven should be fun. |Knicks|2
Anybody else see that cameraman get knocked down at the end? Lol||2
Fuck Harrison Barnes |Warriors|2
I love it when LeBron goes into full "Fuck you" mode. |Spurs|2
Curry's contract with the devil expired. rofl|[MIA] Dwyane Wade|2
Can Barnes win the FMVP for the Cavs?|Warriors|2
He was so bad tonight. I was screaming at Kerr to take him out in the first half. Idk what they should do if Andre is as hurt in game 7 as he was tonight. |[ATL] Kent Bazemore|2
I agree.\n\nGotta play Barbosa.\n\nHe has his limits, but Barnes has gone off the reservation.|Warriors|1
Defensively Barnes has been average with a few bad mismatches especially against LeBron. But Barbosa can score and actually play offense and maybe guard JR or Shumpert. I wouldn't be surprised to see a Curry, Thompson, Barbosa, Green, and useless center lineup. |[ATL] Kent Bazemore|1
I blame Steph's new shoes |Bulls|2
Bron = GOAT|[DET] Rasheed Wallace|2
I'm so happy I started watching basketball this year. I love this game.||2
The stories have been great but wow hopefully Game 7 can give you an actually close game all the way through the 4th quarter! This whole playoffs has just been blowouts! |Rockets|1
cleveland has to be careful. this isnt over yet, celebrate too much and you get hit in the face. i remember when the badgers beat kentucky to end their undefeated streak and we celebrated like we won the 'ship. then got beat by fuckin duke. celebrate for a little, but then back to work|Bucks|2
Fuck Fuck Fuck!!!!! We were 3 and 1. Fuuck!!|Warriors|2
 I've often cheered against LBJ but I really hope he gets this one. Cleveland deserves it. |Knicks|2
LET'S GIVE TRISTAN THOMPSON ANOTHER 80 MILLION!|[MIN] Kevin Garnett|2
This just in: Kevin Love a healthy scratch for game 7 ||2
Draymond sure made sure lebron wasn't going to go for 41 again...|Trail Blazers|2
I was so wrong about Lebron. |Rockets|2
[Every Cavs fan tonight](https://streamable.com/lox3)|Raptors|2
Lebron made Stephen and his sidekick so mad, they upped and quit. ||2
Haslam got suspended for throwing his mouthpiece like that, got him suspended for a playoff game. \n\nNow that won't happen, won't even get looked at by the league office. |Wizards|2
# #getsagertogame7|[CLE] Martynas Andriuskevicius|2
Never seen Curry lose his cool like that|Knicks|2
Kevin Love is undefeated in finals game within 48 hours of Richard Jefferson referencing Lil Kev in an article on the Players Tribune|Knicks|2
LeBron bringing a single NBA championship to Cleveland would make him the GOAT.  What other player could have done that.||2
Impossible to answer, but the GOAT? Nah, at least not yet.||1
I love the sweat taste of salt in the evening|[MIN] Andrew Wiggins|2
holy fuck stephen A smith is on drugs or something||2
[GAAAAAAME SEVEEEEEEEN!!! NOOOOTHING EASY!](https://youtu.be/eQ70BkPkANM)|Kings|2
I WAS ALIVE TO WATCH LEBRON JAMES PLAY||2
Does anyone really think that LeBron James, Father of three, will lose on Father's Day? You have another thing coming.|Celtics|2
Witness. |[MIA] Dwyane Wade|2
Even the other panelists seem sick of Stephen A||2
It's a goddam crime we don't get Inside the NBA after this game. That should have been a package deal with Craig.|Lakers|1
If steph threw his mouthguard at me I'm putting it in||2
http://imgur.com/Y87fs1g|Bulls|2
https://twitter.com/riderslikk/status/743652870994681856\n\nlmao|[LAL] Kobe Bryant|2
LeBron just dad dicked the Warriors. This dude wants another ring!||2
Cavs strategy for Sunday should be to get Kevin Love in foul trouble early.|Mavericks|2
Did anyone else catch the cameraman fall over?!|Celtics|2
The Greatest Shooter Ever? http://i.imgur.com/44CFREv.jpg ||2
I admittedly haven't watched THAT much basketball in my life, but that was the best performance I have personally ever watched by Lebron. ||2
[Some people have no chill](http://imgur.com/vmywnG8)|Heat|2
Till one day, that lion gets up and tears the shit into everybody \n\nhttps://twitter.com/ZachLeeTV/status/743360420438630400||2
Lebron showing why he didn\'t agree with the fact that Curry was the "Undisputed MVP"|[CHI] Jimmy Butler|2
Draymond made a difference, all right.\n\nA 1 point difference.|[CLE] Kyrie Irving|2
Sunday night there is Game 7, Bastardbowl on GoT and Money In The Bank. How the hell am I supposed to do||2
DVR||1
Ambrose better go over|[CLE] Kyrie Irving|1
Curry was ejected so he wouldn't be suspended for game 7.|Charlotte Hornets|2
Lol refs only wanted to throw game 6, not game 7||1
He hit a fan with his mouth guard.  Regular season that would definitely be a 1 game suspension.  |Charlotte Hornets|2
Yeah that mouth piece is a collectors item!  Seriously thou,  game 7 without league MVP would never happen.  Refs were picking on him all night.  It should have been a lot closer score-wise.||1
I NEED MORE MEMES|Charlotte Hornets|2
The MVP chants were the greatest thing.|[CLE] Kyrie Irving|2
Ayesha Curry's tweet / source\n\nhttp://i.imgur.com/TErN0zP.jpg\n|Cavaliers|2
Haha. |Cavaliers|1
Lebron will go for 45+,  12 bounds and 5 stls in Game 7. Cleveland will win by 5-10.||2
Come on Cleveland!!!!.||2
The officiating in this game was... suspect|[BOS] Rajon Rondo|2
Lebron with 1 TO. Amazing. |Thunder|2
Literally 1 more turnover and he breaks the all-time record for playoff turnovers. Clutch performance|Cavaliers|1
Can't help but wonder what would've happened last year if Lebron had Love and Kyrie with him.||2
[MFW GAME SEVEN](https://i.imgur.com/ydz5uSW.jpg)|Raptors|2
Why did Love only play 11 minutes? ||2
Did you watch those 11 minutes?|Cavaliers|1
Haha fair enough. ||1
LeBron deserves MVP even if they lose. WHO the fuck deserves mvp on golden state now?|Thunder|2
Iggy looked so uncomfortable tonight. If he's hurt, that is trouble. With Bogut gone, GS has no one that can stop LeBron inside or out. That is a massive advantage, and now he has two games with confidence in his jumper. If the Cavs win, LeBron is pretty much going to ascended to a higher plane. ||2
This game was lost in the first quarter ||2
What I've learned from this sub is that no matter who the star on your team is, whether it's LeBron or Curry, no one thinks their guy gets star treatment, and are disgusted everyone else does.|Cavaliers|2
Jesus, what a Dad Dick Display|Mavs|2
God damn I swear you guys just have all these links just waiting for the post game.\n\nNot complaining tho|Cavaliers|2
Mr Multiple Sources with a great question about why would make LeBron play point. |Raptors|2
"why would you go to LeBron - don\'t you know he\'s an old busted piece of junk?"|Heat|1
On the one hand, it's a seven game series, that's exciting.  Yet, not one game has been close.  Very strange.|Bulls|2
Roger Goodell has just fined ayesha curry|Rockets|2
I came here to see some dank memes and crying Jordans. Where the hell is crying Ayesha???||2
Game 7 is amazing, BUT..... It's the last game of the season. It's gonna be a LONG summer guys.|[MIA] Dwyane Wade|2
Honestly, what is up with all these blowouts? Would be a boring as fuck series so far if not for LeBron.|Toronto Huskies|2
On ESPN they said Ayesha Curry posted a tweet saying how the NBA is fixed, but she must have deleted it? ||2
Yeah she did delete it. After saying she wouldn't be silent.|Spurs|2
[deleted]||2
"I won\'t be silent" and then she deletes her tweet.|Spurs|1
CLEARLY THE NBA JUST WANTS LEBRON TO WIN SO THAT SPACE JAM 2 COULD HAVE A GOOD ENDING. THEY NEED THE REAL WORLD STORY LIKE MJ'S RETURN FROM RETIREMENT IN THE FIRST MOVIE.|West|2
It baffles me that Harrison Barnes still gets minutes. ||2
I wish that mouthpiece got lodged in Ken Mauer's Pat Riley hair... the league couldn't ignore that one could they?|Heat|2
Wow Kevin Love with just 12 minutes|Knicks|2
Warriors didn't show up in the first and they were playing catch up the entire night. Given how close it got for 3 quarters, this would have been different. \n\nSteph, Klay, and Draymond all need to find that hunger again, or they end up choking the best record the NBA has ever seen, losing at home, and making Lebron an even bigger superstar |Bulls|2
Man, losing in the finals must always suck but THIS one is going to be the biggest fucking heartbreak for either team. After their amazing season and comeback against OKC, to blow a 3-1 lead and lose at home must be the most disapointing ever. \n\nOn the other hand, if the Cavs lose after their improved season and again comeback from 3-1, it would be yet again just close for Lebron. \n\nOh well, someone must lose... lets just hope the best game of the finals is game 7||2
Lebron has proven he shows up come elimination time. I had a feeling after game 4 he was not going down easy. I think the Warriors are underdogs at this point funny to say. Love how the tables have turned now, now they choked a 3-1 lead to game 7.|Thunder|1
Red Wedding All Over again|[GSW] Marreese Speights|1
Bill Russell just wants someone to win already so he can go back home to his life of tranquility. |Lakers|2
Do I want Cleveland to win? Hell yeah, but I just can't see them winning in game 7 in Golden State.\n*Fuck I love being wrong.||2
Lebron James should win FMVP win or lose|Vancouver Grizzlies|2
That'd be absurd. Imagine him having to go up and get the award in the middle of Golden State celebrating a win (if they do). It'd be utterly ridiculous, i'd feel terrible for him if that happened. FMVP requires your team to win, a player on the losing team should never win it. ||2
Jerry West did it in 69.\n\n"West averaged 38 points during the series and had a triple double in Game 7 (42 points, 13 rebounds, 12 assists). West was named Finals MVP, making him the only Finals MVP from a losing team. This was the first year of the award."|Vancouver Grizzlies|1
I think lebron should win mvp regardless if the Warriors win\n|Raptors|2
He should of won it last year too||2
DAVID BLATT AND DAVID STERN DIED FOR THIS|Nets|2
https://www.instagram.com/p/BGvcurHvYYI/||2
Is there a site where I can watch the post game pressers?|Cavaliers Bandwagon|2
Espn|Cavaliers|2
Sweet Jesus Sunday is gonna be cray folks|Bucks|2
Sorry I only watched the 2nd half, but where did love go?|Lakers|2
Foul trouble.|Cavaliers|1
Foul trouble early|Cavaliers|1
Kerr: "I\'m confident because we\'re the best basketball team in the world"|Heat|2
Steve Kerr about to get fined 100k+|Kings|2
Harrison Barnes completely threw the first quarter. Almost all of his shots were open and he missed them.||2
Jones and Mo Williams were better than Shumpert tonight.|[CLE] Kyrie Irving|2
hahaha, Kerr should tag out and let Luke Walton coach the final game|Heat|2
here's hoping someone tells harrison barnes to go to the fuckin' basket in game 7. stop shooting threes and dunk the ball.|Bulls|2
I know this isn't really relevant, but I just noticed that if you google 'the last time cleveland won', you get the wiki pedia page for 'drought'||2
Barnes will still get 120 million from Lakers. Here's a scene at the Lakers Offices right now:\n\nJim Buss: Hey Mitch, we can't kid ourselves, we're not getting Durant. Hell, we don't have a shot at Beal or DeRozan.\n\nKupchak: Well Jim, what do you want me to do? We luckily have Brandon Ingram coming in, so we have a nice youth foundation. We should save up for next year and hope our young core impresses.\n\nBuss: Nah. I can't wait a year. Let's throw money at Barnes. He's young and a core member of the Warriors.\n\nKupchak: Jim, have you seen him in the finals? He can't be our guy if he plays like that on the biggest stage.\n\nBuss: I Don't care! If we don't win now, Jeanie will run me out of town. I'll be back to sitting on the couch and eating ice cream. The last thing I want is watching my sister do better than me while I watch it all on the TV in despair.|Knicks|2
I want Tristan Thompson to be a man and marry me and have three children with me. |Cavaliers|2
Anyone able to find a gif of the Haslem mouthpiece throw?|Knicks|2
Kevin love is still undefeated in a playoff game in Ohio!||2
Harrison Barnes went 0-8? /u/bootum do yo thing|Cavaliers|2
Oh man the meltdown is right around the corner. I can taste it. Cavs have to be the favorites even if fivethirtyeight says otherwise.||2
Hey where's that guy that hates Harrison Barnes.  I need his opinion.|Lakers|2
#FUCK HARRISON BARNES|Warriors|2
I'm simply in awe right now |Celtics|2
lol, Lue acted like there was a sniper when Curry threw the mouthguard|Heat|2
Kevin love is an extremely rich man's Scola.|Vancouver Grizzlies|2
I love that the Warriors have turned full heel. Even Vince Mcmahon is jealous he didn\xe2\x80\x99t think of these storylines first|Timberwolves|2
Did anyone else see the camera man fall on his ass while backing down the tunnel? I need a video|[OKC] Russell Westbrook|2
*Curry with that Dad sweater to match those shoes*|Bulls|2
kyrie lookin like a lumberjack|Rockets|2
GSW better go insane at home or Love might actually win a ring.|Heat|2
Please, Basketball Gods, Please let Game 7 be a bucket-for-bucket game with like a million lead changes. That would be so much fun to watch!|Bulls|2
Wonder why Frye hasn't gotten any minutes lately.  He's not hurt, is he?|Grizzlies|2
He had one play where he left Curry open to double up on Iguodala.  I think that sums it up.|Warriors|2
Abused defensively and can't get open offensively|Cavaliers|5
BATTLE OF THE BASTARDS & BATTLE OF THE LANDS. GET HYPED!|Warriors|2
\xf0\x9f\x98\xad\xf0\x9f\x98\xad\xf0\x9f\x98\xad|Cavaliers|2
These finals have reached the point where I have no idea what to expect in game seven. Both teams have been hot and cold. Hopefully it is a close one, but the one thing that has been consistent is the blow out :/|Spurs|2
Even though the Cavs were up by 20 during the first quarter, it felt like the Warriors had a legitimate chance to crawl back and steal it. Game 7 is going to be insane.|Cavaliers|2
I think this Game 7 comes down to who is healthier between Irving and Iguodola.  Both had injuries in that Game 6 that REALLY hampered their play down the stretch.  \n\nI also think Kevin Love is going to finally need to score around 15-20 points in a game for Cleveland.  I can't believe how useless he's been in this series.  This is a guy who averaged 26 and 12 just 2 years ago, and at age 27 should still be in his prime.  This series he's only average 7 and 4.5.  On the road in a Game 7, he's going to have to be much more impactful. |Grizzlies|2
Where can I see the actual mouthpiece hitting the fan?. \n\nAlso why does no one ever post  game interviews? |Lakers|2
Have you heard of YouTube ||1
No, why would I 'tube'?||1
As a heat fan, I would like to see Lebron fulfill his promise, but mostly to see the city of Cleveland win at least one fucking championship. If that happens, then I wish to see the cubs win a world series. ||2
And if the Cavs don't win, fuck the Cubs too right?|[BOS] Tony Delk|1
And then the Bills a Super Bowl... right?!|Cavaliers|1
As a marlins fan, I have no other choice but to root for the cubs on the side. ||1
I've watched the fouls on Steph again (unfortunately I haven't found a videos with up close replays) and I have to say that you can give all fouls, except foul 5 on which the strip was clean, but maybe there was some illegal contact beforehand. With that being said, Curry certainly didn't get the benefit of the doubt on a few of them (4th and 6th, 5th if it was a foul at all). However, he has to play smarter than that, especially on #4 (don't try to win the rebound against Love) and and #6  (why would you reach in there, makes no sense).|[CLE] LeBron James|2
He kept reaching right in front of the ref.. The last one might not have been too bad.. although he did come across his body when he got the ball.. But the ref has been watching him reach.. That's bad dumb defense by steph in the situation he's in||1
this series showed us how classless gsw team is with their players, coach and even family members.. \n  \njust look at spurs, the way popovich and ginobili answered those questions after they are killed by refs..|Thunder|5
Kerr complaining about fouls again like a bitch|Cavaliers|6
Apparently it comes from the top down. Trickle-Down bitching.|Cavaliers|5
I loved watching the Warriors all season, but their sense of entitlement is ridiculous. It is hard not to root for the Cavs to beat them on their home court at this point.|Suns|5
All the good players went to the west just so they didn't have to play against LeBron James year in and year out.|Cavaliers|5
If Lebron pulls this off, it\'s likely the second greatest sports moment besides "The Miracle on Ice". And consider the events since 2003 with it all coming full circle. My goodness I can\'t fathom it honestly. If he wins Sunday, he\'s second on my list to MJ. |Knicks|4
I'm not sure about that.  I don't think it even breaks top 5 or 10 but in terms of current events, I think it ranks pretty closely behind the 07 Giants taking down the Patriots - and keep in mind, that Giants team didn't have a 'LeBron' either.|Bulls|6
Yeah maybe top 5? I mean yeah I was thinking of the 07 Giants/Pats and the Red Sox coming back from 3-0 down also as possible greater moments but to do this against a 73-9 team for his hometown? But I am probably getting ahead of myself. I mean MJ's last 48 mins with the Bulls is tough to beat too.....Or anything MJ did in retrospect.|Knicks|2
You know, you're right.  I've never been a big LBJ fan so maybe I'm letting that color my perspective on this - as well as the fact that I'm starting to think the Warriors are sort of a Nash/Suns 2.0 that managed to do what those Suns teams never did last year because of the injuries to the teams they faced.  That said, coming back from 3-1 down against the best single-season team in NBA history and winning a game 7 in their house where they're damn near unbeatable would easily be a top 5 model moment and maybe a top 10 all time moment.|Bulls|1
Yeah Boston 04 and miracle on ice definitely have it beat no question. I'd say this over giants pats just because of the history behind this year. That super bowl was more or less just about that one season. |Celtics|1
Paging /u/bootum\n\nI think you're already at work on the sequel to [Barnes-O-Mac](https://www.youtube.com/watch?v=LgqmCpQkQkk): 0 for fucking 8 with 0 points.\n\nAlso, I'm eating the biggest fucking plate of crow regarding Tristan Thompson. Sorry for clowning on you beginning of the season after getting a huge ass contract. No hard feelings bruh.|[ATL] Pete Maravich|6
Aw LeBron your giving me feels talking to Craig Sager|Heat|5
GSW suffered the most from it, but let's not act like CLE didn't have players in foul trouble. The refs called it tight the ENTIRE game. Even in a previous game Van Gundy was talking about how the calls have to be consistent so players know what the tone is. They called it wire to wire very strictly. \n\n*EDIT* I would add that this might have even helped the Cavs because Love stayed on the bench. And it hurts me to say that.|Cavaliers|4
Nah man NBA is clearly rigged, get that logic out of here.|Cavaliers|0
one bad call and the nba is rigged stfu ayesha|NBA|5
KERR "CURRY GOT CALLED FOR A LEBRON FLOP" BOIIIIIIII|[SAS] Tim Duncan|4
this just in...Steve Kerr fined tomorrow for his comments on the officiating|Cavaliers|4
So Warriors fans if y\'all win game 7 which is likely is the NBA still "rigged"?|Mavericks|4
I just want an exciting game.  Is that too much to ask?|Lakers|3
That was exciting. Tf u talkin bout\n\nI never downvote another Lakers fan but cmon|[LAL] Smush Parker|1
This game was exciting for us Cleveland fans.|[CLE] Kyrie Irving|1
Has there ever been a series that went to 7 yet none of the games were decided by single digits?|Lakers|1
great game by big game james. Iffy calls on Curry. Game 7 is anyone's to take. Barnes has one last chance for the max.|Lakers|3
God no, he should never take a shot again for the rest of the series. Fuck him|Warriors|1
LePolitician response in the Sager interview|OKC Hornets|3
Man I like LeBron so much. I really hope Cavs win G7. |Cavaliers Bandwagon|4
ROFL who saw that camera man fall over |Heat|1
Everything LeBron dreamt of is at his feet. If he can shoulder the incredible load one final time, he will lie exhausted in fields of Valhalla.|Heat|3
Steph finally snaps, and [Ayesha is FED UP](http://i.imgur.com/MpN70za.png)\n\nGame 7 will be, as the kids these days say, "LIT AF"||4
REMEMBER WHEN WE WERE ALL THEORY CRAFTING NEW WAYS TO STRUCTURE THE PLAYOFFS CAUSE WE THOUGHT THIS WAS JUST SO UNFAIR\n\nfuck you r/nba|Bucks|3
Can't wait to tell my future children about Lebron|Hawks|2
What a game. Fucking Lebron I fucking knew you had that savagery in you. Fuck the haters calling you Lechoke. Game 7 oh man. My friend is looking like a dumbass betting me Warriors would sweep or end it in 5. Don't disrespect Lebron and Kyrie like that man. Fuck the odds do it Lebron. Avenge us.|[OKC] Russell Westbrook|4
I don't even watch basketball, but I've got money on the Cavs!!! Let's go\n1||4
ESPN just said Curry's mouth guard slipped out of his hand when it hit that fan lmfao. Could they slob on this guys knob any harder?!|Spurs|3
Hey guys I think LeBron had a good game|Timberwolves|2
I thought I this was Curry's world and I was just living in it...Obviously not|Clippers|3
It's Ayesha's twitter and we're all following it|Spurs|1
Over under on how many more times Kerr says "MVP of the league"?||5
Kerr really putting it all out there. He's gonna pay his fine and get those calls back in his favor|[OKC] Kevin Durant|3
people go into this season saying the Cavs big 3 is Lebron, Irving and Love. TBH at this point it's Lebron, Kyrie and Thompson|Kings|3
No smarmy jokes Steve? No witty nonsense replies?|Heat|5
Bernie Sanders doing post game questions now?|[GSW] Andrew Bogut|4
Cavs got the benefit of timely whistles but LeBron showed that he is still the best player in the NBA . When everyone was playing there hardest he shined the brightest . ||4
The aggressor usually gets those calls. The team trying to come back and constantly reaching in gets fouls called on them.||1
The Cavs were the aggressors because Golden State got into early foul trouble ||2
GUYS\n http://espn.go.com/nba/story/_/id/87...hpiece-referee\n\nToronto forward Amir Johnson was suspended for one game without pay by the NBA on Tuesday for throwing his mouthpiece at a referee in the Raptors' loss at Portland on Monday night. \nWILL WE SEE A DOUBLE STANDARD OR ARE THESE NOT THE SAME?||4
\n\n> throwing his mouthpiece at a referee \n|[DET] Andre Drummond|1
Did you ask Curry who he was aiming for? ||0
http://i.imgur.com/CSPB7wT.jpg|Thunder|2
somebody posted an article of haslem getting the same suspension in the playoffs for same thing. Seems like 1 game is the precedent.|Magic|3
I see the narrative has been switched to pro-Cavs. Damn you guys are quick. |Lakers|3
You're talking to a bunch of 15 year olds. What do you expect. ||5
hahaha seriously|Warriors|-1
Yeah you have a point. |Lakers|0
Maybe calling Lebron a crybaby was a bad idea.. |[DAL] Steve Nash|3
I told the warriors, don't call the King a bitch.\n\nthey didn't listen.\n\noh well|Cavaliers|3
hahaha, someone shopped Jordan's crying face on Steph's mouthpiece|Heat|4
[deleted]||1
I only saw it on NBA.com's post-game conference coverage - i'm sure it'll pop up on reddit|Heat|1
DAMAGE CONTROL\n\nhttp://i.imgur.com/7BQYnKg.png||3
Whoa I missed her Initial tweet what's she say|Spurs|1
https://twitter.com/ABC/status/743660304085749760/photo/1 its on abc news,lmao||1
If a 6\'7" Draymond Green is your team\'s best rim protector, you\'re gonna have a bad time|Cavaliers|2
I WAS ALIVE WHEN LEBRON JAMES PLAYED IN THE NBA.|Pistons|1
Riley Curry: My daddy is a bitch!|Heat|3
Warriors went on 3 separate 9-0 runs in this game. Cavs answered every time. |Cavaliers|1
How the hell is the SF chronicle gonna ask steph what LeBron said to him after he blocked his shot?? Lol that's his home reporter!|Kings|3
Warriors:  Draymond would have won us that game!\n\nLeBron James:  *Dad dick incoming*|Cavaliers|5
Remember when Draymond says if he plays game 5 they win??? 40 minutes and 8 points... |NBA|5
I got flamed and down votes at game 2 when I said Cavs win in 7.. there's still hope.||3
